,question,answer,contexts,embedding_model,chunk_size,chunk_overlap,sim_top_k,sys_prompt,Answer Relevancy,Faithfulness,Answer Semantics Similarity,Context Relevancy
0,What is the instructor's name for this course?,"The instructor's name for the course ""Introduction to Computational Natural Language Processing"" is Hamidreza Mahyar. 

Source: NLP Winter 2024 Course Outline","['file name: NLP Winter 2024 Course Outline. Course Outline 1. COURSE INFORMATION Session Offered Winter 2024 Course Name Introduction to Computational Natural Language Processing Course Code SEP 775 Date s and Time s of lectures Lectures In person Wednesday 3 30 pm 6 30 pm Program Name System and Technology Calendar Description This graduate course introduces fundamental concepts in computational natural language processing NLP and their applications to teaching students how to deal with textual data in Artificial Intelligence. This course demonstrates how machines can learn different tasks in natural language such as language modeling text generation machine translation and language understanding. In this regard we go over the most promising methods in this literature and the most recent state of the art techniques. Moreover this course explores different real world applications of NLP and helps students get hands on experience in this field. Instructor Hamidreza Mahyar E Mail mahyarh@mcmaster.ca Office Hours upon request 2. COURSE SPECIFICS Course Description This course covers some fundamental concepts in natural language processing NLP and how they apply in real world use cases. Instruction Type Code Type Hours per term C Classroom instruction 39 L Laboratory workshop or fieldwork T Tutorial DE Distance education Total Hours 39 Resources ISBN Textbook Title Edition Author Publisher Natural Language Processing Jacob Eisenstein Speech and Language Processing Dan Jurafsky and James H. Martin Deep Learning Ian Goodfellow Yoshua Bengio and Aaron Courville Prerequisite s Proficiency in Python programming language Some Machine Learning and or Deep Learning knowledge is a plus Corequisite s Antirequisite s Course Specific Policies All work must be shown to get full credit. Specific policy of Projects Assignments submissionsProjects Assignments will be conducted online by using related software. Completed Projects Assignments should be uploaded to the drop box before midnight of the due date. Projects Assignments missed due to legitimate reasons must be completed later mutually agreed with the instructor. Departmental Policies The use of cell phones iPods laptops and other personal electronic devices are prohibited from the classroom during the class time unless the instructor makes an explicit exception. Announcements made in class or placed on Avenue are considered to have been communicated to all students including those individuals that are not in class. Instructor has the right to submit work to software to identify plagiarism.', 'Instructor has the right to submit work to software to identify plagiarism. 3. SUB TOPIC S Week 1 Overview Human language Word meanings Word2Vec and Optimization basics Week 2 Intro to neural networks Gradients and backpropagation Week 3 Recurrent Neural Networks and Language Models Week 4 Conditioned Generation Week 5 Part 1 Self attention and transformers Part 2 Seq2Seq models Week 6 Midterm Test Week 7 Midterm Recess No class Week 8 Prompting Instruction Finetuning and RLHF Week 9 Question Answering systems Week 10 Multimodal models Week 11 Project presentation and Q A Week 12 Project presentation and Q A Week 13 Project presentation and Q A Classes end April 10th 4. ASSESSMENT OF LEARNING Weight 4 Assignments 20 4 Quizzes 10 Midterm Test 35 Group Project 35 TOTAL 100Note that the percentage distribution of each module may be adjusted. Percentage grades will be converted to letter grades and grade points per the University calendar. 5. LEARNING OUTCOMES By the end of this course the students will know about Introduction to Deep Learning Word representations Language models Pre trained language models Text generation Seq2Seq models Prompting Feedback systems Multimodal models NLP applications e.g. Q A systems 6. COURSE OUTLINE APPROVED ADVISORY STATEMENTS ANTI DISCRIMINATION The Faculty of Engineering is concerned with ensuring an environment that is free of all discrimination. If there is a problem individuals are reminded that they should contact the Associate Director Graduate Studies the Sexual Harassment Officer or the Human Rights Consultant as soon as possible. http www.mcmaster.ca policy General HR Discrimination_Harassment_Sexual_Harassment Prevention Response.pdf ACADEMIC INTEGRITY You are expected to exhibit honesty and use ethical behaviour in all aspects of the learning process. Academic credentials you earn are rooted in principles of honesty and academic integrity. It is your responsibility to understand what constitutes academic dishonesty. Academic dishonesty is to knowingly act or fail to act in a way that results or could result in unearned academic credit or advantage. This behaviour can result in serious consequences e.g.']",text-embedding-3-small,512,20,2,"
You are an AI teaching Assistant for the SEP 775 course. 
You will provide an interactive platform for students to ask questions and receive guidance on course materials.
Your goal is to answer questions as accurately as possible based on the instructions and context provided.
If you found the answer based on the context provided, you should provide the answer first, then at the end, beginning a new sentence with the words ""Source:"", followed by the name of the lecture, or assignment, or paper if possible.
",0.9161228991125252,1.0,0.9057902290172654,0.0869565217391304
1,What is the email address of the instructor for this course?,"The email address of the instructor for the course ""Introduction to Computational Natural Language Processing"" (SEP 775) is mahyarh@mcmaster.ca.

Source: NLP Winter 2024 Course Outline.","['file name: NLP Winter 2024 Course Outline. Course Outline 1. COURSE INFORMATION Session Offered Winter 2024 Course Name Introduction to Computational Natural Language Processing Course Code SEP 775 Date s and Time s of lectures Lectures In person Wednesday 3 30 pm 6 30 pm Program Name System and Technology Calendar Description This graduate course introduces fundamental concepts in computational natural language processing NLP and their applications to teaching students how to deal with textual data in Artificial Intelligence. This course demonstrates how machines can learn different tasks in natural language such as language modeling text generation machine translation and language understanding. In this regard we go over the most promising methods in this literature and the most recent state of the art techniques. Moreover this course explores different real world applications of NLP and helps students get hands on experience in this field. Instructor Hamidreza Mahyar E Mail mahyarh@mcmaster.ca Office Hours upon request 2. COURSE SPECIFICS Course Description This course covers some fundamental concepts in natural language processing NLP and how they apply in real world use cases. Instruction Type Code Type Hours per term C Classroom instruction 39 L Laboratory workshop or fieldwork T Tutorial DE Distance education Total Hours 39 Resources ISBN Textbook Title Edition Author Publisher Natural Language Processing Jacob Eisenstein Speech and Language Processing Dan Jurafsky and James H. Martin Deep Learning Ian Goodfellow Yoshua Bengio and Aaron Courville Prerequisite s Proficiency in Python programming language Some Machine Learning and or Deep Learning knowledge is a plus Corequisite s Antirequisite s Course Specific Policies All work must be shown to get full credit. Specific policy of Projects Assignments submissionsProjects Assignments will be conducted online by using related software. Completed Projects Assignments should be uploaded to the drop box before midnight of the due date. Projects Assignments missed due to legitimate reasons must be completed later mutually agreed with the instructor. Departmental Policies The use of cell phones iPods laptops and other personal electronic devices are prohibited from the classroom during the class time unless the instructor makes an explicit exception. Announcements made in class or placed on Avenue are considered to have been communicated to all students including those individuals that are not in class. Instructor has the right to submit work to software to identify plagiarism.', 'If you have any questions or concerns about such disclosure please discuss this with the course instructor. ONLINE PROCTORING Some courses may use online proctoring software for tests and exams. This software may require students to turn on their video camera present identification monitor and record their computer activities and or lock restrict their browser or other applications software during tests or exams. This software may be required to be installed before the test exam begins. COMMUNICATIONS It is the student s responsibility to Maintain current contact information with the University including address phone numbers and emergency contact information. Use the University provided e mail address or maintain a valid forwarding e mail address. Regularly check the official University communications channels. Official University communications are considered received if sent by postal mail by fax or by e mail to the student s designated primary e mail account via their @mcmaster.ca alias. Accept that forwarded e mails may be lost and that e mail is considered received if sent via the student s @mcmaster.ca alias. Check the McMaster Avenue email and course websites on a regular basis during the term. CONDUCT EXPECTATIONS As a McMaster student you have the right to experience and the responsibility to demonstrate respectful and dignified interactions within all of our living learning and working communities. These expectations are described in the Code of Student Rights Responsibilities the Code . All students share the responsibility of maintaining a positive environment for the academic and personal growth of all McMaster community members whether in person or online. It is essential that students be mindful of their interactions online as the Code remains in effect in virtual learning environments. The Code applies to any interactions that adversely affect disrupt or interfere with reasonable participation in University activities. Student disruptions or behaviours that interfere with university functions on online platforms e.g. use of Avenue 2 Learn WebEx or Zoom for delivery will be taken very seriously and will be investigated. Outcomes may include restriction or removal of the involved students access to these platforms. ACADEMIC ACCOMMODATION OF STUDENTS WITH DISABILITIES Students with disabilities who require academic accommodation must contact Student Accessibility Services SAS at 905 525 9140 ext. 28652 or sas@mcmaster.ca to make arrangements with a Program Coordinator.']",text-embedding-3-small,512,20,2,"
You are an AI teaching Assistant for the SEP 775 course. 
You will provide an interactive platform for students to ask questions and receive guidance on course materials.
Your goal is to answer questions as accurately as possible based on the instructions and context provided.
If you found the answer based on the context provided, you should provide the answer first, then at the end, beginning a new sentence with the words ""Source:"", followed by the name of the lecture, or assignment, or paper if possible.
",0.8907449601778002,1.0,0.8973413321539809,0.0
2,When is this course held every week?,"The course ""Introduction to Computational Natural Language Processing"" (Course Code: SEP 775) is held in person on Wednesdays from 3:30 pm to 6:30 pm every week during the Winter 2024 session.","['file name: NLP Winter 2024 Course Outline. Course Outline 1. COURSE INFORMATION Session Offered Winter 2024 Course Name Introduction to Computational Natural Language Processing Course Code SEP 775 Date s and Time s of lectures Lectures In person Wednesday 3 30 pm 6 30 pm Program Name System and Technology Calendar Description This graduate course introduces fundamental concepts in computational natural language processing NLP and their applications to teaching students how to deal with textual data in Artificial Intelligence. This course demonstrates how machines can learn different tasks in natural language such as language modeling text generation machine translation and language understanding. In this regard we go over the most promising methods in this literature and the most recent state of the art techniques. Moreover this course explores different real world applications of NLP and helps students get hands on experience in this field. Instructor Hamidreza Mahyar E Mail mahyarh@mcmaster.ca Office Hours upon request 2. COURSE SPECIFICS Course Description This course covers some fundamental concepts in natural language processing NLP and how they apply in real world use cases. Instruction Type Code Type Hours per term C Classroom instruction 39 L Laboratory workshop or fieldwork T Tutorial DE Distance education Total Hours 39 Resources ISBN Textbook Title Edition Author Publisher Natural Language Processing Jacob Eisenstein Speech and Language Processing Dan Jurafsky and James H. Martin Deep Learning Ian Goodfellow Yoshua Bengio and Aaron Courville Prerequisite s Proficiency in Python programming language Some Machine Learning and or Deep Learning knowledge is a plus Corequisite s Antirequisite s Course Specific Policies All work must be shown to get full credit. Specific policy of Projects Assignments submissionsProjects Assignments will be conducted online by using related software. Completed Projects Assignments should be uploaded to the drop box before midnight of the due date. Projects Assignments missed due to legitimate reasons must be completed later mutually agreed with the instructor. Departmental Policies The use of cell phones iPods laptops and other personal electronic devices are prohibited from the classroom during the class time unless the instructor makes an explicit exception. Announcements made in class or placed on Avenue are considered to have been communicated to all students including those individuals that are not in class. Instructor has the right to submit work to software to identify plagiarism.', 'Instructor has the right to submit work to software to identify plagiarism. 3. SUB TOPIC S Week 1 Overview Human language Word meanings Word2Vec and Optimization basics Week 2 Intro to neural networks Gradients and backpropagation Week 3 Recurrent Neural Networks and Language Models Week 4 Conditioned Generation Week 5 Part 1 Self attention and transformers Part 2 Seq2Seq models Week 6 Midterm Test Week 7 Midterm Recess No class Week 8 Prompting Instruction Finetuning and RLHF Week 9 Question Answering systems Week 10 Multimodal models Week 11 Project presentation and Q A Week 12 Project presentation and Q A Week 13 Project presentation and Q A Classes end April 10th 4. ASSESSMENT OF LEARNING Weight 4 Assignments 20 4 Quizzes 10 Midterm Test 35 Group Project 35 TOTAL 100Note that the percentage distribution of each module may be adjusted. Percentage grades will be converted to letter grades and grade points per the University calendar. 5. LEARNING OUTCOMES By the end of this course the students will know about Introduction to Deep Learning Word representations Language models Pre trained language models Text generation Seq2Seq models Prompting Feedback systems Multimodal models NLP applications e.g. Q A systems 6. COURSE OUTLINE APPROVED ADVISORY STATEMENTS ANTI DISCRIMINATION The Faculty of Engineering is concerned with ensuring an environment that is free of all discrimination. If there is a problem individuals are reminded that they should contact the Associate Director Graduate Studies the Sexual Harassment Officer or the Human Rights Consultant as soon as possible. http www.mcmaster.ca policy General HR Discrimination_Harassment_Sexual_Harassment Prevention Response.pdf ACADEMIC INTEGRITY You are expected to exhibit honesty and use ethical behaviour in all aspects of the learning process. Academic credentials you earn are rooted in principles of honesty and academic integrity. It is your responsibility to understand what constitutes academic dishonesty. Academic dishonesty is to knowingly act or fail to act in a way that results or could result in unearned academic credit or advantage. This behaviour can result in serious consequences e.g.']",text-embedding-3-small,512,20,2,"
You are an AI teaching Assistant for the SEP 775 course. 
You will provide an interactive platform for students to ask questions and receive guidance on course materials.
Your goal is to answer questions as accurately as possible based on the instructions and context provided.
If you found the answer based on the context provided, you should provide the answer first, then at the end, beginning a new sentence with the words ""Source:"", followed by the name of the lecture, or assignment, or paper if possible.
",0.8454684632075044,1.0,0.8535941478108241,0.0869565217391304
3,What is the name of the TA for this course?,"The name of the instructor for the course is Hamidreza Mahyar. Unfortunately, the name of the TA is not provided in the context information. If you need more specific details, you may want to reach out to the instructor directly or refer to any official course documents.","['file name: NLP Winter 2024 Course Outline. Course Outline 1. COURSE INFORMATION Session Offered Winter 2024 Course Name Introduction to Computational Natural Language Processing Course Code SEP 775 Date s and Time s of lectures Lectures In person Wednesday 3 30 pm 6 30 pm Program Name System and Technology Calendar Description This graduate course introduces fundamental concepts in computational natural language processing NLP and their applications to teaching students how to deal with textual data in Artificial Intelligence. This course demonstrates how machines can learn different tasks in natural language such as language modeling text generation machine translation and language understanding. In this regard we go over the most promising methods in this literature and the most recent state of the art techniques. Moreover this course explores different real world applications of NLP and helps students get hands on experience in this field. Instructor Hamidreza Mahyar E Mail mahyarh@mcmaster.ca Office Hours upon request 2. COURSE SPECIFICS Course Description This course covers some fundamental concepts in natural language processing NLP and how they apply in real world use cases. Instruction Type Code Type Hours per term C Classroom instruction 39 L Laboratory workshop or fieldwork T Tutorial DE Distance education Total Hours 39 Resources ISBN Textbook Title Edition Author Publisher Natural Language Processing Jacob Eisenstein Speech and Language Processing Dan Jurafsky and James H. Martin Deep Learning Ian Goodfellow Yoshua Bengio and Aaron Courville Prerequisite s Proficiency in Python programming language Some Machine Learning and or Deep Learning knowledge is a plus Corequisite s Antirequisite s Course Specific Policies All work must be shown to get full credit. Specific policy of Projects Assignments submissionsProjects Assignments will be conducted online by using related software. Completed Projects Assignments should be uploaded to the drop box before midnight of the due date. Projects Assignments missed due to legitimate reasons must be completed later mutually agreed with the instructor. Departmental Policies The use of cell phones iPods laptops and other personal electronic devices are prohibited from the classroom during the class time unless the instructor makes an explicit exception. Announcements made in class or placed on Avenue are considered to have been communicated to all students including those individuals that are not in class. Instructor has the right to submit work to software to identify plagiarism.', 'Instructor has the right to submit work to software to identify plagiarism. 3. SUB TOPIC S Week 1 Overview Human language Word meanings Word2Vec and Optimization basics Week 2 Intro to neural networks Gradients and backpropagation Week 3 Recurrent Neural Networks and Language Models Week 4 Conditioned Generation Week 5 Part 1 Self attention and transformers Part 2 Seq2Seq models Week 6 Midterm Test Week 7 Midterm Recess No class Week 8 Prompting Instruction Finetuning and RLHF Week 9 Question Answering systems Week 10 Multimodal models Week 11 Project presentation and Q A Week 12 Project presentation and Q A Week 13 Project presentation and Q A Classes end April 10th 4. ASSESSMENT OF LEARNING Weight 4 Assignments 20 4 Quizzes 10 Midterm Test 35 Group Project 35 TOTAL 100Note that the percentage distribution of each module may be adjusted. Percentage grades will be converted to letter grades and grade points per the University calendar. 5. LEARNING OUTCOMES By the end of this course the students will know about Introduction to Deep Learning Word representations Language models Pre trained language models Text generation Seq2Seq models Prompting Feedback systems Multimodal models NLP applications e.g. Q A systems 6. COURSE OUTLINE APPROVED ADVISORY STATEMENTS ANTI DISCRIMINATION The Faculty of Engineering is concerned with ensuring an environment that is free of all discrimination. If there is a problem individuals are reminded that they should contact the Associate Director Graduate Studies the Sexual Harassment Officer or the Human Rights Consultant as soon as possible. http www.mcmaster.ca policy General HR Discrimination_Harassment_Sexual_Harassment Prevention Response.pdf ACADEMIC INTEGRITY You are expected to exhibit honesty and use ethical behaviour in all aspects of the learning process. Academic credentials you earn are rooted in principles of honesty and academic integrity. It is your responsibility to understand what constitutes academic dishonesty. Academic dishonesty is to knowingly act or fail to act in a way that results or could result in unearned academic credit or advantage. This behaviour can result in serious consequences e.g.']",text-embedding-3-small,512,20,2,"
You are an AI teaching Assistant for the SEP 775 course. 
You will provide an interactive platform for students to ask questions and receive guidance on course materials.
Your goal is to answer questions as accurately as possible based on the instructions and context provided.
If you found the answer based on the context provided, you should provide the answer first, then at the end, beginning a new sentence with the words ""Source:"", followed by the name of the lecture, or assignment, or paper if possible.
",0.9175611607980152,0.6666666666666666,0.8959027819140706,0.0
4,What is Word2vec?,"Word2vec is a framework for learning word vectors where every word in a fixed vocabulary is represented by a vector. It involves going through a large corpus of text, considering a center word and context outside words, and using the similarity of word vectors to calculate the probability of outside words given the center word or vice versa. The objective is to adjust word vectors to maximize this probability. Essentially, Word2vec is a method for creating word embeddings by capturing semantic relationships between words based on their usage in context.

Source: Lecture01_wordvecs1.txt","['Word2vec Overview 21 Word2vec Mikolov et al. 2013 is a framework for learning word vectors Idea We have a large corpus body of text a long list of words Every word in a fixed vocabulary is represented by a vector Go through each position t in the text which has a center word c and context outside words o Use the similarity of the word vectors for c and o to calculate the probability of o given c or vice versa Keep adjusting the word vectors to maximize this probabilityWord2Vec Overview Example windows and process for computing 𝑃𝑤𝑡 𝑗 𝑤𝑡 crises banking into turning problems as center word at position t outside context words in window of size 2 outside context words in window of size 2 𝑃𝑤𝑡 1 𝑤𝑡 22 𝑃𝑤𝑡 2 𝑤𝑡 𝑃𝑤𝑡 1 𝑤𝑡 𝑃𝑤𝑡 2 𝑤𝑡Word2Vec Overview Example windows and process for computing 𝑃𝑤𝑡 𝑗 𝑤𝑡 crises banking into turning problems as center word at position t outside context words in window of size 2 outside context words in window of size 2 𝑃𝑤𝑡 2 𝑤𝑡 𝑃𝑤𝑡 1 𝑤𝑡 23 𝑃𝑤𝑡 2 𝑤𝑡 𝑃𝑤𝑡 1 𝑤𝑡Word2vec objective function For each position 𝑡 1 𝑇 predict context words within a window of fixed size m given center word 𝑤𝑡. Data likelihood The objective function 𝐽𝜃is the average negative log likelihood Minimizing objective function Maximizing predictive accuracy sometimes called a cost or loss function 24Word2vec objective function We want to minimize the objective function Question How to calculate 𝑃𝑤𝑡 𝑗 𝑤𝑡 𝜃 Answer We will use two vectors per word w', '3.3 Estimating a word2vec model from a corpus How do we train word2vec in practice Specifying the word2vec model is relatively transparent from the math we ve given above one constructs matrices U and V and can write out the math of the probability. However it may not yet be evident how to estimate the parameters 1 how to calculate the expectation in Eqn 5 for a given value of U and V and then 2 how to perform the minimization operation. Let s start with 1. Word2vec empirical loss. Let D be a set of documents d where each document is a sequence of words w d 1 . . . w d m with all w V. Let k N be a positive integer window size. Let s define how our center word random variable C and outside word r.v. O relate to this concrete dataset. O takes on the value of each word wi in each document and for each such wi the outside words are wi k . . . wi 1 wi 1 . . . wi k . So our Eqn 5 objective becomes L U V d D m i 1 k j 1 log pU V w d i j w d i 6 where you ll note we re taking the sum over 1 all documents of the sum over 2 all words in the document of the sum over 3 all words occuring in the window of the likelihood of the outside word given the center word. Now how do we do the minimization Gradient based estimation At a high level we try to find good U and V for the objective we ve specified by starting with a relatively uninformed guess and iteratively moving in the direction that locally best improves the guess. This is done by gradient based methods a full description of which is out of scope for this note.']",text-embedding-3-small,512,20,2,"
You are an AI teaching Assistant for the SEP 775 course. 
You will provide an interactive platform for students to ask questions and receive guidance on course materials.
Your goal is to answer questions as accurately as possible based on the instructions and context provided.
If you found the answer based on the context provided, you should provide the answer first, then at the end, beginning a new sentence with the words ""Source:"", followed by the name of the lecture, or assignment, or paper if possible.
",0.9999999999999994,1.0,0.958160541729254,0.0833333333333333
5,What are the main learning goals of the course?,"The main learning goals of the course include Introduction to Deep Learning, Word representations, Language models, Pre-trained language models, Text generation, Seq2Seq models, Prompting Feedback systems, Multimodal models, and NLP applications such as Q&A systems. Students will also learn about human language, word meanings, Word2Vec, optimization basics, neural networks, gradients, backpropagation, recurrent neural networks, conditioned generation, self-attention, transformers, and question-answering systems. Additionally, the course will cover topics like midterm tests, group projects, and various assessments to ensure understanding and application of the concepts taught.","['Instructor has the right to submit work to software to identify plagiarism. 3. SUB TOPIC S Week 1 Overview Human language Word meanings Word2Vec and Optimization basics Week 2 Intro to neural networks Gradients and backpropagation Week 3 Recurrent Neural Networks and Language Models Week 4 Conditioned Generation Week 5 Part 1 Self attention and transformers Part 2 Seq2Seq models Week 6 Midterm Test Week 7 Midterm Recess No class Week 8 Prompting Instruction Finetuning and RLHF Week 9 Question Answering systems Week 10 Multimodal models Week 11 Project presentation and Q A Week 12 Project presentation and Q A Week 13 Project presentation and Q A Classes end April 10th 4. ASSESSMENT OF LEARNING Weight 4 Assignments 20 4 Quizzes 10 Midterm Test 35 Group Project 35 TOTAL 100Note that the percentage distribution of each module may be adjusted. Percentage grades will be converted to letter grades and grade points per the University calendar. 5. LEARNING OUTCOMES By the end of this course the students will know about Introduction to Deep Learning Word representations Language models Pre trained language models Text generation Seq2Seq models Prompting Feedback systems Multimodal models NLP applications e.g. Q A systems 6. COURSE OUTLINE APPROVED ADVISORY STATEMENTS ANTI DISCRIMINATION The Faculty of Engineering is concerned with ensuring an environment that is free of all discrimination. If there is a problem individuals are reminded that they should contact the Associate Director Graduate Studies the Sexual Harassment Officer or the Human Rights Consultant as soon as possible. http www.mcmaster.ca policy General HR Discrimination_Harassment_Sexual_Harassment Prevention Response.pdf ACADEMIC INTEGRITY You are expected to exhibit honesty and use ethical behaviour in all aspects of the learning process. Academic credentials you earn are rooted in principles of honesty and academic integrity. It is your responsibility to understand what constitutes academic dishonesty. Academic dishonesty is to knowingly act or fail to act in a way that results or could result in unearned academic credit or advantage. This behaviour can result in serious consequences e.g.', 'file name: NLP Winter 2024 Course Outline. Course Outline 1. COURSE INFORMATION Session Offered Winter 2024 Course Name Introduction to Computational Natural Language Processing Course Code SEP 775 Date s and Time s of lectures Lectures In person Wednesday 3 30 pm 6 30 pm Program Name System and Technology Calendar Description This graduate course introduces fundamental concepts in computational natural language processing NLP and their applications to teaching students how to deal with textual data in Artificial Intelligence. This course demonstrates how machines can learn different tasks in natural language such as language modeling text generation machine translation and language understanding. In this regard we go over the most promising methods in this literature and the most recent state of the art techniques. Moreover this course explores different real world applications of NLP and helps students get hands on experience in this field. Instructor Hamidreza Mahyar E Mail mahyarh@mcmaster.ca Office Hours upon request 2. COURSE SPECIFICS Course Description This course covers some fundamental concepts in natural language processing NLP and how they apply in real world use cases. Instruction Type Code Type Hours per term C Classroom instruction 39 L Laboratory workshop or fieldwork T Tutorial DE Distance education Total Hours 39 Resources ISBN Textbook Title Edition Author Publisher Natural Language Processing Jacob Eisenstein Speech and Language Processing Dan Jurafsky and James H. Martin Deep Learning Ian Goodfellow Yoshua Bengio and Aaron Courville Prerequisite s Proficiency in Python programming language Some Machine Learning and or Deep Learning knowledge is a plus Corequisite s Antirequisite s Course Specific Policies All work must be shown to get full credit. Specific policy of Projects Assignments submissionsProjects Assignments will be conducted online by using related software. Completed Projects Assignments should be uploaded to the drop box before midnight of the due date. Projects Assignments missed due to legitimate reasons must be completed later mutually agreed with the instructor. Departmental Policies The use of cell phones iPods laptops and other personal electronic devices are prohibited from the classroom during the class time unless the instructor makes an explicit exception. Announcements made in class or placed on Avenue are considered to have been communicated to all students including those individuals that are not in class. Instructor has the right to submit work to software to identify plagiarism.']",text-embedding-3-small,512,20,2,"
You are an AI teaching Assistant for the SEP 775 course. 
You will provide an interactive platform for students to ask questions and receive guidance on course materials.
Your goal is to answer questions as accurately as possible based on the instructions and context provided.
If you found the answer based on the context provided, you should provide the answer first, then at the end, beginning a new sentence with the words ""Source:"", followed by the name of the lecture, or assignment, or paper if possible.
",0.9999999999999996,1.0,0.9277807187366056,0.1304347826086956
6,How is the course grade distributed?,"The course grade is distributed as follows:
- 4 Assignments: 20%
- 4 Quizzes: 10%
- Midterm Test: 35%
- Group Project: 35%
Total: 100%
(Source: NLP_Winter_2024_Course_Outline.txt)","['Instructor has the right to submit work to software to identify plagiarism. 3. SUB TOPIC S Week 1 Overview Human language Word meanings Word2Vec and Optimization basics Week 2 Intro to neural networks Gradients and backpropagation Week 3 Recurrent Neural Networks and Language Models Week 4 Conditioned Generation Week 5 Part 1 Self attention and transformers Part 2 Seq2Seq models Week 6 Midterm Test Week 7 Midterm Recess No class Week 8 Prompting Instruction Finetuning and RLHF Week 9 Question Answering systems Week 10 Multimodal models Week 11 Project presentation and Q A Week 12 Project presentation and Q A Week 13 Project presentation and Q A Classes end April 10th 4. ASSESSMENT OF LEARNING Weight 4 Assignments 20 4 Quizzes 10 Midterm Test 35 Group Project 35 TOTAL 100Note that the percentage distribution of each module may be adjusted. Percentage grades will be converted to letter grades and grade points per the University calendar. 5. LEARNING OUTCOMES By the end of this course the students will know about Introduction to Deep Learning Word representations Language models Pre trained language models Text generation Seq2Seq models Prompting Feedback systems Multimodal models NLP applications e.g. Q A systems 6. COURSE OUTLINE APPROVED ADVISORY STATEMENTS ANTI DISCRIMINATION The Faculty of Engineering is concerned with ensuring an environment that is free of all discrimination. If there is a problem individuals are reminded that they should contact the Associate Director Graduate Studies the Sexual Harassment Officer or the Human Rights Consultant as soon as possible. http www.mcmaster.ca policy General HR Discrimination_Harassment_Sexual_Harassment Prevention Response.pdf ACADEMIC INTEGRITY You are expected to exhibit honesty and use ethical behaviour in all aspects of the learning process. Academic credentials you earn are rooted in principles of honesty and academic integrity. It is your responsibility to understand what constitutes academic dishonesty. Academic dishonesty is to knowingly act or fail to act in a way that results or could result in unearned academic credit or advantage. This behaviour can result in serious consequences e.g.', 'This behaviour can result in serious consequences e.g. the grade of zero on an assignment loss of credit with a notation on the transcript notation reads Grade of F assigned for academic dishonesty and or suspension or expulsion from the university. For information on the various types of academic dishonesty please refer to the Academic Integrity Policy located at https secretariat.mcmaster.ca university policies procedures guidelines The following illustrates only three forms of academic dishonesty plagiarism e.g. the submission of work that is not one s own or for which other credit has been obtained. improper collaboration in group work. copying or using unauthorized aids in tests and examinations. AUTHENTICITY PLAGIARISM DETECTION Some courses may use a web based service Turnitin.com to reveal authenticity and ownership of student submitted work. For courses using such software students will be expected to submit their work electronically either directly to Turnitin.com or via an online learning platform e.g. A2L etc. using plagiarism detection a service supported by Turnitin.com so it can be checked for academic dishonesty. Students who do not wish their work to be submitted through the plagiarism detection software must inform the Instructor before the assignment is due. No penalty will be assigned to a student who does not submit work to the plagiarism detection software. All submitted work is subject to normal verification that standards of academicintegrity have been upheld e.g. on line search other software etc. . For more details about McMaster s use of Turnitin.com please go to www.mcmaster.ca academicintegrity. COURSES WITH AN ON LINE ELEMENT Some courses may use on line elements e.g. e mail Avenue to Learn A2L LearnLink web pages capa Moodle ThinkingCap etc. . Students should be aware that when they access the electronic components of a course using these elements private information such as first and last names user names for the McMaster e mail accounts and program affiliation may become apparent to all other students in the same course. The available information is dependent on the technology used. Continuation in a course that uses on line elements will be deemed consent to this disclosure. If you have any questions or concerns about such disclosure please discuss this with the course instructor.']",text-embedding-3-small,512,20,2,"
You are an AI teaching Assistant for the SEP 775 course. 
You will provide an interactive platform for students to ask questions and receive guidance on course materials.
Your goal is to answer questions as accurately as possible based on the instructions and context provided.
If you found the answer based on the context provided, you should provide the answer first, then at the end, beginning a new sentence with the words ""Source:"", followed by the name of the lecture, or assignment, or paper if possible.
",0.9999999999999996,1.0,0.9600655619610268,0.0
7,What is the policy for late submissions in this course?,The policy for late submissions in this course is not explicitly mentioned in the provided context information. It is advisable to refer to the course syllabus or contact the course instructor for specific details regarding late submissions.,"['This behaviour can result in serious consequences e.g. the grade of zero on an assignment loss of credit with a notation on the transcript notation reads Grade of F assigned for academic dishonesty and or suspension or expulsion from the university. For information on the various types of academic dishonesty please refer to the Academic Integrity Policy located at https secretariat.mcmaster.ca university policies procedures guidelines The following illustrates only three forms of academic dishonesty plagiarism e.g. the submission of work that is not one s own or for which other credit has been obtained. improper collaboration in group work. copying or using unauthorized aids in tests and examinations. AUTHENTICITY PLAGIARISM DETECTION Some courses may use a web based service Turnitin.com to reveal authenticity and ownership of student submitted work. For courses using such software students will be expected to submit their work electronically either directly to Turnitin.com or via an online learning platform e.g. A2L etc. using plagiarism detection a service supported by Turnitin.com so it can be checked for academic dishonesty. Students who do not wish their work to be submitted through the plagiarism detection software must inform the Instructor before the assignment is due. No penalty will be assigned to a student who does not submit work to the plagiarism detection software. All submitted work is subject to normal verification that standards of academicintegrity have been upheld e.g. on line search other software etc. . For more details about McMaster s use of Turnitin.com please go to www.mcmaster.ca academicintegrity. COURSES WITH AN ON LINE ELEMENT Some courses may use on line elements e.g. e mail Avenue to Learn A2L LearnLink web pages capa Moodle ThinkingCap etc. . Students should be aware that when they access the electronic components of a course using these elements private information such as first and last names user names for the McMaster e mail accounts and program affiliation may become apparent to all other students in the same course. The available information is dependent on the technology used. Continuation in a course that uses on line elements will be deemed consent to this disclosure. If you have any questions or concerns about such disclosure please discuss this with the course instructor.', '28652 or sas@mcmaster.ca to make arrangements with a Program Coordinator. For further information consult McMaster University s Academic Accommodation of Students with Disabilities policy. ACADEMIC ACCOMMODATION FOR RELIGIOUS INDIGENOUS OR SPIRITUAL OBSERVANCES RISOStudents requiring academic accommodation based on religious indigenous or spiritual observances should follow the procedures set out in the RISO policy. Students should submit their request to their Faculty Office normally within 10 working days of the beginning of term in which they anticipate a need for accommodation or to the Registrar s Office prior to their examinations. Students should also contact their instructors as soon as possible to make alternative arrangements for classes assignments and tests. http www.mcmaster.ca policy Students AcademicStudies Studentcode.pdf COPYRIGHT AND RECORDING Students are advised that lectures demonstrations performances and any other course material provided by an instructor include copyright protected works. The Copyright Act and copyright law protect every original literary dramatic musical and artistic work including lectures by University instructors The recording of lectures tutorials or other methods of instruction may occur during a course. Recording may be done by either the instructor for the purpose of authorized distribution or by a student for the purpose of personal study. Students should be aware that their voice and or image may be recorded by others during the class. Please speak with the instructor if this is a concern for you. EXTREME CIRCUMSTANCES The University reserves the right to change the dates and deadlines for any or all courses in extreme circumstances e.g. severe weather labour disruptions etc. . Changes will be communicated through regular McMaster communication channels such as McMaster Daily News A2L and or McMaster email.']",text-embedding-3-small,512,20,2,"
You are an AI teaching Assistant for the SEP 775 course. 
You will provide an interactive platform for students to ask questions and receive guidance on course materials.
Your goal is to answer questions as accurately as possible based on the instructions and context provided.
If you found the answer based on the context provided, you should provide the answer first, then at the end, beginning a new sentence with the words ""Source:"", followed by the name of the lecture, or assignment, or paper if possible.
",0.0,1.0,0.8672037335286649,0.0
8,What does the course hope to teach regarding word vectors?,"The course aims to teach about representing word semantics not just as one-hot vectors, but as a collection of features and relationships to linguistic categories and other words. It discusses the wealth of information that can be annotated about a word, including grammatical, derivational, and semantic information. It also mentions existing resources like WordNet and UniMorph for annotated information about words, and the challenges of building word vectors based on human annotated resources. Additionally, the course emphasizes the importance of allowing data to determine aspects of text representations and the promise of learning rich representations from data in the field of NLP.

Source: Lecture01_notes_Introduction.txt","['2.3 Vectors from annotated discrete properties. Should we represent word semantics not as one hot vectors but instead as a collection of features and relationships to linguistic categories and other words For any word say runners there is a wealth of information we can annotate about that word. There is grammatical information like plurality there s derivational information like how the runners is something like the verb to run plus a notion of doer or agent think one who runs. There s also semantic information like how runners might be a hyponym of humans or animals or entities. A hyponym is a member of an is a relationship e.g. a runner is a human. There are substantial existing resources in English and a few other languages for various kinds of annotated information about words. WordNet Miller 1995 annotates for synonyms hyponyms and other semantic relations UniMorph Batsuren et al. 2022 annotates for morphology subword structure information across many lan guages. With such resources one could build word vectors that look something like vtea 0 0 1 . . . 1 plural noun 3rd singular verb hyponym of beverage . . . synonym of chai 3 In 2023 word vectors resulting from these methods are not the norm and they won t be the focus of this course. One main failure is that human annotated resources are always lacking in vocabulary compared to methods that can draw a vocabulary from a naturally occuring text source updating these resources is costly and they re always incomplete. Another failure is a tradeoff between dimension ality and utility of the embedding it takes a very high dimensional vector think much larger than the vocabulary size to represent all of these categories and modern neural methods that tend to operate on dense vectors do not behave well with such vectors. Finally a continual theme we ll see in this course is that human ideas of what the right representations should be for text tend to underperform methods that allow data to determine more aspects at least when one has a lot of data to learn from. 3 Distributional semantics and Word2vec A promise of deep learning is to learn rich representations of com plex objects from data. Increasingly relevant in NLP is the idea that we can unsupervisedly learn rich representations from data.', 'This has been done on various datasets that contain human judgement survey data. Model Size WS353 MC RG SCWS RW SVD 6B 35.3 35.1 42.5 38.3 25.6 SVD S 6B 56.5 71.5 71.0 53.6 34.7 SVD L 6B 65.7 72.7 75.1 56.5 37.0 CBOW 6B 57.2 65.6 68.2 57.0 32.5 SG 6B 62.8 65.2 69.7 58.1 37.2 GloVe 6B 65.8 72.7 77.8 53.9 38.1 SVD L 42B 74.0 76.4 74.1 58.3 39.9 GloVe 42B 75.9 83.6 82.9 59.6 47.8 CBOW 100B 68.4 79.6 75.4 59.4 45.5 Table 6 Here we see the correlations be tween of word vector similarities using different embedding techniques with different human judgment datasets 2.6 Further Reading Dealing With Ambiguity One might wonder how we handle the situation where we want to capture the same word with different vectors for its different uses in natural language. For instance run is both a noun and a verb and is used and interpreted differently based on the context. Improving Word Representations Via Global Context And Multi ple Word Prototypes Huang et al 2012 describes how such cases can also be handled in NLP. The essence of the method is the following 1. Gather ﬁxed size context windows of all occurrences of the word for instance 5 before and 5 after 2. Each context is represented by a weighted average of the context words vectors using idf weighting 3. Apply spherical k means to cluster these context representations. 4. Finally each word occurrence is re labeled to its associated cluster and is used to train the word representation for that cluster.']",text-embedding-3-small,512,20,2,"
You are an AI teaching Assistant for the SEP 775 course. 
You will provide an interactive platform for students to ask questions and receive guidance on course materials.
Your goal is to answer questions as accurately as possible based on the instructions and context provided.
If you found the answer based on the context provided, you should provide the answer first, then at the end, beginning a new sentence with the words ""Source:"", followed by the name of the lecture, or assignment, or paper if possible.
",0.9025042410701696,1.0,0.897626128418066,0.0454545454545454
9,How does Word2vec represent word meaning?,"Word2vec represents word meaning by assigning each word in a fixed vocabulary a vector. It goes through each position in the text with a center word and context outside words, using the similarity of the word vectors for the center word and context words to calculate the probability of the context words given the center word or vice versa. By adjusting the word vectors to maximize this probability, Word2vec captures the meaning of words based on their context in the text.","['500 000 Means one 1 the rest 0s 16Problem with words as discrete symbols 17 Example in web search if a user searches for Seattle motel we would like to match documents containing Seattle hotel But motel 0 0 0 0 0 0 0 0 0 0 1 0 0 0 0 hotel 0 0 0 0 0 0 0 1 0 0 0 0 0 0 0 These two vectors are orthogonal There is no natural notion of similarity for one hot vectors Solution Could try to rely on WordNet s list of synonyms to get similarity But it is well known to fail badly incompleteness etc. Instead learn to encode similarity in the vectors themselves Sec. 9.2.2Representing words by their context 21 Distributional semantics A word s meaning is given by the words that frequently appear close by You shall know a word by the company it keeps J. R. Firth 1957 11 One of the most successful ideas of modern statistical NLP When a word w appears in a text its context is the set of words that appear nearby within a fixed size window . We use the many contexts of w to build up a representation of w government debt problems turning into banking crises as happened in 2009 saying that Europe needs unified banking regulation to replace the hodgepodge India has just given its banking system a shot in the arm These context words will represent bankingWord vectors We will build a dense vector for each word chosen so that it is similar to vectors of words that appear in similar contexts measuring similarity as the vector dot scalar product Note word vectors are also called word embeddings or neural word representations They are a distributed representation banking 0.286 0.792 0.177 0.107 0.109 0.542 0.349 0.271 monetary 0.413 0.582 0.007 0.247 0.216 0.718 0.147 0.051 19Word meaning as a neural word vector visualization 0.286 0.792 0.177 0.107 0.109 0.542 0.349 0.271 0.487 expect 203.', 'Word2vec Overview 21 Word2vec Mikolov et al. 2013 is a framework for learning word vectors Idea We have a large corpus body of text a long list of words Every word in a fixed vocabulary is represented by a vector Go through each position t in the text which has a center word c and context outside words o Use the similarity of the word vectors for c and o to calculate the probability of o given c or vice versa Keep adjusting the word vectors to maximize this probabilityWord2Vec Overview Example windows and process for computing 𝑃𝑤𝑡 𝑗 𝑤𝑡 crises banking into turning problems as center word at position t outside context words in window of size 2 outside context words in window of size 2 𝑃𝑤𝑡 1 𝑤𝑡 22 𝑃𝑤𝑡 2 𝑤𝑡 𝑃𝑤𝑡 1 𝑤𝑡 𝑃𝑤𝑡 2 𝑤𝑡Word2Vec Overview Example windows and process for computing 𝑃𝑤𝑡 𝑗 𝑤𝑡 crises banking into turning problems as center word at position t outside context words in window of size 2 outside context words in window of size 2 𝑃𝑤𝑡 2 𝑤𝑡 𝑃𝑤𝑡 1 𝑤𝑡 23 𝑃𝑤𝑡 2 𝑤𝑡 𝑃𝑤𝑡 1 𝑤𝑡Word2vec objective function For each position 𝑡 1 𝑇 predict context words within a window of fixed size m given center word 𝑤𝑡. Data likelihood The objective function 𝐽𝜃is the average negative log likelihood Minimizing objective function Maximizing predictive accuracy sometimes called a cost or loss function 24Word2vec objective function We want to minimize the objective function Question How to calculate 𝑃𝑤𝑡 𝑗 𝑤𝑡 𝜃 Answer We will use two vectors per word w']",text-embedding-3-small,512,20,2,"
You are an AI teaching Assistant for the SEP 775 course. 
You will provide an interactive platform for students to ask questions and receive guidance on course materials.
Your goal is to answer questions as accurately as possible based on the instructions and context provided.
If you found the answer based on the context provided, you should provide the answer first, then at the end, beginning a new sentence with the words ""Source:"", followed by the name of the lecture, or assignment, or paper if possible.
",0.9994884235900416,1.0,0.9245318263495668,0.2
10,What is the main focus of this lecture on neural networks?,"The main focus of this lecture on neural networks is to introduce single and multilayer neural networks, discuss how they can be used for classification purposes, and explain how they can be trained using backpropagation. Additionally, the lecture covers topics such as neuron units, max margin loss, gradient checks, Xavier parameter initialization, learning rates, and Adagrad. Lastly, the lecture motivates the use of recurrent neural networks as a language model.

Source: SEP 775 - Computational Natural Language Processing, lecture02 notes Backpropagation.","['file name: lecture02 notes Backpropagation.  Neural networks. Forward computation. Backward propagation. Neuron Units. Max margin Loss. Gradient checks. Xavier parameter initialization. Learning rates. Adagrad. This set of notes introduces single and multilayer neural networks and how they can be used for classiﬁcation purposes. We then dis cuss how they can be trained using a distributed gradient descent technique known as backpropagation. We will see how the chain rule can be used to make parameter updates sequentially. After a rigorous mathematical discussion of neural networks we will discuss some practical tips and tricks in training neural networks involving neuron units non linearities gradient checks Xavier parameter ini tialization learning rates Adagrad etc. Lastly we will motivate the use of recurrent neural networks as a language model. 1 Neural Networks Foundations Figure 1 We see here how a non linear decision boundary separates the data very well. This is the prowess of neural networks. Fun Fact Neural networks are biologically in spired classiﬁers which is why they are often called artiﬁcial neural networks to distinguish them from the organic kind. However in reality human neural networks are so much more capable and complex from artiﬁcial neural net works that it is usually better to not draw too many parallels between the two. We established in our previous discussions the need for non linear classiﬁers since most data are not linearly separable and thus our classiﬁcation performance on them is limited. Neural networks are a family of classiﬁers with non linear decision boundary as seen in Figure 1. Now that we know the sort of decision boundaries neural networks create let us see how they manage doing so. 1.1 A Neuron A neuron is a generic computational unit that takes n inputs and produces a single output. What differentiates the outputs of different neurons is their parameters also referred to as their weights . One of the most popular choices for neurons is the sigmoid or binary lo gistic regression unit.', 'file name: lecture03 RNNs and LLMs. Hamidreza Mahyar mahyarh@mcmaster.ca Computational Natural Language Processing Language Models and Recurrent Neural NetsLecture Plan 1. A bit more about neural networks Language modeling RNNs 2. A new NLP task Language Modeling 4. Problems with RNNs 5. Recap on RNNs LMs Reminders You should have started working on Assignment 1 2 motivates 3. A new family of neural networks Recurrent Neural Networks RNNs This is the most important concept in the class It leads to GPT 3 and ChatGPT Important and used in Ass1 but not the only way to build LMs0 model power Training error Test error Classic view Regularization works to prevent overfitting when we have a lot of features or later a very powerful deep model etc. Now Regularization produces models that generalize well when we have a big model We do not care that our models overfit on the training data even though they are hugely overfit error overfitting We have models with many parameters Regularization 3 A full loss function includes regularization over all parameters 𝜃 e.g. L2 regularizationDropout Srivastava Hinton Krizhevsky Sutskever Salakhutdinov 2012 JMLR 2014 4 Preventing Feature Co adaptation Good Regularization Method Use it everywhere Training time at each instance of evaluation in online SGD training randomly set 50 p of the inputs to each neuron to 0 Test time halve the model weights now twice as many Except usually only drop first layer inputs a little 15 or not at all This prevents feature co adaptation A feature cannot only be useful in the presence of particular other features In a single layer A kind of middle ground between Naïve Bayes where all feature weights are set independently and logistic regression models where weights are set in the context of all others Can be thought of as a form of model bagging i.e.']",text-embedding-3-small,512,20,2,"
You are an AI teaching Assistant for the SEP 775 course. 
You will provide an interactive platform for students to ask questions and receive guidance on course materials.
Your goal is to answer questions as accurately as possible based on the instructions and context provided.
If you found the answer based on the context provided, you should provide the answer first, then at the end, beginning a new sentence with the words ""Source:"", followed by the name of the lecture, or assignment, or paper if possible.
",1.0000000000000002,1.0,0.925081044920158,0.0357142857142857
11,What are the non-linear functions mentioned for neural networks?,"The non-linear functions mentioned for neural networks are logistic, tanh, ReLU, Swish, Leaky ReLU, Parametric ReLU, and GELU. These functions are used to introduce non-linearities in neural networks for better performance and training efficiency.","['file name: lecture02 Neural Nets. Hamidreza Mahyar mahyarh@mcmaster.ca Computational Natural Language Processing Neural Networks Gradients and BackpropagationBinary classification for center word being location We do supervised training and want high score if it s a location 𝐽𝑡𝜃 𝜎𝑠 1 1 𝑒 𝑠 x xmuseums xin xParis xare xamazing predicted model probability of class f Some element wise non linear function e.g. logistic tanh ReLU 2 R5d Embedding of 1 hot wordsNeural computation Original McCulloch Pitts 1943 threshold unit 𝟏 𝑊𝑥 𝜃 𝟏 𝑊𝑥 𝜃 0 This function has no slope so no gradient based learning 3tanh is just a rescaled and shifted sigmoid 2 as steep 1 1 tanh z 2logistic 2z 1 Logistic and tanh are still used e.g. logistic to get a probability However now for deep networks the first thing to try is ReLU it trains quickly and performs well due to good gradient backflow. ReLU has a negative dead zone that recent proposals mitigate GELU is frequently used with Transformers BERT RoBERTa etc. Non linearities old and new logistic sigmoid tanh hard tanh 1 0 1 1 Swish arXiv 1710.05941 swish 𝑥 𝑥. logistic 𝑥 Rectified Linear Unit ReLU ReLU 𝑧 max 𝑧 0 Leaky ReLU Parametric ReLU 0 0 0 GELU arXiv 1606.08415 GELU 𝑥 𝑥. 𝑃𝑋 𝑥 𝑋 𝑁 0 1 𝑥. logistic 1.702𝑥Non linearities i.e. f on previous slide Why they re needed Neural networks do function approximation e.g.', 'Then during back propagation we only pass gradients through neurons that were kept alive during the forward pass. Finally during testing we compute the forward pass using all of the neurons in the network. However a key sub tlety is that in order for dropout to work effectively the expected output of a neuron during testing should be approximately the same as it was during training else the magnitude of the outputs could be radically different and the behavior of the network is no longer well deﬁned. Thus we must typically divide the outputs of each neuron during testing by a certain value it is left as an exercise to the reader to determine what this value should be in order for the expected outputs during training and testing to be equivalent. 2.4 Neuron Units So far we have discussed neural networks that contain sigmoidal neurons to introduce nonlinearities however in many applications better networks can be designed using other activation functions. Some common choices are listed here with their function and gra dient deﬁnitions and these can be substituted with the sigmoidal functions discussed above. Sigmoid This is the default choice we have discussed the activation function σ is given by Figure 9 The response of a sigmoid nonlinearity σ z 1 1 exp z where σ z 0 1 The gradient of σ z is σ z exp z 1 exp z σ z 1 σ z Tanh The tanh function is an alternative to the sigmoid function that is often found to converge faster in practice. The primary differ ence between tanh and sigmoid is that tanh output ranges from 1 to 1 while the sigmoid ranges from 0 to 1. Figure 10 The response of a tanh nonlinearity tanh z exp z exp z exp z exp z 2σ 2z 1 where tanh z 1 1 The gradient of tanh z is tanh z 1 exp z exp z exp z exp z 2 1 tanh2 z Hard tanh The hard tanh function is sometimes preferred over the tanh function since it is computationally cheaper. It does however saturate for magnitudes of z greater than 1.']",text-embedding-3-small,512,20,2,"
You are an AI teaching Assistant for the SEP 775 course. 
You will provide an interactive platform for students to ask questions and receive guidance on course materials.
Your goal is to answer questions as accurately as possible based on the instructions and context provided.
If you found the answer based on the context provided, you should provide the answer first, then at the end, beginning a new sentence with the words ""Source:"", followed by the name of the lecture, or assignment, or paper if possible.
",0.990252641413291,1.0,0.968261532007181,0.0588235294117647
12,What is the purpose of non-linearities in neural networks?,"The purpose of non-linearities in neural networks is to allow deep neural networks to approximate any complex function beyond just a linear transform. Without non-linearities, deep neural networks would be limited to performing only linear transformations, but with the inclusion of non-linearities in extra layers, neural networks can approximate more complex functions effectively.","['file name: lecture02 notes Backpropagation.  Neural networks. Forward computation. Backward propagation. Neuron Units. Max margin Loss. Gradient checks. Xavier parameter initialization. Learning rates. Adagrad. This set of notes introduces single and multilayer neural networks and how they can be used for classiﬁcation purposes. We then dis cuss how they can be trained using a distributed gradient descent technique known as backpropagation. We will see how the chain rule can be used to make parameter updates sequentially. After a rigorous mathematical discussion of neural networks we will discuss some practical tips and tricks in training neural networks involving neuron units non linearities gradient checks Xavier parameter ini tialization learning rates Adagrad etc. Lastly we will motivate the use of recurrent neural networks as a language model. 1 Neural Networks Foundations Figure 1 We see here how a non linear decision boundary separates the data very well. This is the prowess of neural networks. Fun Fact Neural networks are biologically in spired classiﬁers which is why they are often called artiﬁcial neural networks to distinguish them from the organic kind. However in reality human neural networks are so much more capable and complex from artiﬁcial neural net works that it is usually better to not draw too many parallels between the two. We established in our previous discussions the need for non linear classiﬁers since most data are not linearly separable and thus our classiﬁcation performance on them is limited. Neural networks are a family of classiﬁers with non linear decision boundary as seen in Figure 1. Now that we know the sort of decision boundaries neural networks create let us see how they manage doing so. 1.1 A Neuron A neuron is a generic computational unit that takes n inputs and produces a single output. What differentiates the outputs of different neurons is their parameters also referred to as their weights . One of the most popular choices for neurons is the sigmoid or binary lo gistic regression unit.', 'f on previous slide Why they re needed Neural networks do function approximation e.g. regression or classification Without non linearities deep neural networks can t do anything more than a linear transform Extra layers could just be compiled down into a single linear transform W1 W2 x Wx But with more layers that include non linearities they can approximate any complex function 5Training with cross entropy loss you use this in PyTorch Until now our objective was stated as to maximize the probability of the correct class y or equivalently we can minimize the negative log probability of that class Now restated in terms of cross entropy a concept from information theory Let the true probability distribution be p let our computed model probability be q The cross entropy is Assuming a ground truth or true or gold or target probability distribution that is 1 at the right class and 0 everywhere else p 0 0 1 0 0 then Because of one hot p the only term left is the negative log probability of the true class yi log 𝑝 𝑦i 𝑥i Cross entropy can be used in other ways with a more interesting p but for now just know that you ll want to use it as the loss in PyTorch 6Remember Stochastic Gradient Descent Update equation i.e. for each parameter In deep learning 𝜃includes the data representation e.g. word vectors too How can we compute 𝜃𝐽 𝜃 1. By hand 2. Algorithmically the backpropagation algorithm 𝛼 step size or learning rate 7Lecture Plan 8 Gradients 1. Introduction 2. Matrix calculus 3.']",text-embedding-3-small,512,20,2,"
You are an AI teaching Assistant for the SEP 775 course. 
You will provide an interactive platform for students to ask questions and receive guidance on course materials.
Your goal is to answer questions as accurately as possible based on the instructions and context provided.
If you found the answer based on the context provided, you should provide the answer first, then at the end, beginning a new sentence with the words ""Source:"", followed by the name of the lecture, or assignment, or paper if possible.
",1.0000000000000004,1.0,0.93362477278922,0.04
13,What is cross entropy loss used for in PyTorch?,"Cross entropy loss is used in PyTorch to minimize the negative log probability of the correct class or target class in a classification task. It is a concept from information theory where the true probability distribution (p) and the computed model probability distribution (q) are compared to calculate the loss. By using cross entropy loss, the model aims to improve its performance by reducing the difference between the predicted probabilities and the actual probabilities of the classes.

Source: Lecture02_Neural_Nets.txt","['f on previous slide Why they re needed Neural networks do function approximation e.g. regression or classification Without non linearities deep neural networks can t do anything more than a linear transform Extra layers could just be compiled down into a single linear transform W1 W2 x Wx But with more layers that include non linearities they can approximate any complex function 5Training with cross entropy loss you use this in PyTorch Until now our objective was stated as to maximize the probability of the correct class y or equivalently we can minimize the negative log probability of that class Now restated in terms of cross entropy a concept from information theory Let the true probability distribution be p let our computed model probability be q The cross entropy is Assuming a ground truth or true or gold or target probability distribution that is 1 at the right class and 0 everywhere else p 0 0 1 0 0 then Because of one hot p the only term left is the negative log probability of the true class yi log 𝑝 𝑦i 𝑥i Cross entropy can be used in other ways with a more interesting p but for now just know that you ll want to use it as the loss in PyTorch 6Remember Stochastic Gradient Descent Update equation i.e. for each parameter In deep learning 𝜃includes the data representation e.g. word vectors too How can we compute 𝜃𝐽 𝜃 1. By hand 2. Algorithmically the backpropagation algorithm 𝛼 step size or learning rate 7Lecture Plan 8 Gradients 1. Introduction 2. Matrix calculus 3.', 'The cross entropy can never be lower than the true entropy so a model cannot err by underestimating the true entropy. We are ﬁnally ready to see the relation between perplexity and cross entropy as we saw it in Eq. 3.51. Cross entropy is deﬁned in the limit as the length of the observed word sequence goes to inﬁnity. We will need an approximation to cross entropy relying on a sufﬁciently long sequence of ﬁxed length. This approxima tion to the cross entropy of a model M P wi wi N 1 i 1 on a sequence of words W is H W 1 N logP w1w2 ...wN 3.53 The perplexity of a model P on a sequence of words W is now formally deﬁned as perplexity 2 raised to the power of this cross entropy3.9 SUMMARY 25 Perplexity W 2H W P w1w2 ...wN 1 N N s 1 P w1w2 ...wN N v u u t N Y i 1 1 P wi w1 ...wi 1 3.54 3.9 Summary This chapter introduced language modeling and the n gram one of the most widely used tools in language processing. Language models offer a way to assign a probability to a sentence or other sequence of words and to predict a word from preceding words. n grams are Markov models that estimate words from a ﬁxed window of pre vious words. n gram probabilities can be estimated by counting in a corpus and normalizing the maximum likelihood estimate . n gram language models are evaluated extrinsically in some task or intrinsi cally using perplexity. The perplexity of a test set according to a language model is the geometric mean of the inverse test set probability computed by the model. Smoothing algorithms provide a more sophisticated way to estimate the prob ability of n grams. Commonly used smoothing algorithms for n grams rely on lower order n gram counts through backoff or interpolation. Both backoff and interpolation require discounting to create a probability dis tribution. Kneser Ney smoothing makes use of the probability of a word being a novel continuation.']",text-embedding-3-small,512,20,2,"
You are an AI teaching Assistant for the SEP 775 course. 
You will provide an interactive platform for students to ask questions and receive guidance on course materials.
Your goal is to answer questions as accurately as possible based on the instructions and context provided.
If you found the answer based on the context provided, you should provide the answer first, then at the end, beginning a new sentence with the words ""Source:"", followed by the name of the lecture, or assignment, or paper if possible.
",0.9999999999999988,1.0,0.9578057944628332,0.0476190476190476
14,What is the significance of the backpropagation algorithm?,"The significance of the backpropagation algorithm is that it allows us to use the chain rule of differentiation to calculate loss gradients for any parameter used in the feedforward computation of a neural network model. It enables updating parameters efficiently using gradient descent or its variants, such as stochastic gradient descent (SGD), by propagating error signals backward through the network to adjust the weights and biases based on the calculated gradients. This iterative process of backpropagation plays a crucial role in training neural networks by optimizing their performance through learning from the errors and updating the model parameters accordingly.","['No parameter updates are necessary if the cost is 0. Since we typically update parameters using gradient descent or a variant such as SGD we typically need the gradient information for any parameter as required in the update equation θ t 1 θ t α θ t J Backpropagation is technique that allows us to use the chain rule of differentiation to calculate loss gradients for any parameter used in the feed forward computation on the model. To understand this further let us understand the toy network shown in Figure 5 for which we will perform backpropagation. Figure 5 This is a 4 2 1 neural network where neuron j on layer k receives input z k j and produces activation output a k j . Here we use a neural network with a single hidden layer and a single unit output. Let us establish some notation that will make it easier to generalize this model later xi is an input to the neural network. s is the output of the neural network. Each layer including the input and output layers has neurons which receive an input and produce an output. The j th neuron of layer k receives the scalar input z k j and produces the scalar activation output a k j . We will call the backpropagated error calculated at z k j as δ k j . Layer 1 refers to the input layer and not the ﬁrst hidden layer. For the input layer xj z 1 j a 1 j . W k is the transfer matrix that maps the output from the k th layer to the input to the k 1 th Thus W 1 W and W 2 U to put this new generalized notation in perspective of Section 1.3. Backpropagation Notation xi is an input to the neural network. s is the output of the neural net work. The j th neuron of layer k receives the scalar input z k j and produces the scalar activation output a k j . For the input layer xj z 1 j a 1 j . W k is the transfer matrix that maps the output from the k th layer to the input to the k 1 th. Thus W 1 W and W 2 UT using notation from Section 1.3.', 'Figure 6 This subnetwork shows the relevant parts of the network required to update W 1 ij Let us discuss the error sharing distribution interpretation of backpropagation better using Figure 6 as an example. Say we were to update W 1 14 1. We start with the an error signal of 1 propagating backwards from a 3 1 . 2. We then multiply this error by the local gradient of the neuron which maps z 3 1 to a 3 1 . This happens to be 1 in this case and thus the error is still 1. This is now known as δ 3 1 1. 3. At this point the error signal of 1 has reached z 3 1 . We now need to distribute the error signal so that the fair share of the error reaches to a 2 1 . 4. This amount is the error signal at z 3 1 δ 3 1 W 2 1 W 2 1 . Thus the error at a 2 1 W 2 1 . 5. As we did in step 2 we need to move the error across the neuron which maps z 2 1 to a 2 1 . We do this by multiplying the error signal at a 2 1 by the local gradient of the neuron which happens to be f z 2 1 . 6. Thus the error signal at z 2 1 is f z 2 1 W 2 1 . This is known as δ 2 1 . 7. Finally we need to distribute the fair share of the error to W 1 14 by simply multiplying it by the input it was responsible for for warding which happens to be a 1 4 . 8. Thus the gradient of the loss with respect to W 1 14 is calculated to be a 1 4 f z 2 1 W 2 1 . Notice that the result we arrive at using this approach is exactly the same as that we arrived at using explicit differentiation earlier.']",text-embedding-3-small,512,20,2,"
You are an AI teaching Assistant for the SEP 775 course. 
You will provide an interactive platform for students to ask questions and receive guidance on course materials.
Your goal is to answer questions as accurately as possible based on the instructions and context provided.
If you found the answer based on the context provided, you should provide the answer first, then at the end, beginning a new sentence with the words ""Source:"", followed by the name of the lecture, or assignment, or paper if possible.
",1.000000000000001,1.0,0.9483442996093148,0.03125
15,What does the Jacobian matrix represent in the context of neural networks?,"The Jacobian matrix in the context of neural networks represents an m x n matrix of partial derivatives, where m is the number of outputs and n is the number of inputs of a given function. It generalizes the concept of the gradient when dealing with functions that have multiple outputs and inputs. The Jacobian matrix helps in understanding how each input affects each output in a multivariable function.

Source: lecture02_Neural_Nets.txt","['So if k i everything in the sum is zero and the gradient is zero. Otherwise the only nonzero element of the sum is when l j so we just get xj. Thus we ﬁnd zk Wij xj if k i and 0 if otherwise. Another way of writing this is z Wij 0 . . . 0 xj 0 . . . 0 ith element Now let s compute J Wij J Wij J z z Wij δ z Wij m X k 1 δk zk Wij δixj the only nonzero term in the sum is δi zi Wij . To get J W we want a ma trix where entry i j is δixj. This matrix is equal to the outer product J W δT xT 6 Row vector time matrix with respect to the matrix z xW δ J z what is J W δ z W A similar computation to 5 shows that J W xT δ . 7 Cross entropy loss with respect to logits ˆ y softmax θ J CE y ˆ y what is J θ The gradient is J θ ˆ y y or ˆ y y T if y is a column vector . 4These identities will be enough to let you quickly compute the gradients for many neural networks. However it s important to know how to compute Jacobians for other functions as well in case they show up. Some examples if you want practice dot product of two vectors elementwise product of two vectors 2 norm of a vector. Feel free to use these identities in the assignments. One option is just to memorize them. Another option is to ﬁgure them out by looking at the dimensions. For example only one ordering orientation of δ and x will produce the correct shape for J W assuming W is not square . 4 Gradient Layout Jacobean formulation is great for applying the chain rule you just have to mul tiply the Jacobians. However when doing SGD it s more convenient to follow the convention the shape of the gradient equals the shape of the parameter as we did when computing J W . That way subtracting the gradient times the learning rate from the parameters is easy. We expect answers to homework questions to follow this convention.', 'Introduction 2. Matrix calculus 3. BackpropagationComputing Gradients by Hand 9 Matrix calculus Fully vectorized gradients Multivariable calculus is just like single variable calculus if you use matrices Much faster and more useful than non vectorized gradients But doing a non vectorized gradient can be good for intuition recall the first lecture for an exampleGradients Given a function with 1 output and 1 input 𝑓𝑥 𝑥3 It s gradient slope is its derivative 𝑑f 3𝑥2 10 𝑑𝑥 How much will the output change if we change the input a bit At x 1 it changes about 3 times as much 1.013 1.03 At x 4 it changes about 48 times as much 4.013 64.48Gradients Given a function with 1 output and n inputs Its gradient is a vector of partial derivatives with respect to each input 11Jacobian Matrix Generalization of the Gradient Given a function with m outputs and n inputs It s Jacobian is an m x n matrix of partial derivatives 12Chain Rule For composition of one variable functions multiply derivatives For multiple variables functions multiply Jacobians 13Example Jacobian Elementwise activation Function 14Example Jacobian Elementwise activation Function Function has n outputs and n inputs n by n Jacobian 15Example Jacobian Elementwise activation Function 16Example Jacobian Elementwise activation Function 17Example Jacobian Elementwise activation Function 18Other Jacobians Compute these at home for practice Check your answers with the lecture notes 19Other Jacobians Compute these at home for practice Check your answers with the lecture notes 20Other Jacobians Compute these at home for practice Check your answers with the lecture notes Fine print This is the correct Jacobian. Later we discuss the shape convention using it the answer would be h. 21Other Jacobians Compute these at home for practice 22Back to our Neural Net x xmuseums xin xParis xare xamazing 23Back to our Neural Net Let s find Really we care about the gradient of the loss Jt but we will compute the gradient of the score for simplicity x xmuseums xin xParis xare xamazing 241.']",text-embedding-3-small,512,20,2,"
You are an AI teaching Assistant for the SEP 775 course. 
You will provide an interactive platform for students to ask questions and receive guidance on course materials.
Your goal is to answer questions as accurately as possible based on the instructions and context provided.
If you found the answer based on the context provided, you should provide the answer first, then at the end, beginning a new sentence with the words ""Source:"", followed by the name of the lecture, or assignment, or paper if possible.
",0.9999999999999988,1.0,0.938534632876426,0.6086956521739131
16,How is the derivative with respect to a matrix described?,The derivative with respect to a matrix is described as a n x m matrix where each entry represents the derivative of the loss function with respect to a specific entry in the original matrix. This arrangement allows for easier computation and application of gradient descent during optimization.,"['So z x ij zi xj xj f xi f xi if i j 0 if otherwise So we see that the Jacobian z x is a diagonal matrix where the entry at i i is the derivative of f applied to xi. We can write this as z x diag f x . Since multiplication by a diagonal matrix is the same as doing elementwise multiplication by the diagonal we could also write f x when applying the chain rule. 5 Matrix times column vector with respect to the matrix z W x δ J z what is J W J z z W δ z W This is a bit more complicated than the other identities. The reason for in cluding J z in the above problem formulation will become clear in a moment. First suppose we have a loss function J a scalar and are computing its gradient with respect to a matrix W Rn m. Then we could think of J as a function of W taking nm inputs the entries of W to a single output J . This means the Jacobian J W would be a 1 nm vector. But in practice this is not a very useful way of arranging the gradient. It would be much nicer if the derivatives were in a n m matrix like this J W J W11 . . . J W1m . . . ... . . . J Wn1 . . . J Wnm Since this matrix has the same shape as W we could just subtract it times the learning rate from W when doing gradient descent. So in a slight abuse of notation let s ﬁnd this matrix as J W instead. This way of arranging the gradients becomes complicated when computing z W . Unlike J z is a vector. So if we are trying to rearrange the gradients like with J W z W would be an n m n tensor Luckily we can avoid the issue by taking the gradient with respect to a single weight Wij instead. 3z Wij is just a vector which is much easier to deal with. We have zk m X l 1 Wklxl zk Wij m X l 1 xl Wij Wkl Note that Wij Wkl 1 if i k and j l and 0 if otherwise. So if k i everything in the sum is zero and the gradient is zero.', 'Using the regular chain rule we can compute the derivative of g as the Jacobian g x xg1 f1 x f2 x xg2 f1 x f2 x g1 f1 f1 x g1 f2 f2 x g2 f1 f1 x g2 f2 f2 x 1And we see this is the same as multiplying the two Jacobians g x g f f x g1 f1 g1 f2 g2 f1 g2 f2 f1 x f2 x 3 Useful Identities This section will now go over how to compute the Jacobian for several simple functions. It will provide some useful identities you can apply when taking neu ral network gradients. 1 Matrix times column vector with respect to the column vector z W x what is z x Suppose W Rn m. Then we can think of z as a function of x taking an m dimensional vector to an n dimensional vector. So its Jacobian will be n m. Note that zi m X k 1 Wikxk So an entry z x ij of the Jacobian will be z x ij zi xj xj m X k 1 Wikxk m X k 1 Wik xj xk Wij because xj xk 1 if k j and 0 if otherwise. So we see that z x W 2 Row vector times matrix with respect to the row vector z xW what is z x A computation similar to 1 shows that z x W T . 3 A vector with itself z x what is z x We have zi xi. So z x ij zi xj xj xi 1 if i j 0 if otherwise So we see that the Jacobian z x is a diagonal matrix where the entry at i i is 1. This is just the identity matrix z x I . When applying the chain 2rule this term will disappear because a matrix or vector multiplied by the identity matrix does not change. 4 An elementwise function applied a vector z f x what is z x Since f is being applied elementwise we have zi f xi .']",text-embedding-3-small,512,20,2,"
You are an AI teaching Assistant for the SEP 775 course. 
You will provide an interactive platform for students to ask questions and receive guidance on course materials.
Your goal is to answer questions as accurately as possible based on the instructions and context provided.
If you found the answer based on the context provided, you should provide the answer first, then at the end, beginning a new sentence with the words ""Source:"", followed by the name of the lecture, or assignment, or paper if possible.
",0.9768913042834108,0.5,0.8983354856596555,0.0344827586206896
17,What role does automatic differentiation play in modern deep learning frameworks?,"Automatic differentiation plays a crucial role in modern deep learning frameworks as they compute gradients automatically. This feature saves time and effort for developers by handling the complex task of calculating derivatives efficiently, allowing them to focus on designing and training neural network models effectively. Understanding how automatic differentiation works can help developers debug and improve their models when necessary.

Source: Lecture02_Neural_Nets","['do backpropagation for you but mainly leave layer node writer to hand calculate the local derivative 74Backprop Implementations 75Implementation forward backward API 76Implementation forward backward API 77Manual Gradient checking Numeric Gradient For small h 1e 4 Easy to implement correctly But approximate and very slow You have to recompute f for every parameter of our model Useful for checking your implementation In the old days we hand wrote everything doing this everywhere was the key test Now much less needed you can use it to check layers are correctly implemented 78Summary We ve mastered the core technology of neural nets Backpropagation recursively and hence efficiently apply the chain rule along computation graph downstream gradient upstream gradient x local gradient Forward pass compute results of operations and save intermediate values Backward pass apply chain rule to compute gradients 79Why learn all these details about gradients 80 Modern deep learning frameworks compute gradients for you But why take a class on compilers or systems when they are implemented for you Understanding what is going on under the hood is useful Backpropagation doesn t always work perfectly out of the box Understanding why is crucial for debugging and improving models See Karpathy article https medium.com @karpathy yes you should understand backprop e2f06eab496b Example in future lecture exploding and vanishing gradients', 'Introduction 2. Matrix calculus 3. BackpropagationComputing Gradients by Hand 9 Matrix calculus Fully vectorized gradients Multivariable calculus is just like single variable calculus if you use matrices Much faster and more useful than non vectorized gradients But doing a non vectorized gradient can be good for intuition recall the first lecture for an exampleGradients Given a function with 1 output and 1 input 𝑓𝑥 𝑥3 It s gradient slope is its derivative 𝑑f 3𝑥2 10 𝑑𝑥 How much will the output change if we change the input a bit At x 1 it changes about 3 times as much 1.013 1.03 At x 4 it changes about 48 times as much 4.013 64.48Gradients Given a function with 1 output and n inputs Its gradient is a vector of partial derivatives with respect to each input 11Jacobian Matrix Generalization of the Gradient Given a function with m outputs and n inputs It s Jacobian is an m x n matrix of partial derivatives 12Chain Rule For composition of one variable functions multiply derivatives For multiple variables functions multiply Jacobians 13Example Jacobian Elementwise activation Function 14Example Jacobian Elementwise activation Function Function has n outputs and n inputs n by n Jacobian 15Example Jacobian Elementwise activation Function 16Example Jacobian Elementwise activation Function 17Example Jacobian Elementwise activation Function 18Other Jacobians Compute these at home for practice Check your answers with the lecture notes 19Other Jacobians Compute these at home for practice Check your answers with the lecture notes 20Other Jacobians Compute these at home for practice Check your answers with the lecture notes Fine print This is the correct Jacobian. Later we discuss the shape convention using it the answer would be h. 21Other Jacobians Compute these at home for practice 22Back to our Neural Net x xmuseums xin xParis xare xamazing 23Back to our Neural Net Let s find Really we care about the gradient of the loss Jt but we will compute the gradient of the score for simplicity x xmuseums xin xParis xare xamazing 241.']",text-embedding-3-small,512,20,2,"
You are an AI teaching Assistant for the SEP 775 course. 
You will provide an interactive platform for students to ask questions and receive guidance on course materials.
Your goal is to answer questions as accurately as possible based on the instructions and context provided.
If you found the answer based on the context provided, you should provide the answer first, then at the end, beginning a new sentence with the words ""Source:"", followed by the name of the lecture, or assignment, or paper if possible.
",1.0000000000000002,0.2,0.9111661137411092,0.1666666666666666
18,What is the purpose of manual gradient checking?,"The purpose of manual gradient checking is to compare analytical gradients with numerical gradients in order to verify the correctness of the analytical gradients. This process helps ensure that the gradients calculated analytically are accurate and close to the numerical gradients, providing a way to validate the gradient computation process in machine learning models. It is a way to catch errors in the gradient calculation and ensure the model is learning effectively.","['We note that this deﬁnition of the numerical gradient follows very naturally from the deﬁnition of the derivative where in the scalar case f x f x ϵ f x ϵ Gradient checks are a great way to compare analytical and numerical gradients. Analytical gradients should be close and numerical gradients can be calculated using f θ J θ i J θ i 2ϵ J θ i and J θ i can be evalu ated using two forward passes. An implementation of this can be seen in Snippet 2.1. Of course there is a slight difference the deﬁnition above only perturbs x in the positive direction to compute the gradient. While it would have been perfectly acceptable to deﬁne the numerical gradi ent in this way in practice it is often more precise and stable to use the centered difference formula where we perturb a parameter in both directions. The intuition is that to get a better approximation of the derivative slope around a point we need to examine the func tion f s behavior both to the left and right of that point. It can also be shown using Taylor s theorem that the centered difference formula has an error proportional to ϵ2 which is quite small whereas the derivative deﬁnition is more error prone. Now a natural question you might ask is if this method is so pre cise why do we not use it to compute all of our network gradients instead of applying back propagation The simple answer as hinted earlier is inefﬁciency recall that every time we want to compute the gradient with respect to an element we need to make two forward passes through the network which will be computationally expen sive. Furthermore many large scale neural networks can contain millions of parameters and computing two passes per parameter is clearly not optimal. And since in optimization techniques such as SGD we must compute the gradients once per iteration for several thousands of iterations it is obvious that this method quickly grows intractable. This inefﬁciency is why we only use gradient check to verify the correctness of our analytic gradients which are much quicker to compute.', 'This means that when stochastic gradient descent SGD reaches the wall and does a gradient descent step it will be forced to jump across the valley moving perpen dicular to the steep walls possibly leaving the valley and disrupting the learning process. The dashed arrows in Fig. 6 correspond to ignoring the norm of this large step ensuring that the model stays close to the wall. The key insight is that all the steps taken when the gradient explodes are aligned with v and ignore other descent direction i.e. the model moves perpendicular to the wall . At the wall a small norm step in the direction of the gradient there fore merely pushes us back inside the smoother low curvature region besides the wall whereas a regular gradient step would bring us very far thus slowing or preventing further training. Instead with a bounded step we get back in that smooth region near the wall where SGD is free to explore other descent directions. The important addition in this scenario to the classical high curvature valley is that we assume that the val ley is wide as we have a large region around the wall where if we land we can rely on ﬁrst order methods to move towards the local minima. This is why just clipping the gradient might be suﬃcient not requiring the use a second order method. Note that this algo rithm should work even when the rate of growth of the gradient is not the same as the one of the curvature a case for which a second order method would fail as the ratio between the gradient and curvature could still explode . Our hypothesis could also help to understand the re cent success of the Hessian Free approach compared to other second order methods. There are two key dif ferences between Hessian Free and most other second order algorithms. First it uses the full Hessian matrix and hence can deal with exploding directions that are not necessarily axis aligned. Second it computes a new estimate of the Hessian matrix before each up date step and can take into account abrupt changes in curvature such as the ones suggested by our hypothe sis while most other approaches use a smoothness as sumption i.e. averaging 2nd order signals over many steps. 3. Dealing with the exploding and vanishing gradient 3.1.']",text-embedding-3-small,512,20,2,"
You are an AI teaching Assistant for the SEP 775 course. 
You will provide an interactive platform for students to ask questions and receive guidance on course materials.
Your goal is to answer questions as accurately as possible based on the instructions and context provided.
If you found the answer based on the context provided, you should provide the answer first, then at the end, beginning a new sentence with the words ""Source:"", followed by the name of the lecture, or assignment, or paper if possible.
",0.9999994313386336,0.6666666666666666,0.9331793187288586,0.04
19,Why is understanding gradients important despite automatic differentiation?,"Understanding gradients is important despite automatic differentiation because it allows us to debug and improve models when backpropagation doesn't work perfectly out of the box. It helps us comprehend what is happening under the hood, which is crucial for addressing issues such as exploding and vanishing gradients. Source: SEP 775 - Computational Natural Language Processing, lecture02_Neural_Nets.txt","['We note that this deﬁnition of the numerical gradient follows very naturally from the deﬁnition of the derivative where in the scalar case f x f x ϵ f x ϵ Gradient checks are a great way to compare analytical and numerical gradients. Analytical gradients should be close and numerical gradients can be calculated using f θ J θ i J θ i 2ϵ J θ i and J θ i can be evalu ated using two forward passes. An implementation of this can be seen in Snippet 2.1. Of course there is a slight difference the deﬁnition above only perturbs x in the positive direction to compute the gradient. While it would have been perfectly acceptable to deﬁne the numerical gradi ent in this way in practice it is often more precise and stable to use the centered difference formula where we perturb a parameter in both directions. The intuition is that to get a better approximation of the derivative slope around a point we need to examine the func tion f s behavior both to the left and right of that point. It can also be shown using Taylor s theorem that the centered difference formula has an error proportional to ϵ2 which is quite small whereas the derivative deﬁnition is more error prone. Now a natural question you might ask is if this method is so pre cise why do we not use it to compute all of our network gradients instead of applying back propagation The simple answer as hinted earlier is inefﬁciency recall that every time we want to compute the gradient with respect to an element we need to make two forward passes through the network which will be computationally expen sive. Furthermore many large scale neural networks can contain millions of parameters and computing two passes per parameter is clearly not optimal. And since in optimization techniques such as SGD we must compute the gradients once per iteration for several thousands of iterations it is obvious that this method quickly grows intractable. This inefﬁciency is why we only use gradient check to verify the correctness of our analytic gradients which are much quicker to compute.', 'do backpropagation for you but mainly leave layer node writer to hand calculate the local derivative 74Backprop Implementations 75Implementation forward backward API 76Implementation forward backward API 77Manual Gradient checking Numeric Gradient For small h 1e 4 Easy to implement correctly But approximate and very slow You have to recompute f for every parameter of our model Useful for checking your implementation In the old days we hand wrote everything doing this everywhere was the key test Now much less needed you can use it to check layers are correctly implemented 78Summary We ve mastered the core technology of neural nets Backpropagation recursively and hence efficiently apply the chain rule along computation graph downstream gradient upstream gradient x local gradient Forward pass compute results of operations and save intermediate values Backward pass apply chain rule to compute gradients 79Why learn all these details about gradients 80 Modern deep learning frameworks compute gradients for you But why take a class on compilers or systems when they are implemented for you Understanding what is going on under the hood is useful Backpropagation doesn t always work perfectly out of the box Understanding why is crucial for debugging and improving models See Karpathy article https medium.com @karpathy yes you should understand backprop e2f06eab496b Example in future lecture exploding and vanishing gradients']",text-embedding-3-small,512,20,2,"
You are an AI teaching Assistant for the SEP 775 course. 
You will provide an interactive platform for students to ask questions and receive guidance on course materials.
Your goal is to answer questions as accurately as possible based on the instructions and context provided.
If you found the answer based on the context provided, you should provide the answer first, then at the end, beginning a new sentence with the words ""Source:"", followed by the name of the lecture, or assignment, or paper if possible.
",0.984563332089755,1.0,0.945738058894314,0.0833333333333333
20,What is the core concept introduced in this class that leads to GPT-3 and ChatGPT?,"The core concept introduced in this class that leads to GPT-3 and ChatGPT is the idea of emergent zero-shot learning. This concept refers to the ability of models like GPT-2 and GPT-3 to perform tasks without specific examples or gradient updates, simply by specifying the right sequence prediction problem. This allows the models to excel in various tasks without task-specific fine-tuning, showcasing their versatility and capability in natural language processing tasks.","['2019 Same architecture as GPT just bigger 117M 1.5B But trained on much more data 4GB 40GB of internet text data WebText Scrape links posted on Reddit w at least 3 upvotes rough proxy of human quality GPT 2018 GPT 2 2019 117M 1.5B 15One key emergent ability in GPT 2 is zero shot learning the ability to do many tasks with no examples and no gradient updates by simply Specifying the right sequence prediction problem e.g. question answering Passage Tom Brady... Q Where was Tom Brady born A ... Comparing probabilities of sequences e.g. Winograd Schema Challenge Levesque 2011 16 The cat couldn t fit into the hat because it was too big. Does it the cat or the hat Is P ...because the cat was too big P ...because the hat was too big Emergent zero shot learning Radford et al. 2019Emergent zero shot learning GPT 2 beats SoTA on language modeling benchmarks with no task specific fine tuning LAMBADA language modeling w long discourse dependencies Paperno et al. 2016 Radford et al. 2019 17Emergent zero shot learning 18 You can get interesting zero shot behavior if you re creative enough with how you specify your task Summarization on CNN DailyMail dataset See et al. 2017 SAN FRANCISCO California CNN A magnitude 4.2 earthquake shook the San Francisco ... overturn unstable Radford et al. 2019 2018 SoTA Supervised 287K Too Long Didn t Read Prompting objects. TL DR Select from article ROUGEEmergent abilities of large language models GPT 3 2020 19 GPT 3 175B parameters Brown et al.', 'These possibilities exist on a spectrum ranging from demonstrations in the training set that are drawn from exactly the same distribution as those at test time to recognizing the same task but in a different format to adapting to a speciﬁc style of a general task such as QA to learning a skill entirely de novo. Where GPT 3 is on this spectrum may also vary from task to task. Synthetic tasks such as wordscrambling or deﬁning nonsense words seem especially likely to be learned de novo whereas translation clearly must be learned during pretraining although possibly from data that is very different in organization and style than the test data. Ultimately it is not even clear what humans learn from scratch vs from prior demonstrations. Even organizing diverse demonstrations during pre training and identifying them at test time would be an advance for language models but nevertheless understanding precisely how few shot learning works is an important unexplored direction for future research. A limitation associated with models at the scale of GPT 3 regardless of objective function or algorithm is that they are both expensive and inconvenient to perform inference on which may present a challenge for practical applicability of models of this scale in their current form. One possible future direction to address this is distillation HVD15 of large models down to a manageable size for speciﬁc tasks. Large models such as GPT 3 contain a very wide range of skills most of which are not needed for a speciﬁc task suggesting that in principle aggressive distillation may be possible. Distillation is well explored in general LHCG19a but has not been tried at the scale of hundred of billions parameters new challenges and opportunities may be associated with applying it to models of this size. Finally GPT 3 shares some limitations common to most deep learning systems its decisions are not easily interpretable it is not necessarily well calibrated in its predictions on novel inputs as observed by the much higher variance in performance than humans on standard benchmarks and it retains the biases of the data it has been trained on. This last issue biases in the data that may lead the model to generate stereotyped or prejudiced content is of special concern from a societal perspective and will be discussed along with other issues in the next section on Broader Impacts Section 6 .']",text-embedding-3-small,512,20,2,"
You are an AI teaching Assistant for the SEP 775 course. 
You will provide an interactive platform for students to ask questions and receive guidance on course materials.
Your goal is to answer questions as accurately as possible based on the instructions and context provided.
If you found the answer based on the context provided, you should provide the answer first, then at the end, beginning a new sentence with the words ""Source:"", followed by the name of the lecture, or assignment, or paper if possible.
",0.9999999999999996,0.0,0.8789638276369943,0.0625
21,What is the purpose of Dropout as mentioned in the document?,"The purpose of Dropout, as mentioned in the document, is to act as a powerful technique for regularization in neural networks. During training, Dropout randomly drops a subset of neurons with a certain probability during each forward and backward pass, or keeps each neuron alive with a certain probability. This process helps prevent overfitting, allows the network to learn more meaningful information from the data, and generally leads to higher performance on the task at hand by effectively training exponentially many smaller networks at once and averaging over their predictions.

Source: SEP775_NLP - lecture02_notes_Backpropagation.txt","['Imposing such a con straint can also be interpreted as the prior Bayesian belief that the optimal weights are close to zero how close depends on the value of λ. Choosing the right value of λ is critical and must be chosen via hyperparameter tuning. Too high a value of λ causes most of the weights to be set too close to 0 and the model does not learn anything meaningful from the training data often obtaining poor ac curacy on training validation and testing sets. Too low a value and we fall into the domain of overﬁtting once again. It must be noted that the bias terms are not regularized and do not contribute to the cost term above try thinking about why this is the case There are indeed other types of regularization that are sometimes used such as L1 regularization which sums over the absolute values rather than squares of parameter elements however this is less commonly applied in practice since it leads to sparsity of parameter weights. In the next section we discuss dropout which effectively acts as another form of regularization by randomly dropping i.e. setting to zero neurons in the forward pass. 2.3 Dropout Dropout is a powerful technique for regularization ﬁrst introduced by Srivastava et al. in Dropout A Simple Way to Prevent Neural Net works from Overﬁtting. The idea is simple yet effective during train ing we will randomly drop with some probability 1 p a subset of neurons during each forward backward pass or equivalently we will keep alive each neuron with a probability p . Then during testing we will use the full network to compute our predictions. The result is that the network typically learns more meaningful informa tion from the data is less likely to overﬁt and usually obtains higher performance overall on the task at hand. One intuitive reason why this technique should be so effective is that what dropout is doing is essentially doing is training exponentially many smaller networks at once and averaging over their predictions. Dropout applied to an artiﬁcial neural network. Image credits to Srivastava et al. In practice the way we introduce dropout is that we take the out put h of each layer of neurons and keep each neuron with prob ability p and else set it to 0. Then during back propagation we only pass gradients through neurons that were kept alive during the forward pass.', 'like an ensemble model Nowadays usually thought of as strong feature dependent regularizer Wager Wang Liang 2013DropoutDropout Srivastava Hinton Krizhevsky Sutskever Salakhutdinov 2012 JMLR 2014 During training For each data point each time Randomly set input to 0 with probability 𝑝 dropout ratio often p 0.5 except p 0.15 for input layer via dropout mask During testing Multiply all weights by 1 𝑝 No other dropout 𝑥2 𝑥3 0 𝑤1 𝑤2 𝑤3 𝑤4 𝑏 1 𝑦 𝑤1𝑥1 𝑤2𝑥2 𝑤3𝑥3 𝑥 𝑥 1 1 Train 1 Train 2 Test 𝑥3 0 1 𝑦 𝑤1𝑥1 𝑤3𝑥3 𝑏 𝑤1 𝑤2 𝑤3 𝑤4 𝑏 𝑥1 0 𝑥2 𝑥3 𝑥4 𝑤1 𝑤2 𝑤3 𝑤4 𝑏 1 𝑦 1 𝑝 𝑤1𝑥1 𝑤2𝑥2 𝑤3𝑥3 𝑤4𝑥4 6Vectorization E.g. looping over word vectors versus concatenating them all into one large matrix and then multiplying the softmax weights with that matrix for loop 1000 loops best of 3 639 µs per loop Using single a C x N matrix 10000 loops best of 3 53.8 µs per loop Matrices are awesome Always try to use vectors and matrices rather than for loops The speed gain goes from 1 to 2 orders of magnitude with GPUs 7Parameter Initialization You normally must initialize weights to small random values i.e. not zero matrices To avoid symmetries that prevent learning specialization Initialize hidden layer biases to 0 and output or reconstruction biases to optimal value if weights were 0 e.g.']",text-embedding-3-small,512,20,2,"
You are an AI teaching Assistant for the SEP 775 course. 
You will provide an interactive platform for students to ask questions and receive guidance on course materials.
Your goal is to answer questions as accurately as possible based on the instructions and context provided.
If you found the answer based on the context provided, you should provide the answer first, then at the end, beginning a new sentence with the words ""Source:"", followed by the name of the lecture, or assignment, or paper if possible.
",0.9535660078682912,0.8,0.9138025318595606,0.0625
22,What are some approaches to address the vanishing gradient problem in RNNs?,"Some approaches to address the vanishing gradient problem in RNNs include:
1. Using Long Short Term Memory RNNs (LSTMs) proposed by Hochreiter and Schmidhuber in 1997, which are designed to mitigate the vanishing gradient issue.
2. Implementing RNNs with separate memory components, such as LSTMs, which allow for better information preservation over many timesteps.
3. Creating more direct and linear pass-through connections in the model, such as attention mechanisms and residual connections, to help alleviate the vanishing gradient problem.

Source: On the difficulty of training recurrent neural networks Pascanu et al 2013. http://proceedings.mlr.press/v28/pascanu13.pdf","['Problems with RNNs Vanishing and Exploding Gradients 48Vanishing gradient intuition 49Vanishing gradient intuition chain rule 50Vanishing gradient intuition chain rule 51Vanishing gradient intuition chain rule 52Vanishing gradient intuition What happens if these are small Vanishing gradient problem When these are small the gradient signal gets smaller and smaller as it backpropagates further 53Vanishing gradient proof sketch linear case Recall What if were the identity function 53 Source On the difficulty of training recurrent neural networks Pascanu et al 2013. http proceedings.mlr.press v28 pascanu13.pdf and supplemental materials at http proceedings.mlr.press v28 pascanu13 supp.pdf If Wh is small then this term gets exponentially problematic as becomes large chain rule Consider the gradient of the loss on step with respect to the hidden state on some previous step . Let chain rule value of ONLY READ IF INTERESTEDVanishing gradient proof sketch linear case What s wrong with Consider if the eigenvalues of are all less than 1 We can write as a basis What about nonlinear activations i.e. what we use Pretty much the same thing except the proof requires for some dependent on dimensionality and Source On the difficulty of training recurrent neural networks Pascanu et al 2013. http proceedings.mlr.press v28 pascanu13.pdf and supplemental materials at http proceedings.mlr.press v28 pascanu13 supp.pdf 54 eigenvectors using the eigenvectors of Approaches 0 as grows so gradient vanishes sufficient but not necessary ONLY READ IF INTERESTEDWhy is vanishing gradient a problem Gradient signal from far away is lost because it s much smaller than gradient signal from close by. So model weights are updated only with respect to near effects not long term effects. 56Effect of vanishing gradient on RNN LM 57 LM task When she tried to print her tickets she found that the printer was out of toner. She went to the stationery store to buy more toner. It was very overpriced. After installing the toner into the printer she finally printed her To learn from this training example the RNN LM needs to model the dependency between tickets on the 7th step and the target word tickets at the end.', 'But if the gradient is small the model can t learn this dependency So the model is unable to predict similar long distance dependencies at test timeWhy is exploding gradient a problem If the gradient becomes too big then the SGD update step becomes too big learning rate gradient This can cause bad updates we take too large a step and reach a weird and bad parameter configuration with large loss You think you ve found a hill to climb but suddenly you re in Iowa In the worst case this will result in Inf or NaN in your network then you have to restart training from an earlier checkpoint 58Gradient clipping solution for exploding gradient 58 Gradient clipping if the norm of the gradient is greater than some threshold scale it down before applying SGD update Intuition take a step in the same direction but a smaller step In practice remembering to clip gradients is important but exploding gradients are an easy problem to solve Source On the difficulty of training recurrent neural networks Pascanu et al 2013. http proceedings.mlr.press v28 pascanu13.pdfHow to fix the vanishing gradient problem The main problem is that it s too difficult for the RNN to learn to preserve information over many timesteps. In a vanilla RNN the hidden state is constantly being rewritten First off next time How about an RNN with separate memory which is added to LSTMs And then Creating more direct and linear pass through connections in model Attention residual connections etc. 60Long Short Term Memory RNNs LSTMs A type of RNN proposed by Hochreiter and Schmidhuber in 1997 as a solution to the problem of vanishing gradients Everyone cites that paper but really a crucial part of the modern LSTM is from Gers et al. 2000 Only started to be recognized as promising through the work of S s student Alex Graves c. 2006 Work in which he also invented CTC connectionist temporal classification for speech recognition But only really became well known after Hinton brought it to Google in 2013 Following Graves having been a postdoc with Hinton 61 Hochreiter and Schmidhuber 1997. Long short term memory. https www.bioinf.jku.at publications older 2604.pdf Gers Schmidhuber and Cummins 2000. Learning to Forget Continual Prediction with LSTM.']",text-embedding-3-small,512,20,2,"
You are an AI teaching Assistant for the SEP 775 course. 
You will provide an interactive platform for students to ask questions and receive guidance on course materials.
Your goal is to answer questions as accurately as possible based on the instructions and context provided.
If you found the answer based on the context provided, you should provide the answer first, then at the end, beginning a new sentence with the words ""Source:"", followed by the name of the lecture, or assignment, or paper if possible.
",1.0000000000000009,1.0,0.872486515081448,0.0625
23,"What is perplexity, and how is it used in evaluating language models?","Perplexity is a measurement used in evaluating language models. It is the geometric mean of the probabilities assigned by the model to each word in a test set. A lower perplexity indicates that the model is more certain about its predictions and is better at predicting the test set. In other words, minimizing perplexity is equivalent to maximizing the test set probability according to the language model. Perplexity can be seen as a way to measure how well a language model predicts a given text or sequence of words. It is used to compare different language models, with lower perplexity values indicating better performance. However, it is important to note that perplexity alone does not guarantee improved performance in tasks like speech recognition or machine translation. It is commonly used as a quick check on the effectiveness of a language model, but any improvements in perplexity should be confirmed through end-to-end evaluations on real tasks before drawing conclusions about the model's overall performance.

Source: Lecture notes on N-gram Language Models.","['Here s the perplexity of W with a unigram language model just the geometric mean of the unigram probabilities perplexity W N v u u t N Y i 1 1 P wi 3.16 The perplexity of W computed with a bigram language model is still a geometric mean but now of the bigram probabilities perplexity W N v u u t N Y i 1 1 P wi wi 1 3.17 Note that because of the inverse in Eq. 3.15 the higher the conditional probabil ity of the word sequence the lower the perplexity. Thus minimizing perplexity is equivalent to maximizing the test set probability according to the language model. What we generally use for word sequence in Eq. 3.15 or Eq. 3.17 is the entire se quence of words in some test set. Since this sequence will cross many sentence boundaries we need to include the begin and end sentence markers s and s in the probability computation. We also need to include the end of sentence marker s but not the beginning of sentence marker s in the total count of word to kens N. There is another way to think about perplexity as the weighted average branch ing factor of a language. The branching factor of a language is the number of possi ble next words that can follow any word. Consider the task of recognizing the digits3.2 EVALUATING LANGUAGE MODELS 9 in English zero one two ... nine given that both in some training set and in some test set each of the 10 digits occurs with equal probability P 1 10. The perplexity of this mini language is in fact 10. To see that imagine a test string of digits of length N and assume that in the training set all the digits occurred with equal probability. By Eq. 3.15 the perplexity will be perplexity W P w1w2 ...wN 1 N 1 10 N 1 N 1 10 1 10 3.18 But suppose that the number zero is really frequent and occurs far more often than other numbers. Let s say that 0 occur 91 times in the training set and each of the other digits occurred 1 time each.', 'Any kind of knowledge of the test set can cause the perplexity to be artiﬁcially low. The perplexity of two language models is only comparable if they use identical vocabularies. An intrinsic improvement in perplexity does not guarantee an extrinsic im provement in the performance of a language processing task like speech recognition10 CHAPTER 3 N GRAM LANGUAGE MODELS or machine translation. Nonetheless because perplexity often correlates with such improvements it is commonly used as a quick check on an algorithm. But a model s improvement in perplexity should always be conﬁrmed by an end to end evaluation of a real task before concluding the evaluation of the model. 3.3 Sampling sentences from a language model One important way to visualize what kind of knowledge a language model embodies is to sample from it. Sampling from a distribution means to choose random points sampling according to their likelihood. Thus sampling from a language model which rep resents a distribution over sentences means to generate some sentences choosing each sentence according to its likelihood as deﬁned by the model. Thus we are more likely to generate sentences that the model thinks have a high probability and less likely to generate sentences that the model thinks have a low probability. This technique of visualizing a language model by sampling was ﬁrst suggested very early on by Shannon 1951 and Miller and Selfridge 1950 . It s simplest to visualize how this works for the unigram case. Imagine all the words of the English language covering the probability space between 0 and 1 each word covering an interval proportional to its frequency. Fig. 3.3 shows a visualization using a unigram LM computed from the text of this book. We choose a random value between 0 and 1 ﬁnd that point on the probability line and print the word whose interval includes this chosen value. We continue choosing random numbers and generating words until we randomly generate the sentence ﬁnal token s .']",text-embedding-3-small,512,20,2,"
You are an AI teaching Assistant for the SEP 775 course. 
You will provide an interactive platform for students to ask questions and receive guidance on course materials.
Your goal is to answer questions as accurately as possible based on the instructions and context provided.
If you found the answer based on the context provided, you should provide the answer first, then at the end, beginning a new sentence with the words ""Source:"", followed by the name of the lecture, or assignment, or paper if possible.
",0.9377451467611764,1.0,0.9463004537836776,0.0333333333333333
24,How does LSTM solve the vanishing gradient problem?,"LSTMs (Long Short Term Memory networks) were proposed as a solution to the vanishing gradient problem in RNNs. They address this issue by introducing a mechanism called ""gates"" that regulate the flow of information in and out of the memory cell. These gates consist of the input gate, forget gate, and output gate, which control the information to be stored, forgotten, or outputted respectively. By selectively retaining or updating information over time, LSTMs can better preserve long-term dependencies and mitigate the vanishing gradient problem compared to traditional RNNs.","['But if the gradient is small the model can t learn this dependency So the model is unable to predict similar long distance dependencies at test timeWhy is exploding gradient a problem If the gradient becomes too big then the SGD update step becomes too big learning rate gradient This can cause bad updates we take too large a step and reach a weird and bad parameter configuration with large loss You think you ve found a hill to climb but suddenly you re in Iowa In the worst case this will result in Inf or NaN in your network then you have to restart training from an earlier checkpoint 58Gradient clipping solution for exploding gradient 58 Gradient clipping if the norm of the gradient is greater than some threshold scale it down before applying SGD update Intuition take a step in the same direction but a smaller step In practice remembering to clip gradients is important but exploding gradients are an easy problem to solve Source On the difficulty of training recurrent neural networks Pascanu et al 2013. http proceedings.mlr.press v28 pascanu13.pdfHow to fix the vanishing gradient problem The main problem is that it s too difficult for the RNN to learn to preserve information over many timesteps. In a vanilla RNN the hidden state is constantly being rewritten First off next time How about an RNN with separate memory which is added to LSTMs And then Creating more direct and linear pass through connections in model Attention residual connections etc. 60Long Short Term Memory RNNs LSTMs A type of RNN proposed by Hochreiter and Schmidhuber in 1997 as a solution to the problem of vanishing gradients Everyone cites that paper but really a crucial part of the modern LSTM is from Gers et al. 2000 Only started to be recognized as promising through the work of S s student Alex Graves c. 2006 Work in which he also invented CTC connectionist temporal classification for speech recognition But only really became well known after Hinton brought it to Google in 2013 Following Graves having been a postdoc with Hinton 61 Hochreiter and Schmidhuber 1997. Long short term memory. https www.bioinf.jku.at publications older 2604.pdf Gers Schmidhuber and Cummins 2000. Learning to Forget Continual Prediction with LSTM.', 'Problems with RNNs Vanishing and Exploding Gradients 48Vanishing gradient intuition 49Vanishing gradient intuition chain rule 50Vanishing gradient intuition chain rule 51Vanishing gradient intuition chain rule 52Vanishing gradient intuition What happens if these are small Vanishing gradient problem When these are small the gradient signal gets smaller and smaller as it backpropagates further 53Vanishing gradient proof sketch linear case Recall What if were the identity function 53 Source On the difficulty of training recurrent neural networks Pascanu et al 2013. http proceedings.mlr.press v28 pascanu13.pdf and supplemental materials at http proceedings.mlr.press v28 pascanu13 supp.pdf If Wh is small then this term gets exponentially problematic as becomes large chain rule Consider the gradient of the loss on step with respect to the hidden state on some previous step . Let chain rule value of ONLY READ IF INTERESTEDVanishing gradient proof sketch linear case What s wrong with Consider if the eigenvalues of are all less than 1 We can write as a basis What about nonlinear activations i.e. what we use Pretty much the same thing except the proof requires for some dependent on dimensionality and Source On the difficulty of training recurrent neural networks Pascanu et al 2013. http proceedings.mlr.press v28 pascanu13.pdf and supplemental materials at http proceedings.mlr.press v28 pascanu13 supp.pdf 54 eigenvectors using the eigenvectors of Approaches 0 as grows so gradient vanishes sufficient but not necessary ONLY READ IF INTERESTEDWhy is vanishing gradient a problem Gradient signal from far away is lost because it s much smaller than gradient signal from close by. So model weights are updated only with respect to near effects not long term effects. 56Effect of vanishing gradient on RNN LM 57 LM task When she tried to print her tickets she found that the printer was out of toner. She went to the stationery store to buy more toner. It was very overpriced. After installing the toner into the printer she finally printed her To learn from this training example the RNN LM needs to model the dependency between tickets on the 7th step and the target word tickets at the end.']",text-embedding-3-small,512,20,2,"
You are an AI teaching Assistant for the SEP 775 course. 
You will provide an interactive platform for students to ask questions and receive guidance on course materials.
Your goal is to answer questions as accurately as possible based on the instructions and context provided.
If you found the answer based on the context provided, you should provide the answer first, then at the end, beginning a new sentence with the words ""Source:"", followed by the name of the lecture, or assignment, or paper if possible.
",0.8623146416943716,1.0,0.91999408173033,0.0625
25,"What is the impact of bidirectional RNNs, and where are they applicable?","Bidirectional RNNs have the capability to consider both past and future words in a sequence, allowing them to capture more context and dependencies in the data. They are applicable in tasks where information from both directions is crucial for making accurate predictions, such as machine translation where understanding the context of the entire sentence is important for accurate translation. Additionally, bidirectional RNNs are useful in sentiment analysis, named entity recognition, and speech recognition tasks where context from both directions is valuable for making predictions.","['h h h Figure 8 A bi directional RNN model h t f W xt V h t 1 b 17 h t f W xt V h t 1 b 18 ˆ yt g Uht c g U h t h t c 19 RNNs can also be multi layered. Figure 9 shows a multi layer bi directional RNN where each lower layer feeds the next layer. As shown in this ﬁgure in this network architecture at time step t each interme diate neuron receives one set of parameters from the previous time step in the same RNN layer and two sets of parameters from the previous RNN hidden layer one input comes from the left to right RNN and the other from the right to left RNN. To construct a Deep RNN with L layers the above relationships are modiﬁed to the relationships in Equations 20 and 21 where the input to each intermediate neuron at level i is the output of the RNN at layer i 1 at the same time step t. The output ˆ y at each time step is the result of propagating input parameters through all hidden layers Equation 22 . Going Deep h i t f W i ht i 1 h i t f W i ht i 1 yt g U h t L h y h 3 x Each memory layer passes an intermediate seq representation to the next. h 2 h 1 Figure 9 A deep bi directional RNN with three RNN layers. h i t f W i h i 1 t V i h i t 1 b i 20 h i t f W i h i 1 t V i h i t 1 b i 21 ˆ yt g Uht c g U h L t h L t c 22 2.6 Application RNN Translation Model Traditional translation models are quite complex they consist of nu merous machine learning algorithms applied to different stages of the language translation pipeline. In this section we discuss the potential for adopting RNNs as a replacement to traditional translation mod ules. Consider the RNN example model shown in Figure 10 here the German phrase Echt dicke Kiste is translated to Awesome sauce.', 'av steps. 3. Dealing wi vanishing g 3.1. Previous so Using an L1 or L2 help with explodin ters initialized wit Wrec is probably that the gradient tion found in secti ensure that durin exceeds 1. This a ple regime with a where any informa Figure 7 Gradient explosion clipping visualization To solve the problem of vanishing gradients we introduce two tech niques. The ﬁrst technique is that instead of initializing W hh ran domly start off from an identity matrix initialization. The second technique is to use the Rectiﬁed Linear Units ReLU in stead of the sigmoid function. The derivative for the ReLU is either 0 or 1. This way gradients would ﬂow through the neurons whose deriva tive is 1 without getting attenuated while propagating back through time steps. 2.5 Deep Bidirectional RNNs So far we have focused on RNNs that condition on past words to predict the next word in the sequence. It is possible to make predic tions based on future words by having the RNN model read through the corpus backwards. Irsoy et al. shows a bi directional deep neu ral network at each time step t this network maintains two hidden layers one for the left to right propagation and another for the right to left propagation. To maintain two hidden layers at any time this network consumes twice as much memory space for its weight and bias parameters. The ﬁnal classiﬁcation result ˆ yt is generated through combining the score results produced by both RNN hidden layers. Fig ure 8 shows the bi directional network architecture and Equations 17 and 18 show the mathematical formulation behind setting up the bi directional RNN hidden layer. The only difference between these two relationships is in the direction of recursing through the corpus. Equa tion 19 shows the classiﬁcation relationship used for predicting the next word via summarizing past and future word representations. Bidirectionality h t f W xt V h t f W xt V yt g U h t h t y h x now represents summarizes the past and around a single token.']",text-embedding-3-small,512,20,2,"
You are an AI teaching Assistant for the SEP 775 course. 
You will provide an interactive platform for students to ask questions and receive guidance on course materials.
Your goal is to answer questions as accurately as possible based on the instructions and context provided.
If you found the answer based on the context provided, you should provide the answer first, then at the end, beginning a new sentence with the words ""Source:"", followed by the name of the lecture, or assignment, or paper if possible.
",0.9320110807255396,0.8,0.9457046679883138,0.0357142857142857
26,Describe the concept of multi-layer or stacked RNNs and their benefit.,"Multi-layer or stacked RNNs involve applying multiple RNNs on top of each other, allowing the network to compute more complex representations. The lower RNN layers compute lower-level features, while the higher RNN layers compute higher-level features. Stacked RNNs work better than having just one layer of high-dimensional encodings. High-performing RNNs are usually multi-layered, with 2 to 4 layers being optimal for tasks like Neural Machine Translation. Skip connections or dense connections are often used to train deeper RNNs effectively. Transformer-based networks like BERT are typically deeper, with 12 or 24 layers. Ultimately, multi-layer RNNs enable the network to capture more intricate patterns and relationships in the data, leading to improved performance in various NLP tasks.

Source: Lecture03_RNNs_and_LLMs","['You will learn more about transformers including BERT in a couple of weeksMulti layer RNNs RNNs are already deep on one dimension they unroll over many timesteps We can also make them deep in another dimension by applying multiple RNNs this is a multi layer RNN. This allows the network to compute more complex representations The lower RNNs should compute lower level features and the higher RNNs should compute higher level features. Multi layer RNNs are also called stacked RNNs. 80Multi layer RNNs was terribly exciting the movie RNN layer 1 RNN layer 2 81 RNN layer 3 The hidden states from RNN layer i are the inputs to RNN layer i 1Multi layer RNNs in practice 39 Multi layer or stacked RNNs allow a network to compute more complex representations they work better than just have one layer of high dimensional encodings The lower RNNs should compute lower level features and the higher RNNs should compute higher level features. High performing RNNs are usually multi layer but aren t as deep as convolutional or feed forward networks For example In a 2017 paper Britz et al. find that for Neural Machine Translation 2 to 4 layers is best for the encoder RNN and 4 layers is best for the decoder RNN Often 2 layers is a lot better than 1 and 3 might be a little better than 2 Usually skip connections dense connections are needed to train deeper RNNs e.g. 8 layers Transformer based networks e.g. BERT are usually deeper like 12 or 24 layers. You will learn about Transformers later they have a lot of skipping like connections Massive Exploration of Neural Machine Translation Architecutres Britz et al 2017. https arxiv.org pdf 1703.03906.pdfTerminology By the end of the course You will understand phrases like stacked bidirectional LSTMs with residual connections and self attention The RNN described in this lecture simple vanilla Elman RNN You learned about other RNN flavors like LSTM and GRU and multi layer RNNs 83', 'h h h Figure 8 A bi directional RNN model h t f W xt V h t 1 b 17 h t f W xt V h t 1 b 18 ˆ yt g Uht c g U h t h t c 19 RNNs can also be multi layered. Figure 9 shows a multi layer bi directional RNN where each lower layer feeds the next layer. As shown in this ﬁgure in this network architecture at time step t each interme diate neuron receives one set of parameters from the previous time step in the same RNN layer and two sets of parameters from the previous RNN hidden layer one input comes from the left to right RNN and the other from the right to left RNN. To construct a Deep RNN with L layers the above relationships are modiﬁed to the relationships in Equations 20 and 21 where the input to each intermediate neuron at level i is the output of the RNN at layer i 1 at the same time step t. The output ˆ y at each time step is the result of propagating input parameters through all hidden layers Equation 22 . Going Deep h i t f W i ht i 1 h i t f W i ht i 1 yt g U h t L h y h 3 x Each memory layer passes an intermediate seq representation to the next. h 2 h 1 Figure 9 A deep bi directional RNN with three RNN layers. h i t f W i h i 1 t V i h i t 1 b i 20 h i t f W i h i 1 t V i h i t 1 b i 21 ˆ yt g Uht c g U h L t h L t c 22 2.6 Application RNN Translation Model Traditional translation models are quite complex they consist of nu merous machine learning algorithms applied to different stages of the language translation pipeline. In this section we discuss the potential for adopting RNNs as a replacement to traditional translation mod ules. Consider the RNN example model shown in Figure 10 here the German phrase Echt dicke Kiste is translated to Awesome sauce.']",text-embedding-3-small,512,20,2,"
You are an AI teaching Assistant for the SEP 775 course. 
You will provide an interactive platform for students to ask questions and receive guidance on course materials.
Your goal is to answer questions as accurately as possible based on the instructions and context provided.
If you found the answer based on the context provided, you should provide the answer first, then at the end, beginning a new sentence with the words ""Source:"", followed by the name of the lecture, or assignment, or paper if possible.
",0.9358869366896716,1.0,0.9533673581167378,0.0588235294117647
27,How does Dropout work during training and testing?,"During training, Dropout works by randomly dropping a subset of neurons with a certain probability (1-p) during each forward and backward pass. This means that some neurons are set to zero while others are kept alive with a probability p. During testing, all weights are multiplied by 1/p, and no dropout is applied. This technique helps prevent overfitting by effectively training multiple smaller networks simultaneously and averaging their predictions, leading to more meaningful learning from the data and higher performance overall on the task at hand.

Source: lecture02_notes_Backpropagation.txt","['Imposing such a con straint can also be interpreted as the prior Bayesian belief that the optimal weights are close to zero how close depends on the value of λ. Choosing the right value of λ is critical and must be chosen via hyperparameter tuning. Too high a value of λ causes most of the weights to be set too close to 0 and the model does not learn anything meaningful from the training data often obtaining poor ac curacy on training validation and testing sets. Too low a value and we fall into the domain of overﬁtting once again. It must be noted that the bias terms are not regularized and do not contribute to the cost term above try thinking about why this is the case There are indeed other types of regularization that are sometimes used such as L1 regularization which sums over the absolute values rather than squares of parameter elements however this is less commonly applied in practice since it leads to sparsity of parameter weights. In the next section we discuss dropout which effectively acts as another form of regularization by randomly dropping i.e. setting to zero neurons in the forward pass. 2.3 Dropout Dropout is a powerful technique for regularization ﬁrst introduced by Srivastava et al. in Dropout A Simple Way to Prevent Neural Net works from Overﬁtting. The idea is simple yet effective during train ing we will randomly drop with some probability 1 p a subset of neurons during each forward backward pass or equivalently we will keep alive each neuron with a probability p . Then during testing we will use the full network to compute our predictions. The result is that the network typically learns more meaningful informa tion from the data is less likely to overﬁt and usually obtains higher performance overall on the task at hand. One intuitive reason why this technique should be so effective is that what dropout is doing is essentially doing is training exponentially many smaller networks at once and averaging over their predictions. Dropout applied to an artiﬁcial neural network. Image credits to Srivastava et al. In practice the way we introduce dropout is that we take the out put h of each layer of neurons and keep each neuron with prob ability p and else set it to 0. Then during back propagation we only pass gradients through neurons that were kept alive during the forward pass.', 'like an ensemble model Nowadays usually thought of as strong feature dependent regularizer Wager Wang Liang 2013DropoutDropout Srivastava Hinton Krizhevsky Sutskever Salakhutdinov 2012 JMLR 2014 During training For each data point each time Randomly set input to 0 with probability 𝑝 dropout ratio often p 0.5 except p 0.15 for input layer via dropout mask During testing Multiply all weights by 1 𝑝 No other dropout 𝑥2 𝑥3 0 𝑤1 𝑤2 𝑤3 𝑤4 𝑏 1 𝑦 𝑤1𝑥1 𝑤2𝑥2 𝑤3𝑥3 𝑥 𝑥 1 1 Train 1 Train 2 Test 𝑥3 0 1 𝑦 𝑤1𝑥1 𝑤3𝑥3 𝑏 𝑤1 𝑤2 𝑤3 𝑤4 𝑏 𝑥1 0 𝑥2 𝑥3 𝑥4 𝑤1 𝑤2 𝑤3 𝑤4 𝑏 1 𝑦 1 𝑝 𝑤1𝑥1 𝑤2𝑥2 𝑤3𝑥3 𝑤4𝑥4 6Vectorization E.g. looping over word vectors versus concatenating them all into one large matrix and then multiplying the softmax weights with that matrix for loop 1000 loops best of 3 639 µs per loop Using single a C x N matrix 10000 loops best of 3 53.8 µs per loop Matrices are awesome Always try to use vectors and matrices rather than for loops The speed gain goes from 1 to 2 orders of magnitude with GPUs 7Parameter Initialization You normally must initialize weights to small random values i.e. not zero matrices To avoid symmetries that prevent learning specialization Initialize hidden layer biases to 0 and output or reconstruction biases to optimal value if weights were 0 e.g.']",text-embedding-3-small,512,20,2,"
You are an AI teaching Assistant for the SEP 775 course. 
You will provide an interactive platform for students to ask questions and receive guidance on course materials.
Your goal is to answer questions as accurately as possible based on the instructions and context provided.
If you found the answer based on the context provided, you should provide the answer first, then at the end, beginning a new sentence with the words ""Source:"", followed by the name of the lecture, or assignment, or paper if possible.
",0.9691847791905802,1.0,0.9276308254435122,0.375
28,What is the role of parameter initialization in neural networks?,"Parameter initialization in neural networks is a key step towards achieving optimal performance. A common strategy is to initialize the weights to small random numbers distributed around 0. This helps in preventing symmetries that hinder learning. Additionally, biases are typically initialized to 0 for hidden layers and to optimal values for output or reconstruction biases. Proper parameter initialization can lead to faster convergence, lower error rates, and help maintain activation and gradient variances across layers, ultimately aiding in the training dynamics of the neural network.

Source: Lecture02_SEP775_NLP","['This is useful since input features are often measured in different units but we often want to initially consider all features as equally important. The way we accomplish this is by simply dividing the features by their respective standard deviation calculated across the training set. Whitening Not as commonly used as mean subtraction normalization whiten ing essentially converts the data to a have an identity covariance matrix that is features become uncorrelated and have a variance of 1. This is done by ﬁrst mean subtracting the data as usual to get X . We can then take the Singular Value Decomposition SVD of X to get matrices U S V. We then compute UX to project X into the basis deﬁned by the columns of U. We ﬁnally divide each dimension of the result by the corresponding singular value in S to scale our data appropriately if a singular value is zero we can just divide by a small number instead . 2.6 Parameter Initialization A key step towards achieving superlative performance with a neu ral network is initializing the parameters in a reasonable way. A good starting strategy is to initialize the weights to small random numbers normally distributed around 0 and in practice this often words acceptably well. However in Understanding the dif ficulty of training deep feedforward neural networks 2010 Xavier et al study the effect of different weight and bias initialization schemes on training dynamics. The empirical ﬁndings suggest that for sigmoid and tanh activation units faster convergence and lower error rates are achieved when the weights of a matrix W Rn l 1 n l are initialized randomly with a uniform distribution as follows W U s 6 n l n l 1 s 6 n l n l 1 Where n l is the number of input units to W fan in and n l 1 is the number of output units from W fan out . In this parameter initialization scheme bias units are initialized to 0. This approach attempts to maintain activation variances as well as backpropagated gradient variances across layers. Without such initialization the gradient variances which are a proxy for information generally decrease with backpropagation across layers. 2.7 Learning Strategies The rate magnitude of model parameter updates during training can be controlled using the learning rate.', 'like an ensemble model Nowadays usually thought of as strong feature dependent regularizer Wager Wang Liang 2013DropoutDropout Srivastava Hinton Krizhevsky Sutskever Salakhutdinov 2012 JMLR 2014 During training For each data point each time Randomly set input to 0 with probability 𝑝 dropout ratio often p 0.5 except p 0.15 for input layer via dropout mask During testing Multiply all weights by 1 𝑝 No other dropout 𝑥2 𝑥3 0 𝑤1 𝑤2 𝑤3 𝑤4 𝑏 1 𝑦 𝑤1𝑥1 𝑤2𝑥2 𝑤3𝑥3 𝑥 𝑥 1 1 Train 1 Train 2 Test 𝑥3 0 1 𝑦 𝑤1𝑥1 𝑤3𝑥3 𝑏 𝑤1 𝑤2 𝑤3 𝑤4 𝑏 𝑥1 0 𝑥2 𝑥3 𝑥4 𝑤1 𝑤2 𝑤3 𝑤4 𝑏 1 𝑦 1 𝑝 𝑤1𝑥1 𝑤2𝑥2 𝑤3𝑥3 𝑤4𝑥4 6Vectorization E.g. looping over word vectors versus concatenating them all into one large matrix and then multiplying the softmax weights with that matrix for loop 1000 loops best of 3 639 µs per loop Using single a C x N matrix 10000 loops best of 3 53.8 µs per loop Matrices are awesome Always try to use vectors and matrices rather than for loops The speed gain goes from 1 to 2 orders of magnitude with GPUs 7Parameter Initialization You normally must initialize weights to small random values i.e. not zero matrices To avoid symmetries that prevent learning specialization Initialize hidden layer biases to 0 and output or reconstruction biases to optimal value if weights were 0 e.g.']",text-embedding-3-small,512,20,2,"
You are an AI teaching Assistant for the SEP 775 course. 
You will provide an interactive platform for students to ask questions and receive guidance on course materials.
Your goal is to answer questions as accurately as possible based on the instructions and context provided.
If you found the answer based on the context provided, you should provide the answer first, then at the end, beginning a new sentence with the words ""Source:"", followed by the name of the lecture, or assignment, or paper if possible.
",0.9778954036888198,1.0,0.933717291322853,0.0714285714285714
29,"What are the differences between Vanilla RNNs, LSTMs, and GRUs?","Vanilla RNNs, LSTMs, and GRUs are all types of recurrent neural networks, but they differ in their architectures and capabilities. 

1. Vanilla RNNs: Vanilla RNNs suffer from the vanishing gradient problem, which makes it difficult for them to capture long-term dependencies in sequences. They have a simple architecture where the hidden state is updated based on the current input and the previous hidden state. However, they struggle with retaining information over long sequences due to the vanishing gradient problem.

2. LSTMs (Long Short-Term Memory): LSTMs were introduced to address the vanishing gradient problem in Vanilla RNNs. They have a more complex architecture with three gates: input gate, forget gate, and output gate. These gates control the flow of information into and out of the cell state, allowing LSTMs to capture long-term dependencies more effectively than Vanilla RNNs.

3. GRUs (Gated Recurrent Units): GRUs are a variation of LSTMs that aim to simplify the architecture while retaining the ability to capture long-term dependencies. GRUs combine the forget and input gates into a single update gate and merge the cell state and hidden state. This simplification makes GRUs computationally more efficient than LSTMs while still being effective in capturing long-term dependencies.

In summary, Vanilla RNNs have a simple architecture but struggle with capturing long-term dependencies, LSTMs have a more complex architecture with specialized gates to address the vanishing gradient problem, and GRUs are a simplified version of LSTMs that are computationally efficient while still being effective in capturing long-term dependencies.

Source: SEP 775 - Computational Natural Language Processing, lecture notes and provided context.","['We only forget when we re going to input something in its place. We only input new values to the state when we forget something older. A slightly more dramatic variation on the LSTM is the Gated Recurrent Unit or GRU introduced by Cho et al. 2014 http arxiv.org pdf 1406.1078v3.pdf . It combines the forget and input gates into a single update gate. It also merges the cell state and hidden state and makes some other changes. The resulting model is simpler than standard LSTM models and has been growing increasingly popular. These are only a few of the most notable LSTM variants. There are lots of others like Depth Gated RNNs by Yao et al. 2015 http arxiv.org pdf 1508.03790v2.pdf . There s also some completely different approach to tackling long term dependencies like Clockwork RNNs by Koutnik et al. 2014 http arxiv.org pdf 1402.3511v1.pdf . Which of these variants is best Do the differences matter Greff et al. 2015 http arxiv.org pdf 1503.04069.pdf do a nice comparison of popular variants finding that they re all about the same. Jozefowicz et al. 2015 http jmlr.org proceedings papers v37 jozefowicz15.pdf tested more than ten thousand RNN architectures finding some that worked better than LSTMs on certain tasks. Conclusion Earlier I mentioned the remarkable results people are achieving with RNNs. Essentially all of these are achieved using LSTMs. They really work a lot better for most tasks Written down as a set of equations LSTMs look pretty intimidating. Hopefully walking through them step by step in this essay has made them a bit more approachable.1 24 24 3 23 PM Understanding LSTM Networks colah s blog 7 7 Attention and Augmented Recurrent Neural Networks On Distill Conv Nets A Modular Perspective Neural Networks Manifolds and Topology Deep Learning NLP and Representations LSTMs were a big step in what we can accomplish with RNNs.', 'Extension V given a word sequence A B C in German whose transla tion is X Y in English instead of training the RNN using A B C X Y train it using C B A X Y. The intutition behind this technique is that A is more likely to be translated to X. Thus given the vanishing gradient problem discussed earlier reversing the order of the input words can help reduce the error rate in generating the output phrase. 3 Gated Recurrent Units Beyond the extensions discussed so far RNNs have been found to per form better with the use of more complex units for activation. So far we have discussed methods that transition from hidden state ht 1 to ht using an afﬁne transformation and a point wise nonlinearity. Here we discuss the use of a gated activation function thereby modifying the RNN architecture. What motivates this Well although RNNs can theoretically capture long term dependencies they are very hard to actually train to do this. Gated recurrent units are designed in a manner to have more persistent memory thereby making it easier for RNNs to capture long term dependencies. Let us see mathematically how a GRU uses ht 1 and xt to generate the next hidden state ht. We will then dive into the intuition of this architecture. zt σ W z xt U z ht 1 Update gate rt σ W r xt U r ht 1 Reset gate ht tanh rt Uht 1 Wxt New memory ht 1 zt ht zt ht 1 Hidden state The above equations can be thought of a GRU s four fundamental op erational stages and they have intuitive interpretations that make this model much more intellectually satisfying see Figure 12 1. New memory generation A new memory ht is the consolidation of a new input word xt with the past hidden state ht 1. Anthropomor phically this stage is the one who knows the recipe of combining a newly observed word with the past hidden state ht 1 to summarize this new word in light of the contextual past as the vector ht. 2. Reset Gate The reset signal rt is responsible for determining how important ht 1 is to the summarization ht.']",text-embedding-3-small,512,20,2,"
You are an AI teaching Assistant for the SEP 775 course. 
You will provide an interactive platform for students to ask questions and receive guidance on course materials.
Your goal is to answer questions as accurately as possible based on the instructions and context provided.
If you found the answer based on the context provided, you should provide the answer first, then at the end, beginning a new sentence with the words ""Source:"", followed by the name of the lecture, or assignment, or paper if possible.
",0.9635808261014066,1.0,0.9572725395704148,0.037037037037037
30,What is the difference between traditional language models and conditioned language models?,"Traditional language models are generative models of text, while conditioned language models generate text according to some specification or input. Conditioned language models take into account additional information or context when generating text, allowing for more controlled and specific text generation based on the given input or condition.

Source: SEP 775 - Computational Natural Language Processing, lecture04 Conditioned Generation.","['file name: lecture04 Conditioned Generation. Hamidreza Mahyar mahyarh@mcmaster.ca Computational Natural Language Processing Conditioned GenerationLanguage Models Language models are generative models of text s P x The Malfoys said Hermione. Harry was watching him. He looked like Madame Maxime. When she strode up the wrong staircase to visit himself. I m afraid I ve definitely been suspended from power no chance indeed said Snape. He put his head back behind them and read groups as they crossed a corner and fluttered down onto their ink lamp and picked up his spoon. The doorbell rang. It was a lot cleaner down in London. Text Credit Max Deutsch https medium.com deep writingConditioned Language Models Not just generate text generate text according to some specification Input X Structured Data English Document Utterance Image Speech Output Y Text NL Description Japanese Short Description Response Text Transcript Task NL Generation Translation Summarization Response Generation Image Captioning Speech RecognitionFormulation and ModelingCalculating the Probability of a SentenceConditional Language ModelsOne Type of Language Model LSTM LSTM LSTM LSTM predict hate predict this predict movie predict s LSTM Mikolov et al. 2011 s I hate this movie predict ILSTM LSTM LSTM LSTM LSTM s LSTM LSTM LSTM LSTM argmax argmax argmax argmax argmax s One Type of Conditional Language Model I hate this movie kono eiga ga kirai hate this movie Sutskever et al. 2014 Encoder I DecoderHow to Pass Hidden State Initialize decoder w encoder Sutskever et al. 2014 encoder decoder Transform can be different dimensions encoder transform decoder encoder Input at every time step Kalchbrenner Blunsom 2013 decoder decoder decoderMethods of GenerationThe Generation Problem We have a model of P Y X how do we use it to generate a sentence Two methods Sampling Try to generate a random sentence according to the probability distribution. Argmax Try to generate the sentence with the highest probability.Ancestral Sampling Randomly generate words one by one.', 'For instance HLW 20 observe that larger models do not necessarily generalize better out of distribution. There is evidence that suggests that the generalization achieved under this paradigm can be poor because the model is overly speciﬁc to the training distribution and does not generalize well outside it YdC 19 MPL19 . Thus the performance of ﬁne tuned models on speciﬁc benchmarks even when it is nominally at human level may exaggerate actual performance on the underlying task GSL 18 NK19 . Third humans do not require large supervised datasets to learn most language tasks a brief directive in natural language e.g. please tell me if this sentence describes something happy or something sad or at most a tiny number of demonstrations e.g. here are two examples of people acting brave please give a third example of bravery is often Figure 1.1 Language model meta learning. During unsupervised pre training a language model develops a broad set of skills and pattern recognition abilities. It then uses these abilities at inference time to rapidly adapt to or recognize the desired task. We use the term in context learning to describe the inner loop of this process which occurs within the forward pass upon each sequence. The sequences in this diagram are not intended to be representative of the data a model would see during pre training but are intended to show that there are sometimes repeated sub tasks embedded within a single sequence. 3Figure 1.2 Larger models make increasingly efﬁcient use of in context information. We show in context learning performance on a simple task requiring the model to remove random symbols from a word both with and without a natural language task description see Sec. 3.9.2 . The steeper in context learning curves for large models demonstrate improved ability to learn a task from contextual information. We see qualitatively similar behavior across a wide range of tasks. sufﬁcient to enable a human to perform a new task to at least a reasonable degree of competence. Aside from pointing to a conceptual limitation in our current NLP techniques this adaptability has practical advantages it allows humans to seamlessly mix together or switch between many tasks and skills for example performing addition during a lengthy dialogue.']",text-embedding-3-small,512,20,2,"
You are an AI teaching Assistant for the SEP 775 course. 
You will provide an interactive platform for students to ask questions and receive guidance on course materials.
Your goal is to answer questions as accurately as possible based on the instructions and context provided.
If you found the answer based on the context provided, you should provide the answer first, then at the end, beginning a new sentence with the words ""Source:"", followed by the name of the lecture, or assignment, or paper if possible.
",0.9701408609702442,1.0,0.9629038673321232,0.0
31,How can LSTM networks be used in language modeling?,"LSTM networks can be used in language modeling to predict the next word in a sequence. They have been successful in tasks such as handwriting recognition, speech recognition, machine translation, parsing, image captioning, and generating language models. LSTMs have become the dominant approach for most NLP tasks due to their ability to handle sequential data effectively and capture long-term dependencies in the data. Additionally, LSTMs have been used to build language models that help in measuring progress on predicting language use and are a subcomponent of many NLP tasks involving generating text or estimating the probability of text.","['are hard to train Another solution lots of new deep feedforward convolutional architectures add more direct connections thus allowing the gradient to flow Deep Residual Learning for Image Recognition He et al 2015. https arxiv.org pdf 1512.03385.pdfLSTMs real world success 68 In 2013 2015 LSTMs started achieving state of the art results Successful tasks include handwriting recognition speech recognition machine translation parsing and image captioning as well as language models LSTMs became the dominant approach for most NLP tasks Now 2019 2023 Transformers have become dominant for all tasks For example in WMT a Machine Translation conference competition In WMT 2014 there were 0 neural machine translation systems In WMT 2016 the summary report contains RNN 44 times and these systems won In WMT 2019 RNN 7 times Transformer 105 times Source Findings of the 2016 Conference on Machine Translation WMT16 Bojar et al. 2016 http www.statmt.org wmt16 pdf W16 2301.pdf Source Findings of the 2018 Conference on Machine Translation WMT18 Bojar et al. 2018 http www.statmt.org wmt18 pdf WMT028.pdf Source Findings of the 2019 Conference on Machine Translation WMT19 Barrault et al. 2019 http www.statmt.org wmt18 pdf WMT028.pdf5. Recap 69 Language Model A system that predicts the next word Recurrent Neural Network A family of neural networks that Take sequential input of any length Apply the same weights on each step Can optionally produce output on each step Recurrent Neural Network Language Model We ve shown that RNNs are a great way to build a LM despite some problems RNNs are also useful for much moreWhy should we care about Language Modeling 70 Language Modeling is a benchmark task that helps us measure our progress on predicting language use Language Modeling is a subcomponent of many NLP tasks especially those involving generating text or estimating the probability of text Predictive typing Speech recognition Handwriting recognition Spelling grammar correction Authorship identification Machine translation Summarization Dialogue etc.', 'Everything else in NLP has now been rebuilt upon Language Modeling GPT 3 is an LMOther RNN ArchitecturesOther RNN uses RNNs can be used for sequence tagging e.g. part of speech tagging named entity recognition knocked over the vase the startled cat 72 VBN IN DT NN DT JJ NNthe movie a lot overall I enjoyed positive Sentence encoding 73 How to compute sentence encoding RNNs can be used for sentence classification e.g. sentiment classificationthe movie a lot overall I enjoyed positive Sentence encoding 74 equals How to compute sentence encoding Basic way Use final hidden state RNNs can be used for sentence classification e.g. sentiment classificationRNNs can be used for sentence classification the movie a lot overall I enjoyed positive Sentence encoding How to compute sentence encoding 75 Usually better Take element wise max or mean of all hidden states e.g. sentiment classificationRNNs can be used as an encoder module e.g. question answering machine translation many other tasks Context Ludwig van Beethoven was a German composer and pianist. A crucial figure Beethoven Question what nationality was Here the RNN acts as an encoder for the Question the hidden states represent the Question . The encoder is part of a larger neural system. Answer German 76 lots of neural architecture lots of neural architectureRNN LMs can be used to generate text e.g. speech recognition machine translation summarization RNN LM what s the the weather what s This is an example of a conditional language model. We ll see Machine Translation in much more detail next lectures. Input audio START conditioning 77Bidirectional RNNs was terribly exciting the movie Forward RNN Backward RNN Concatenated hidden states This contextual representation of terribly has both left and right context 78Bidirectional RNNs 79 Note bidirectional RNNs are only applicable if you have access to the entire input sequence They are not applicable to Language Modeling because in LM you only have left context available. If you do have entire input sequence e.g. any kind of encoding bidirectionality is powerful you should use it by default . For example BERT Bidirectional Encoder Representations from Transformers is a powerful pretrained contextual representation system built on bidirectionality.']",text-embedding-3-small,512,20,2,"
You are an AI teaching Assistant for the SEP 775 course. 
You will provide an interactive platform for students to ask questions and receive guidance on course materials.
Your goal is to answer questions as accurately as possible based on the instructions and context provided.
If you found the answer based on the context provided, you should provide the answer first, then at the end, beginning a new sentence with the words ""Source:"", followed by the name of the lecture, or assignment, or paper if possible.
",0.8908874928551955,0.6,0.949869518966776,0.0909090909090909
32,What are the methods of generation in conditioned language modeling?,"The methods of generation in conditioned language modeling are Sampling and Argmax. Sampling involves trying to generate a random sentence according to the probability distribution, while Argmax involves trying to generate the sentence with the highest probability.","['file name: lecture04 Conditioned Generation. Hamidreza Mahyar mahyarh@mcmaster.ca Computational Natural Language Processing Conditioned GenerationLanguage Models Language models are generative models of text s P x The Malfoys said Hermione. Harry was watching him. He looked like Madame Maxime. When she strode up the wrong staircase to visit himself. I m afraid I ve definitely been suspended from power no chance indeed said Snape. He put his head back behind them and read groups as they crossed a corner and fluttered down onto their ink lamp and picked up his spoon. The doorbell rang. It was a lot cleaner down in London. Text Credit Max Deutsch https medium.com deep writingConditioned Language Models Not just generate text generate text according to some specification Input X Structured Data English Document Utterance Image Speech Output Y Text NL Description Japanese Short Description Response Text Transcript Task NL Generation Translation Summarization Response Generation Image Captioning Speech RecognitionFormulation and ModelingCalculating the Probability of a SentenceConditional Language ModelsOne Type of Language Model LSTM LSTM LSTM LSTM predict hate predict this predict movie predict s LSTM Mikolov et al. 2011 s I hate this movie predict ILSTM LSTM LSTM LSTM LSTM s LSTM LSTM LSTM LSTM argmax argmax argmax argmax argmax s One Type of Conditional Language Model I hate this movie kono eiga ga kirai hate this movie Sutskever et al. 2014 Encoder I DecoderHow to Pass Hidden State Initialize decoder w encoder Sutskever et al. 2014 encoder decoder Transform can be different dimensions encoder transform decoder encoder Input at every time step Kalchbrenner Blunsom 2013 decoder decoder decoderMethods of GenerationThe Generation Problem We have a model of P Y X how do we use it to generate a sentence Two methods Sampling Try to generate a random sentence according to the probability distribution. Argmax Try to generate the sentence with the highest probability.Ancestral Sampling Randomly generate words one by one.', 'An exact method for sampling from P X no further work needed.Greedy Search One by one pick the single highest probability word Not exact real problems Will often generate the easy words first Will prefer multiple common words to one rare wordBeam Search Instead of picking one high probability word maintain several paths Some in reading materials more in a later classModel EnsemblingEnsembling Why Multiple models make somewhat uncorrelated errors Models tend to be more uncertain when they are about to make errors Smooths over idiosyncrasies of the model LSTM1 predict1 I LSTM2 predict2 Combine predictions from multiple models s sLinear Interpolation Take a weighted average of the M model probabilities Second term often set to uniform distribution 1 MLog linear Interpolation Weighted combination of log probabilities normalize Interpolation coefficient often set to uniform distribution 1 MLinear or Log Linear Think of it in logic Linear Logical OR the interpolated model likes any choice that a model gives a high probability use models with models that capture different traits necessary when any model can assign zero probability Log Linear Logical AND interpolated model only likes choices where all models agree use when you want to restrict possible answersParameter Averaging Problem Ensembling means we have to use M models at test time increasing our time memory complexity Parameter averaging is a cheap way to get some good effects of ensembling Basically write out models several times near the end of training and take the average of parametersEnsemble Distillation e.g. Kim et al. 2016 Problem parameter averaging only works for models within the same run Knowledge distillation trains a model to copy the ensemble Specifically it tries to match the description over predicted words Why We want the model to make the same mistakes as an ensemble Shown to increase accuracy notablyStacking What if we have two very different models where prediction of outputs is done in very different ways e.g. a phrase based translation model and a neural MT model Niehues et al. 2017 Stacking uses the output of one system in calculating features for another systemCase Studies in Conditional Language ModelingFrom Images e.g. Karpathy et al. 2015 Input is image features output is text Use standard image encoders e.g.']",text-embedding-3-small,512,20,2,"
You are an AI teaching Assistant for the SEP 775 course. 
You will provide an interactive platform for students to ask questions and receive guidance on course materials.
Your goal is to answer questions as accurately as possible based on the instructions and context provided.
If you found the answer based on the context provided, you should provide the answer first, then at the end, beginning a new sentence with the words ""Source:"", followed by the name of the lecture, or assignment, or paper if possible.
",1.0000000000000002,1.0,0.9533169432150654,0.0833333333333333
33,What is beam search and how is it used in language generation?,"Beam search is a decoding algorithm used in natural language processing for generating sequences like sentences. It is an alternative to greedy decoding, where instead of picking the single highest probability word at each step, beam search maintains several paths or hypotheses. On each step of the decoder, beam search keeps track of the k most probable partial translations (hypotheses), where k is the beam size (usually around 5 to 10 in practice). Each hypothesis has a score based on its log probability, and the algorithm searches for high-scoring hypotheses by tracking the top k on each step. While beam search is not guaranteed to find the optimal solution, it is much more efficient than exhaustive search, where all possible sequences are computed, making it a popular choice for language generation tasks.

Source: lecture05_Seq2Seq","['2014 Luong et al. 2015 The hidden states from RNN layer i are the inputs to RNN layer i 1Decoding Greedy decoding We saw how to generate or decode the target sentence by taking argmax on each step of the decoder he hit me with a pie END START he hit me with a pie This is greedy decoding take most probable word on each step argmax argmax argmax argmax 15 argmax argmax argmaxProblems with greedy decoding 16 Greedy decoding has no way to undo decisions Input il a m entarté he he hit he hit a he hit me with a pie whoops no going back now How to fix thisExhaustive search decoding Ideally we want to find a length T translation y that maximizes We could try computing all possible sequences y This means that on each step t of the decoder we re tracking Vt possible partial translations where V is vocab size This O VT complexity is far too expensive 17Beam search decoding Core idea On each step of decoder keep track of the k most probable partial translations which we call hypotheses k is the beam size in practice around 5 to 10 in NMT A hypothesis has a score which is its log probability Scores are all negative and higher score is better We search for high scoring hypotheses tracking top k on each step Beam search is not guaranteed to find optimal solution But much more efficient than exhaustive search 18Beam search decoding example Beam size k 2. Blue numbers START Calculate prob dist of next word 19Beam search decoding example Beam size k 2. Blue numbers START he I 0.7 log PLM he START 0.9 log PLM I START Take top k words and compute scores 20Beam search decoding example Beam size k 2. Blue numbers hit struck was got START he I 10 0.7 0.9 2.9 log PLM struck START he 0.7 1.6 log PLM was START I 0.9 1.8 log PLM got START I 0.9 1.7 log PLM hit START he 0.7 For each of the k hypotheses find top k next words and calculate scoresBeam search decoding example Beam size k 2.', 'An exact method for sampling from P X no further work needed.Greedy Search One by one pick the single highest probability word Not exact real problems Will often generate the easy words first Will prefer multiple common words to one rare wordBeam Search Instead of picking one high probability word maintain several paths Some in reading materials more in a later classModel EnsemblingEnsembling Why Multiple models make somewhat uncorrelated errors Models tend to be more uncertain when they are about to make errors Smooths over idiosyncrasies of the model LSTM1 predict1 I LSTM2 predict2 Combine predictions from multiple models s sLinear Interpolation Take a weighted average of the M model probabilities Second term often set to uniform distribution 1 MLog linear Interpolation Weighted combination of log probabilities normalize Interpolation coefficient often set to uniform distribution 1 MLinear or Log Linear Think of it in logic Linear Logical OR the interpolated model likes any choice that a model gives a high probability use models with models that capture different traits necessary when any model can assign zero probability Log Linear Logical AND interpolated model only likes choices where all models agree use when you want to restrict possible answersParameter Averaging Problem Ensembling means we have to use M models at test time increasing our time memory complexity Parameter averaging is a cheap way to get some good effects of ensembling Basically write out models several times near the end of training and take the average of parametersEnsemble Distillation e.g. Kim et al. 2016 Problem parameter averaging only works for models within the same run Knowledge distillation trains a model to copy the ensemble Specifically it tries to match the description over predicted words Why We want the model to make the same mistakes as an ensemble Shown to increase accuracy notablyStacking What if we have two very different models where prediction of outputs is done in very different ways e.g. a phrase based translation model and a neural MT model Niehues et al. 2017 Stacking uses the output of one system in calculating features for another systemCase Studies in Conditional Language ModelingFrom Images e.g. Karpathy et al. 2015 Input is image features output is text Use standard image encoders e.g.']",text-embedding-3-small,512,20,2,"
You are an AI teaching Assistant for the SEP 775 course. 
You will provide an interactive platform for students to ask questions and receive guidance on course materials.
Your goal is to answer questions as accurately as possible based on the instructions and context provided.
If you found the answer based on the context provided, you should provide the answer first, then at the end, beginning a new sentence with the words ""Source:"", followed by the name of the lecture, or assignment, or paper if possible.
",0.9218209045611296,0.8888888888888888,0.9149858996716024,1.0
34,Explain the concept of model ensembling in language models.,"Model ensembling in language models involves combining predictions from multiple models to improve overall performance. By using multiple models that make somewhat uncorrelated errors, the ensemble can reduce uncertainty and smooth over idiosyncrasies of individual models. This approach can be beneficial when different models capture different traits or when there is a need to handle zero probabilities effectively. Techniques such as parameter averaging and ensemble distillation are used to leverage the strengths of multiple models during testing or inference. Overall, model ensembling can enhance the accuracy and robustness of language models by leveraging diverse sources of information and expertise.

Source: SEP 775 - Computational Natural Language Processing, lecture notes.","['An exact method for sampling from P X no further work needed.Greedy Search One by one pick the single highest probability word Not exact real problems Will often generate the easy words first Will prefer multiple common words to one rare wordBeam Search Instead of picking one high probability word maintain several paths Some in reading materials more in a later classModel EnsemblingEnsembling Why Multiple models make somewhat uncorrelated errors Models tend to be more uncertain when they are about to make errors Smooths over idiosyncrasies of the model LSTM1 predict1 I LSTM2 predict2 Combine predictions from multiple models s sLinear Interpolation Take a weighted average of the M model probabilities Second term often set to uniform distribution 1 MLog linear Interpolation Weighted combination of log probabilities normalize Interpolation coefficient often set to uniform distribution 1 MLinear or Log Linear Think of it in logic Linear Logical OR the interpolated model likes any choice that a model gives a high probability use models with models that capture different traits necessary when any model can assign zero probability Log Linear Logical AND interpolated model only likes choices where all models agree use when you want to restrict possible answersParameter Averaging Problem Ensembling means we have to use M models at test time increasing our time memory complexity Parameter averaging is a cheap way to get some good effects of ensembling Basically write out models several times near the end of training and take the average of parametersEnsemble Distillation e.g. Kim et al. 2016 Problem parameter averaging only works for models within the same run Knowledge distillation trains a model to copy the ensemble Specifically it tries to match the description over predicted words Why We want the model to make the same mistakes as an ensemble Shown to increase accuracy notablyStacking What if we have two very different models where prediction of outputs is done in very different ways e.g. a phrase based translation model and a neural MT model Niehues et al. 2017 Stacking uses the output of one system in calculating features for another systemCase Studies in Conditional Language ModelingFrom Images e.g. Karpathy et al. 2015 Input is image features output is text Use standard image encoders e.g.', 'For instance HLW 20 observe that larger models do not necessarily generalize better out of distribution. There is evidence that suggests that the generalization achieved under this paradigm can be poor because the model is overly speciﬁc to the training distribution and does not generalize well outside it YdC 19 MPL19 . Thus the performance of ﬁne tuned models on speciﬁc benchmarks even when it is nominally at human level may exaggerate actual performance on the underlying task GSL 18 NK19 . Third humans do not require large supervised datasets to learn most language tasks a brief directive in natural language e.g. please tell me if this sentence describes something happy or something sad or at most a tiny number of demonstrations e.g. here are two examples of people acting brave please give a third example of bravery is often Figure 1.1 Language model meta learning. During unsupervised pre training a language model develops a broad set of skills and pattern recognition abilities. It then uses these abilities at inference time to rapidly adapt to or recognize the desired task. We use the term in context learning to describe the inner loop of this process which occurs within the forward pass upon each sequence. The sequences in this diagram are not intended to be representative of the data a model would see during pre training but are intended to show that there are sometimes repeated sub tasks embedded within a single sequence. 3Figure 1.2 Larger models make increasingly efﬁcient use of in context information. We show in context learning performance on a simple task requiring the model to remove random symbols from a word both with and without a natural language task description see Sec. 3.9.2 . The steeper in context learning curves for large models demonstrate improved ability to learn a task from contextual information. We see qualitatively similar behavior across a wide range of tasks. sufﬁcient to enable a human to perform a new task to at least a reasonable degree of competence. Aside from pointing to a conceptual limitation in our current NLP techniques this adaptability has practical advantages it allows humans to seamlessly mix together or switch between many tasks and skills for example performing addition during a lengthy dialogue.']",text-embedding-3-small,512,20,2,"
You are an AI teaching Assistant for the SEP 775 course. 
You will provide an interactive platform for students to ask questions and receive guidance on course materials.
Your goal is to answer questions as accurately as possible based on the instructions and context provided.
If you found the answer based on the context provided, you should provide the answer first, then at the end, beginning a new sentence with the words ""Source:"", followed by the name of the lecture, or assignment, or paper if possible.
",0.9687264226750372,1.0,0.933090753944826,0.0666666666666666
35,How does ensemble distillation differ from parameter averaging?,"Ensemble distillation differs from parameter averaging in that while parameter averaging involves taking the average of parameters from multiple models near the end of training to achieve some benefits of ensembling, ensemble distillation involves training a model to copy the ensemble by matching the distribution over predicted words. This is done to make the model make the same mistakes as an ensemble, ultimately increasing accuracy.","['An exact method for sampling from P X no further work needed.Greedy Search One by one pick the single highest probability word Not exact real problems Will often generate the easy words first Will prefer multiple common words to one rare wordBeam Search Instead of picking one high probability word maintain several paths Some in reading materials more in a later classModel EnsemblingEnsembling Why Multiple models make somewhat uncorrelated errors Models tend to be more uncertain when they are about to make errors Smooths over idiosyncrasies of the model LSTM1 predict1 I LSTM2 predict2 Combine predictions from multiple models s sLinear Interpolation Take a weighted average of the M model probabilities Second term often set to uniform distribution 1 MLog linear Interpolation Weighted combination of log probabilities normalize Interpolation coefficient often set to uniform distribution 1 MLinear or Log Linear Think of it in logic Linear Logical OR the interpolated model likes any choice that a model gives a high probability use models with models that capture different traits necessary when any model can assign zero probability Log Linear Logical AND interpolated model only likes choices where all models agree use when you want to restrict possible answersParameter Averaging Problem Ensembling means we have to use M models at test time increasing our time memory complexity Parameter averaging is a cheap way to get some good effects of ensembling Basically write out models several times near the end of training and take the average of parametersEnsemble Distillation e.g. Kim et al. 2016 Problem parameter averaging only works for models within the same run Knowledge distillation trains a model to copy the ensemble Specifically it tries to match the description over predicted words Why We want the model to make the same mistakes as an ensemble Shown to increase accuracy notablyStacking What if we have two very different models where prediction of outputs is done in very different ways e.g. a phrase based translation model and a neural MT model Niehues et al. 2017 Stacking uses the output of one system in calculating features for another systemCase Studies in Conditional Language ModelingFrom Images e.g. Karpathy et al. 2015 Input is image features output is text Use standard image encoders e.g.', 'All ensembles have at least 3 workers. TL DR 6.7B RL T 0.7 labeler labeler ensem ble length copying ROUGE 1.3B sup logprob 1.3B RM 6.7B sup logprob 6.7B RM labeler 60.4 5.9 66.0 7.6 55.8 2.2 52.7 2.1 49.9 2.1 48.0 2.2 57.4 2.0 47.3 2.2 62.3 2.1 labeler ensemble 66.0 7.6 80.0 8.9 65.0 10.6 35.0 10.5 45.0 11.1 75.0 9.8 40.0 10.5 75.0 9.8 length 55.8 2.2 80.0 8.9 48.1 2.2 50.3 2.2 30.0 2.1 62.0 2.1 30.4 2.0 59.8 2.2 copying 52.7 2.1 65.0 10.6 48.1 2.2 52.0 2.2 64.2 2.1 56.7 2.2 64.4 2.1 53.4 2.2 ROUGE 49.9 2.1 35.0 10.5 50.3 2.2 52.0 2.2 50.5 2.2 52.0 2.3 51.1 2.3 54.5 2.1 1.3B sup.']",text-embedding-3-small,512,20,2,"
You are an AI teaching Assistant for the SEP 775 course. 
You will provide an interactive platform for students to ask questions and receive guidance on course materials.
Your goal is to answer questions as accurately as possible based on the instructions and context provided.
If you found the answer based on the context provided, you should provide the answer first, then at the end, beginning a new sentence with the words ""Source:"", followed by the name of the lecture, or assignment, or paper if possible.
",0.987278043698859,1.0,0.9720746021728476,0.3333333333333333
36,What are some common evaluation metrics for conditioned language models?,"Some common evaluation metrics for conditioned language models include BLEU, embedding-based metrics such as BertScore, BLEURT, COMET, PRISM, and Perplexity. Additionally, meta-evaluation, which involves running human evaluation and automatic evaluation on the same outputs and calculating correlation, is another approach used in evaluating conditioned language models.","['2015 Input is image features output is text Use standard image encoders e.g. CNN Often pre trained on large databases such as ImageNetCheck out this review paperHow do we EvaluateBasic Evaluation Paradigm Use parallel test set Use system to generate translations Compare target translations w referenceHuman Evaluation Ask a human to do evaluation Final goal but slow expensive and sometimes inconsistentBLEU Works by comparing n gram overlap w reference Pros Easy to use good for measuring system improvement Cons Often doesn t match human eval bad for comparing very different systemsEmbedding based Metrics Recently many metrics based on neural models BertScore Find similarity between BERT embeddings unsupervised Zhang et al. 2020 BLEURT Train BERT to predict human evaluation scores Sellam et al. 2020 COMET Train model to predict human eval also using source sentence Rei et al. 2020 PRISM Model based on training paraphrasing model Thompson and Post 2020Perplexity Calculate the perplexity of the words in the held out set without doing generation Pros Naturally solves multiple reference problem Cons Doesn t consider decoding or actually generating output. May be reasonable for problems with lots of ambiguity.Which One to Use Meta evaluation runs human evaluation and automatic evaluation on the same outputs calculates correlation Examples WMT Metrics Task for MT Mathur et al. 2021 RealSumm for summarization Evaluation is hard especially with good systems Most metrics had no correlation w human eval over best systems at some WMT 2019 tasksQuestions', 'For this graph we also include 6 additional extra small models with as few as 100 000 parameters. As observed in KMH 20 language modeling performance follows a power law when making efﬁcient use of training compute. After extending this trend by two more orders of magnitude we observe only a slight if any departure from the power law. One might worry that these improvements in cross entropy loss come only from modeling spurious details of our training corpus. However we will see in the following sections that improvements in cross entropy loss lead to consistent performance gains across a broad spectrum of natural language tasks. Below we evaluate the 8 models described in Section 2 the 175 billion parameter parameter GPT 3 and 7 smaller models on a wide range of datasets. We group the datasets into 9 categories representing roughly similar tasks. In Section 3.1 we evaluate on traditional language modeling tasks and tasks that are similar to language modeling such as Cloze tasks and sentence paragraph completion tasks. In Section 3.2 we evaluate on closed book question answering tasks tasks which require using the information stored in the model s parameters to answer general knowledge questions. In Section 3.3 we evaluate the model s ability to translate between languages especially one shot and few shot . In Section 3.4 we evaluate the model s performance on Winograd Schema like tasks. In Section 3.5 we evaluate on datasets that involve commonsense reasoning or question answering. In Section 3.6 we evaluate on reading comprehension tasks in Section 3.7 we evaluate on the SuperGLUE benchmark suite and in 3.8 we brieﬂy explore NLI. Finally in Section 3.9 we invent some additional tasks designed especially to probe in context learning abilities these tasks focus on on the ﬂy reasoning adaptation skills or open ended text synthesis. We evaluate all tasks in the few shot one shot and zero shot settings. 10Figure 3.1 Smooth scaling of performance with compute. Performance measured in terms of cross entropy validation loss follows a power law trend with the amount of compute used for training. The power law behavior observed in KMH 20 continues for an additional two orders of magnitude with only small deviations from the predicted curve.']",text-embedding-3-small,512,20,2,"
You are an AI teaching Assistant for the SEP 775 course. 
You will provide an interactive platform for students to ask questions and receive guidance on course materials.
Your goal is to answer questions as accurately as possible based on the instructions and context provided.
If you found the answer based on the context provided, you should provide the answer first, then at the end, beginning a new sentence with the words ""Source:"", followed by the name of the lecture, or assignment, or paper if possible.
",1.0000000000000002,0.7142857142857143,0.9231531346029664,0.05
37,What is the significance of stacking in model ensembling?,"Stacking is significant in model ensembling when we have two very different models that predict outputs in different ways. It involves using the output of one system to calculate features for another system. This approach can help improve the overall performance by leveraging the strengths of each individual model and combining their predictions effectively. By incorporating diverse models through stacking, we can potentially enhance the accuracy and robustness of the ensemble model.","['An exact method for sampling from P X no further work needed.Greedy Search One by one pick the single highest probability word Not exact real problems Will often generate the easy words first Will prefer multiple common words to one rare wordBeam Search Instead of picking one high probability word maintain several paths Some in reading materials more in a later classModel EnsemblingEnsembling Why Multiple models make somewhat uncorrelated errors Models tend to be more uncertain when they are about to make errors Smooths over idiosyncrasies of the model LSTM1 predict1 I LSTM2 predict2 Combine predictions from multiple models s sLinear Interpolation Take a weighted average of the M model probabilities Second term often set to uniform distribution 1 MLog linear Interpolation Weighted combination of log probabilities normalize Interpolation coefficient often set to uniform distribution 1 MLinear or Log Linear Think of it in logic Linear Logical OR the interpolated model likes any choice that a model gives a high probability use models with models that capture different traits necessary when any model can assign zero probability Log Linear Logical AND interpolated model only likes choices where all models agree use when you want to restrict possible answersParameter Averaging Problem Ensembling means we have to use M models at test time increasing our time memory complexity Parameter averaging is a cheap way to get some good effects of ensembling Basically write out models several times near the end of training and take the average of parametersEnsemble Distillation e.g. Kim et al. 2016 Problem parameter averaging only works for models within the same run Knowledge distillation trains a model to copy the ensemble Specifically it tries to match the description over predicted words Why We want the model to make the same mistakes as an ensemble Shown to increase accuracy notablyStacking What if we have two very different models where prediction of outputs is done in very different ways e.g. a phrase based translation model and a neural MT model Niehues et al. 2017 Stacking uses the output of one system in calculating features for another systemCase Studies in Conditional Language ModelingFrom Images e.g. Karpathy et al. 2015 Input is image features output is text Use standard image encoders e.g.', 'All ensembles have at least 3 workers. TL DR 6.7B RL T 0.7 labeler labeler ensem ble length copying ROUGE 1.3B sup logprob 1.3B RM 6.7B sup logprob 6.7B RM labeler 60.4 5.9 66.0 7.6 55.8 2.2 52.7 2.1 49.9 2.1 48.0 2.2 57.4 2.0 47.3 2.2 62.3 2.1 labeler ensemble 66.0 7.6 80.0 8.9 65.0 10.6 35.0 10.5 45.0 11.1 75.0 9.8 40.0 10.5 75.0 9.8 length 55.8 2.2 80.0 8.9 48.1 2.2 50.3 2.2 30.0 2.1 62.0 2.1 30.4 2.0 59.8 2.2 copying 52.7 2.1 65.0 10.6 48.1 2.2 52.0 2.2 64.2 2.1 56.7 2.2 64.4 2.1 53.4 2.2 ROUGE 49.9 2.1 35.0 10.5 50.3 2.2 52.0 2.2 50.5 2.2 52.0 2.3 51.1 2.3 54.5 2.1 1.3B sup.']",text-embedding-3-small,512,20,2,"
You are an AI teaching Assistant for the SEP 775 course. 
You will provide an interactive platform for students to ask questions and receive guidance on course materials.
Your goal is to answer questions as accurately as possible based on the instructions and context provided.
If you found the answer based on the context provided, you should provide the answer first, then at the end, beginning a new sentence with the words ""Source:"", followed by the name of the lecture, or assignment, or paper if possible.
",0.9609509521143909,1.0,0.9346559262142746,0.3333333333333333
38,How are images used as input for conditioned language models?,Images can be used as input for conditioned language models by converting the image into a textual description or embedding that can be fed into the model alongside the text input. This allows the conditioned language model to generate text based on both the textual input and the visual information extracted from the image.,"['While the effective receptive ﬁeld size in this ﬁgure is the same for both schemes in 2D attention the memory block contains a more evenly balanced number of pixels next to and above the query block respectively. dence across channels Salimans et al. . For each pixel the number of parameters is 10 times the number of mixture components 10 for one unnormalized mixture probability three means three standard deviations and three coefﬁcients which capture the linear dependence. For 10 mixtures this translates to 100 parameters for each pixel for 32 32 im ages the network outputs 102 400 dimensions which is a 7x reduction enabling denser gradients and lower memory. 4. Inference Across all of the presented experiments we use categorical sampling during decoding with a tempered softmax Dahl et al. 2017 . We adjust the concentration of the distribution we sample from with a temperature τ 0 by which we divide the logits for the channel intensities. We tuned τ between 0.8 and 1.0 observing the highest perceptual quality in unconditioned and class conditional image generation with τ 1.0. For super resolution we present results for different temperatures in Table 5. 5. Experiments All code we used to develop train and evaluate our models is available in Tensor2Tensor Vaswani et al. 2018 . For all experiments we optimize with Adam Kingma Ba 2015 and vary the learning rate as speciﬁed in Vaswani et al. 2017 . We train our models on both p100 and k40 GPUs with batch sizes ranging from 1 to 8 per GPU.Image Transformer Table 3. Conditional image generations for all CIFAR 10 cate gories. Images on the left are from a model that achieves 3.03 bits dim on the test set. Images on the right are from our best non averaged model with 2.99 bits dim. Both models are able to generate convincing cars trucks and ships. Generated horses planes and birds also look reasonable. 5.1. Generative Image Modeling Our unconditioned and class conditioned image generation models both use 1D local attention with lq 256 and a total memory size of 512.', 'file name: lecture04 Conditioned Generation. Hamidreza Mahyar mahyarh@mcmaster.ca Computational Natural Language Processing Conditioned GenerationLanguage Models Language models are generative models of text s P x The Malfoys said Hermione. Harry was watching him. He looked like Madame Maxime. When she strode up the wrong staircase to visit himself. I m afraid I ve definitely been suspended from power no chance indeed said Snape. He put his head back behind them and read groups as they crossed a corner and fluttered down onto their ink lamp and picked up his spoon. The doorbell rang. It was a lot cleaner down in London. Text Credit Max Deutsch https medium.com deep writingConditioned Language Models Not just generate text generate text according to some specification Input X Structured Data English Document Utterance Image Speech Output Y Text NL Description Japanese Short Description Response Text Transcript Task NL Generation Translation Summarization Response Generation Image Captioning Speech RecognitionFormulation and ModelingCalculating the Probability of a SentenceConditional Language ModelsOne Type of Language Model LSTM LSTM LSTM LSTM predict hate predict this predict movie predict s LSTM Mikolov et al. 2011 s I hate this movie predict ILSTM LSTM LSTM LSTM LSTM s LSTM LSTM LSTM LSTM argmax argmax argmax argmax argmax s One Type of Conditional Language Model I hate this movie kono eiga ga kirai hate this movie Sutskever et al. 2014 Encoder I DecoderHow to Pass Hidden State Initialize decoder w encoder Sutskever et al. 2014 encoder decoder Transform can be different dimensions encoder transform decoder encoder Input at every time step Kalchbrenner Blunsom 2013 decoder decoder decoderMethods of GenerationThe Generation Problem We have a model of P Y X how do we use it to generate a sentence Two methods Sampling Try to generate a random sentence according to the probability distribution. Argmax Try to generate the sentence with the highest probability.Ancestral Sampling Randomly generate words one by one.']",text-embedding-3-small,512,20,2,"
You are an AI teaching Assistant for the SEP 775 course. 
You will provide an interactive platform for students to ask questions and receive guidance on course materials.
Your goal is to answer questions as accurately as possible based on the instructions and context provided.
If you found the answer based on the context provided, you should provide the answer first, then at the end, beginning a new sentence with the words ""Source:"", followed by the name of the lecture, or assignment, or paper if possible.
",0.9918168868462132,1.0,0.9174466055279876,0.0
39,What challenges exist in evaluating conditioned language models?,"Some challenges in evaluating conditioned language models include the issue of generalization outside of the training distribution, the potential exaggeration of performance on specific benchmarks, the need for large supervised datasets for training, the lack of grounding in other domains of experience, the limitations of the pretraining objective, poor sample efficiency during pretraining, and ambiguity regarding few-shot learning capabilities at inference time.","['For instance HLW 20 observe that larger models do not necessarily generalize better out of distribution. There is evidence that suggests that the generalization achieved under this paradigm can be poor because the model is overly speciﬁc to the training distribution and does not generalize well outside it YdC 19 MPL19 . Thus the performance of ﬁne tuned models on speciﬁc benchmarks even when it is nominally at human level may exaggerate actual performance on the underlying task GSL 18 NK19 . Third humans do not require large supervised datasets to learn most language tasks a brief directive in natural language e.g. please tell me if this sentence describes something happy or something sad or at most a tiny number of demonstrations e.g. here are two examples of people acting brave please give a third example of bravery is often Figure 1.1 Language model meta learning. During unsupervised pre training a language model develops a broad set of skills and pattern recognition abilities. It then uses these abilities at inference time to rapidly adapt to or recognize the desired task. We use the term in context learning to describe the inner loop of this process which occurs within the forward pass upon each sequence. The sequences in this diagram are not intended to be representative of the data a model would see during pre training but are intended to show that there are sometimes repeated sub tasks embedded within a single sequence. 3Figure 1.2 Larger models make increasingly efﬁcient use of in context information. We show in context learning performance on a simple task requiring the model to remove random symbols from a word both with and without a natural language task description see Sec. 3.9.2 . The steeper in context learning curves for large models demonstrate improved ability to learn a task from contextual information. We see qualitatively similar behavior across a wide range of tasks. sufﬁcient to enable a human to perform a new task to at least a reasonable degree of competence. Aside from pointing to a conceptual limitation in our current NLP techniques this adaptability has practical advantages it allows humans to seamlessly mix together or switch between many tasks and skills for example performing addition during a lengthy dialogue.', 'A more fundamental limitation of the general approach described in this paper scaling up any LM like model whether autoregressive or bidirectional is that it may eventually run into or could already be running into the limits of the 33pretraining objective. Our current objective weights every token equally and lacks a notion of what is most important to predict and what is less important. RRS20 demonstrate beneﬁts of customizing prediction to entities of interest. Also with self supervised objectives task speciﬁcation relies on forcing the desired task into a prediction problem whereas ultimately useful language systems for example virtual assistants might be better thought of as taking goal directed actions rather than just making predictions. Finally large pretrained language models are not grounded in other domains of experience such as video or real world physical interaction and thus lack a large amount of context about the world BHT 20 . For all these reasons scaling pure self supervised prediction is likely to hit limits and augmentation with a different approach is likely to be necessary. Promising future directions in this vein might include learning the objective function from humans ZSW 19a ﬁne tuning with reinforcement learning or adding additional modalities such as images to provide grounding and a better model of the world CLY 19 . Another limitation broadly shared by language models is poor sample efﬁciency during pre training. While GPT 3 takes a step towards test time sample efﬁciency closer to that of humans one shot or zero shot it still sees much more text during pre training than a human sees in the their lifetime Lin20 . Improving pre training sample efﬁciency is an important direction for future work and might come from grounding in the physical world to provide additional information or from algorithmic improvements. A limitation or at least uncertainty associated with few shot learning in GPT 3 is ambiguity about whether few shot learning actually learns new tasks from scratch at inference time or if it simply recognizes and identiﬁes tasks that it has learned during training.']",text-embedding-3-small,512,20,2,"
You are an AI teaching Assistant for the SEP 775 course. 
You will provide an interactive platform for students to ask questions and receive guidance on course materials.
Your goal is to answer questions as accurately as possible based on the instructions and context provided.
If you found the answer based on the context provided, you should provide the answer first, then at the end, beginning a new sentence with the words ""Source:"", followed by the name of the lecture, or assignment, or paper if possible.
",0.9932392273138442,0.8571428571428571,0.8500893131538232,0.04
40,What is the instructor's name for this course?,"The instructor for the course ""Introduction to Computational Natural Language Processing"" in Winter 2024 is Hamidreza Mahyar. 

Source: NLP Winter 2024 Course Outline","['file name: NLP Winter 2024 Course Outline. Course Outline 1. COURSE INFORMATION Session Offered Winter 2024 Course Name Introduction to Computational Natural Language Processing Course Code SEP 775 Date s and Time s of lectures Lectures In person Wednesday 3 30 pm 6 30 pm Program Name System and Technology Calendar Description This graduate course introduces fundamental concepts in computational natural language processing NLP and their applications to teaching students how to deal with textual data in Artificial Intelligence. This course demonstrates how machines can learn different tasks in natural language such as language modeling text generation machine translation and language understanding. In this regard we go over the most promising methods in this literature and the most recent state of the art techniques. Moreover this course explores different real world applications of NLP and helps students get hands on experience in this field. Instructor Hamidreza Mahyar E Mail mahyarh@mcmaster.ca Office Hours upon request 2. COURSE SPECIFICS Course Description This course covers some fundamental concepts in natural language processing NLP and how they apply in real world use cases. Instruction Type Code Type Hours per term C Classroom instruction 39 L Laboratory workshop or fieldwork T Tutorial DE Distance education Total Hours 39 Resources ISBN Textbook Title Edition Author Publisher Natural Language Processing Jacob Eisenstein Speech and Language Processing Dan Jurafsky and James H. Martin Deep Learning Ian Goodfellow Yoshua Bengio and Aaron Courville Prerequisite s Proficiency in Python programming language Some Machine Learning and or Deep Learning knowledge is a plus Corequisite s Antirequisite s Course Specific Policies All work must be shown to get full credit. Specific policy of Projects Assignments submissionsProjects Assignments will be conducted online by using related software. Completed Projects Assignments should be uploaded to the drop box before midnight of the due date. Projects Assignments missed due to legitimate reasons must be completed later mutually agreed with the instructor. Departmental Policies The use of cell phones iPods laptops and other personal electronic devices are prohibited from the classroom during the class time unless the instructor makes an explicit exception. Announcements made in class or placed on Avenue are considered to have been communicated to all students including those individuals that are not in class. Instructor has the right to submit work to software to identify plagiarism.', 'Instructor has the right to submit work to software to identify plagiarism. 3. SUB TOPIC S Week 1 Overview Human language Word meanings Word2Vec and Optimization basics Week 2 Intro to neural networks Gradients and backpropagation Week 3 Recurrent Neural Networks and Language Models Week 4 Conditioned Generation Week 5 Part 1 Self attention and transformers Part 2 Seq2Seq models Week 6 Midterm Test Week 7 Midterm Recess No class Week 8 Prompting Instruction Finetuning and RLHF Week 9 Question Answering systems Week 10 Multimodal models Week 11 Project presentation and Q A Week 12 Project presentation and Q A Week 13 Project presentation and Q A Classes end April 10th 4. ASSESSMENT OF LEARNING Weight 4 Assignments 20 4 Quizzes 10 Midterm Test 35 Group Project 35 TOTAL 100Note that the percentage distribution of each module may be adjusted. Percentage grades will be converted to letter grades and grade points per the University calendar. 5. LEARNING OUTCOMES By the end of this course the students will know about Introduction to Deep Learning Word representations Language models Pre trained language models Text generation Seq2Seq models Prompting Feedback systems Multimodal models NLP applications e.g. Q A systems 6. COURSE OUTLINE APPROVED ADVISORY STATEMENTS ANTI DISCRIMINATION The Faculty of Engineering is concerned with ensuring an environment that is free of all discrimination. If there is a problem individuals are reminded that they should contact the Associate Director Graduate Studies the Sexual Harassment Officer or the Human Rights Consultant as soon as possible. http www.mcmaster.ca policy General HR Discrimination_Harassment_Sexual_Harassment Prevention Response.pdf ACADEMIC INTEGRITY You are expected to exhibit honesty and use ethical behaviour in all aspects of the learning process. Academic credentials you earn are rooted in principles of honesty and academic integrity. It is your responsibility to understand what constitutes academic dishonesty. Academic dishonesty is to knowingly act or fail to act in a way that results or could result in unearned academic credit or advantage. This behaviour can result in serious consequences e.g.']",text-embedding-3-small,512,20,2,"
You are an AI Teaching Assistant for the SEP 775 course. 
Your job is to answer students' questions about course materials according to the instructions and context provided.
If you found the answer based on the context provided, you should provide the answer first, then at the end, beginning a new sentence with the words ""Source:"", followed by the name of the lecture, or assignment, or paper if possible.
",0.8698619914558052,1.0,0.8818268184179945,0.0869565217391304
41,What is the email address of the instructor for this course?,"The email address of the instructor for the ""Introduction to Computational Natural Language Processing"" course in Winter 2024 is mahyarh@mcmaster.ca. 

Source: NLP Winter 2024 Course Outline.","['file name: NLP Winter 2024 Course Outline. Course Outline 1. COURSE INFORMATION Session Offered Winter 2024 Course Name Introduction to Computational Natural Language Processing Course Code SEP 775 Date s and Time s of lectures Lectures In person Wednesday 3 30 pm 6 30 pm Program Name System and Technology Calendar Description This graduate course introduces fundamental concepts in computational natural language processing NLP and their applications to teaching students how to deal with textual data in Artificial Intelligence. This course demonstrates how machines can learn different tasks in natural language such as language modeling text generation machine translation and language understanding. In this regard we go over the most promising methods in this literature and the most recent state of the art techniques. Moreover this course explores different real world applications of NLP and helps students get hands on experience in this field. Instructor Hamidreza Mahyar E Mail mahyarh@mcmaster.ca Office Hours upon request 2. COURSE SPECIFICS Course Description This course covers some fundamental concepts in natural language processing NLP and how they apply in real world use cases. Instruction Type Code Type Hours per term C Classroom instruction 39 L Laboratory workshop or fieldwork T Tutorial DE Distance education Total Hours 39 Resources ISBN Textbook Title Edition Author Publisher Natural Language Processing Jacob Eisenstein Speech and Language Processing Dan Jurafsky and James H. Martin Deep Learning Ian Goodfellow Yoshua Bengio and Aaron Courville Prerequisite s Proficiency in Python programming language Some Machine Learning and or Deep Learning knowledge is a plus Corequisite s Antirequisite s Course Specific Policies All work must be shown to get full credit. Specific policy of Projects Assignments submissionsProjects Assignments will be conducted online by using related software. Completed Projects Assignments should be uploaded to the drop box before midnight of the due date. Projects Assignments missed due to legitimate reasons must be completed later mutually agreed with the instructor. Departmental Policies The use of cell phones iPods laptops and other personal electronic devices are prohibited from the classroom during the class time unless the instructor makes an explicit exception. Announcements made in class or placed on Avenue are considered to have been communicated to all students including those individuals that are not in class. Instructor has the right to submit work to software to identify plagiarism.', 'If you have any questions or concerns about such disclosure please discuss this with the course instructor. ONLINE PROCTORING Some courses may use online proctoring software for tests and exams. This software may require students to turn on their video camera present identification monitor and record their computer activities and or lock restrict their browser or other applications software during tests or exams. This software may be required to be installed before the test exam begins. COMMUNICATIONS It is the student s responsibility to Maintain current contact information with the University including address phone numbers and emergency contact information. Use the University provided e mail address or maintain a valid forwarding e mail address. Regularly check the official University communications channels. Official University communications are considered received if sent by postal mail by fax or by e mail to the student s designated primary e mail account via their @mcmaster.ca alias. Accept that forwarded e mails may be lost and that e mail is considered received if sent via the student s @mcmaster.ca alias. Check the McMaster Avenue email and course websites on a regular basis during the term. CONDUCT EXPECTATIONS As a McMaster student you have the right to experience and the responsibility to demonstrate respectful and dignified interactions within all of our living learning and working communities. These expectations are described in the Code of Student Rights Responsibilities the Code . All students share the responsibility of maintaining a positive environment for the academic and personal growth of all McMaster community members whether in person or online. It is essential that students be mindful of their interactions online as the Code remains in effect in virtual learning environments. The Code applies to any interactions that adversely affect disrupt or interfere with reasonable participation in University activities. Student disruptions or behaviours that interfere with university functions on online platforms e.g. use of Avenue 2 Learn WebEx or Zoom for delivery will be taken very seriously and will be investigated. Outcomes may include restriction or removal of the involved students access to these platforms. ACADEMIC ACCOMMODATION OF STUDENTS WITH DISABILITIES Students with disabilities who require academic accommodation must contact Student Accessibility Services SAS at 905 525 9140 ext. 28652 or sas@mcmaster.ca to make arrangements with a Program Coordinator.']",text-embedding-3-small,512,20,2,"
You are an AI Teaching Assistant for the SEP 775 course. 
Your job is to answer students' questions about course materials according to the instructions and context provided.
If you found the answer based on the context provided, you should provide the answer first, then at the end, beginning a new sentence with the words ""Source:"", followed by the name of the lecture, or assignment, or paper if possible.
",0.8988614592934341,1.0,0.8912044038318212,0.0
42,When is this course held every week?,This course is held in person every Wednesday from 3:30 pm to 6:30 pm.,"['file name: NLP Winter 2024 Course Outline. Course Outline 1. COURSE INFORMATION Session Offered Winter 2024 Course Name Introduction to Computational Natural Language Processing Course Code SEP 775 Date s and Time s of lectures Lectures In person Wednesday 3 30 pm 6 30 pm Program Name System and Technology Calendar Description This graduate course introduces fundamental concepts in computational natural language processing NLP and their applications to teaching students how to deal with textual data in Artificial Intelligence. This course demonstrates how machines can learn different tasks in natural language such as language modeling text generation machine translation and language understanding. In this regard we go over the most promising methods in this literature and the most recent state of the art techniques. Moreover this course explores different real world applications of NLP and helps students get hands on experience in this field. Instructor Hamidreza Mahyar E Mail mahyarh@mcmaster.ca Office Hours upon request 2. COURSE SPECIFICS Course Description This course covers some fundamental concepts in natural language processing NLP and how they apply in real world use cases. Instruction Type Code Type Hours per term C Classroom instruction 39 L Laboratory workshop or fieldwork T Tutorial DE Distance education Total Hours 39 Resources ISBN Textbook Title Edition Author Publisher Natural Language Processing Jacob Eisenstein Speech and Language Processing Dan Jurafsky and James H. Martin Deep Learning Ian Goodfellow Yoshua Bengio and Aaron Courville Prerequisite s Proficiency in Python programming language Some Machine Learning and or Deep Learning knowledge is a plus Corequisite s Antirequisite s Course Specific Policies All work must be shown to get full credit. Specific policy of Projects Assignments submissionsProjects Assignments will be conducted online by using related software. Completed Projects Assignments should be uploaded to the drop box before midnight of the due date. Projects Assignments missed due to legitimate reasons must be completed later mutually agreed with the instructor. Departmental Policies The use of cell phones iPods laptops and other personal electronic devices are prohibited from the classroom during the class time unless the instructor makes an explicit exception. Announcements made in class or placed on Avenue are considered to have been communicated to all students including those individuals that are not in class. Instructor has the right to submit work to software to identify plagiarism.', 'Instructor has the right to submit work to software to identify plagiarism. 3. SUB TOPIC S Week 1 Overview Human language Word meanings Word2Vec and Optimization basics Week 2 Intro to neural networks Gradients and backpropagation Week 3 Recurrent Neural Networks and Language Models Week 4 Conditioned Generation Week 5 Part 1 Self attention and transformers Part 2 Seq2Seq models Week 6 Midterm Test Week 7 Midterm Recess No class Week 8 Prompting Instruction Finetuning and RLHF Week 9 Question Answering systems Week 10 Multimodal models Week 11 Project presentation and Q A Week 12 Project presentation and Q A Week 13 Project presentation and Q A Classes end April 10th 4. ASSESSMENT OF LEARNING Weight 4 Assignments 20 4 Quizzes 10 Midterm Test 35 Group Project 35 TOTAL 100Note that the percentage distribution of each module may be adjusted. Percentage grades will be converted to letter grades and grade points per the University calendar. 5. LEARNING OUTCOMES By the end of this course the students will know about Introduction to Deep Learning Word representations Language models Pre trained language models Text generation Seq2Seq models Prompting Feedback systems Multimodal models NLP applications e.g. Q A systems 6. COURSE OUTLINE APPROVED ADVISORY STATEMENTS ANTI DISCRIMINATION The Faculty of Engineering is concerned with ensuring an environment that is free of all discrimination. If there is a problem individuals are reminded that they should contact the Associate Director Graduate Studies the Sexual Harassment Officer or the Human Rights Consultant as soon as possible. http www.mcmaster.ca policy General HR Discrimination_Harassment_Sexual_Harassment Prevention Response.pdf ACADEMIC INTEGRITY You are expected to exhibit honesty and use ethical behaviour in all aspects of the learning process. Academic credentials you earn are rooted in principles of honesty and academic integrity. It is your responsibility to understand what constitutes academic dishonesty. Academic dishonesty is to knowingly act or fail to act in a way that results or could result in unearned academic credit or advantage. This behaviour can result in serious consequences e.g.']",text-embedding-3-small,512,20,2,"
You are an AI Teaching Assistant for the SEP 775 course. 
Your job is to answer students' questions about course materials according to the instructions and context provided.
If you found the answer based on the context provided, you should provide the answer first, then at the end, beginning a new sentence with the words ""Source:"", followed by the name of the lecture, or assignment, or paper if possible.
",0.9261015836751826,1.0,0.9727988425002738,0.0869565217391304
43,What is the name of the TA for this course?,"The TA for this course is not explicitly mentioned in the provided context information. If you need to know the TA's name, I recommend checking the official course website, contacting the instructor, or referring to any official communication from the course administration. Let me know if you need help with anything else.
Source: NLP Winter 2024 Course Outline","['file name: NLP Winter 2024 Course Outline. Course Outline 1. COURSE INFORMATION Session Offered Winter 2024 Course Name Introduction to Computational Natural Language Processing Course Code SEP 775 Date s and Time s of lectures Lectures In person Wednesday 3 30 pm 6 30 pm Program Name System and Technology Calendar Description This graduate course introduces fundamental concepts in computational natural language processing NLP and their applications to teaching students how to deal with textual data in Artificial Intelligence. This course demonstrates how machines can learn different tasks in natural language such as language modeling text generation machine translation and language understanding. In this regard we go over the most promising methods in this literature and the most recent state of the art techniques. Moreover this course explores different real world applications of NLP and helps students get hands on experience in this field. Instructor Hamidreza Mahyar E Mail mahyarh@mcmaster.ca Office Hours upon request 2. COURSE SPECIFICS Course Description This course covers some fundamental concepts in natural language processing NLP and how they apply in real world use cases. Instruction Type Code Type Hours per term C Classroom instruction 39 L Laboratory workshop or fieldwork T Tutorial DE Distance education Total Hours 39 Resources ISBN Textbook Title Edition Author Publisher Natural Language Processing Jacob Eisenstein Speech and Language Processing Dan Jurafsky and James H. Martin Deep Learning Ian Goodfellow Yoshua Bengio and Aaron Courville Prerequisite s Proficiency in Python programming language Some Machine Learning and or Deep Learning knowledge is a plus Corequisite s Antirequisite s Course Specific Policies All work must be shown to get full credit. Specific policy of Projects Assignments submissionsProjects Assignments will be conducted online by using related software. Completed Projects Assignments should be uploaded to the drop box before midnight of the due date. Projects Assignments missed due to legitimate reasons must be completed later mutually agreed with the instructor. Departmental Policies The use of cell phones iPods laptops and other personal electronic devices are prohibited from the classroom during the class time unless the instructor makes an explicit exception. Announcements made in class or placed on Avenue are considered to have been communicated to all students including those individuals that are not in class. Instructor has the right to submit work to software to identify plagiarism.', 'Instructor has the right to submit work to software to identify plagiarism. 3. SUB TOPIC S Week 1 Overview Human language Word meanings Word2Vec and Optimization basics Week 2 Intro to neural networks Gradients and backpropagation Week 3 Recurrent Neural Networks and Language Models Week 4 Conditioned Generation Week 5 Part 1 Self attention and transformers Part 2 Seq2Seq models Week 6 Midterm Test Week 7 Midterm Recess No class Week 8 Prompting Instruction Finetuning and RLHF Week 9 Question Answering systems Week 10 Multimodal models Week 11 Project presentation and Q A Week 12 Project presentation and Q A Week 13 Project presentation and Q A Classes end April 10th 4. ASSESSMENT OF LEARNING Weight 4 Assignments 20 4 Quizzes 10 Midterm Test 35 Group Project 35 TOTAL 100Note that the percentage distribution of each module may be adjusted. Percentage grades will be converted to letter grades and grade points per the University calendar. 5. LEARNING OUTCOMES By the end of this course the students will know about Introduction to Deep Learning Word representations Language models Pre trained language models Text generation Seq2Seq models Prompting Feedback systems Multimodal models NLP applications e.g. Q A systems 6. COURSE OUTLINE APPROVED ADVISORY STATEMENTS ANTI DISCRIMINATION The Faculty of Engineering is concerned with ensuring an environment that is free of all discrimination. If there is a problem individuals are reminded that they should contact the Associate Director Graduate Studies the Sexual Harassment Officer or the Human Rights Consultant as soon as possible. http www.mcmaster.ca policy General HR Discrimination_Harassment_Sexual_Harassment Prevention Response.pdf ACADEMIC INTEGRITY You are expected to exhibit honesty and use ethical behaviour in all aspects of the learning process. Academic credentials you earn are rooted in principles of honesty and academic integrity. It is your responsibility to understand what constitutes academic dishonesty. Academic dishonesty is to knowingly act or fail to act in a way that results or could result in unearned academic credit or advantage. This behaviour can result in serious consequences e.g.']",text-embedding-3-small,512,20,2,"
You are an AI Teaching Assistant for the SEP 775 course. 
Your job is to answer students' questions about course materials according to the instructions and context provided.
If you found the answer based on the context provided, you should provide the answer first, then at the end, beginning a new sentence with the words ""Source:"", followed by the name of the lecture, or assignment, or paper if possible.
",0.0,,0.8286185101900094,0.0
44,What is Word2vec?,"Word2vec is a framework for learning word vectors where each word in a fixed vocabulary is represented by a vector. It involves going through a large corpus of text, considering a center word and context outside words, and adjusting word vectors to maximize the probability of predicting context words given the center word or vice versa. The objective is to minimize an empirical loss function by estimating parameters using gradient-based methods.","['Word2vec Overview 21 Word2vec Mikolov et al. 2013 is a framework for learning word vectors Idea We have a large corpus body of text a long list of words Every word in a fixed vocabulary is represented by a vector Go through each position t in the text which has a center word c and context outside words o Use the similarity of the word vectors for c and o to calculate the probability of o given c or vice versa Keep adjusting the word vectors to maximize this probabilityWord2Vec Overview Example windows and process for computing 𝑃𝑤𝑡 𝑗 𝑤𝑡 crises banking into turning problems as center word at position t outside context words in window of size 2 outside context words in window of size 2 𝑃𝑤𝑡 1 𝑤𝑡 22 𝑃𝑤𝑡 2 𝑤𝑡 𝑃𝑤𝑡 1 𝑤𝑡 𝑃𝑤𝑡 2 𝑤𝑡Word2Vec Overview Example windows and process for computing 𝑃𝑤𝑡 𝑗 𝑤𝑡 crises banking into turning problems as center word at position t outside context words in window of size 2 outside context words in window of size 2 𝑃𝑤𝑡 2 𝑤𝑡 𝑃𝑤𝑡 1 𝑤𝑡 23 𝑃𝑤𝑡 2 𝑤𝑡 𝑃𝑤𝑡 1 𝑤𝑡Word2vec objective function For each position 𝑡 1 𝑇 predict context words within a window of fixed size m given center word 𝑤𝑡. Data likelihood The objective function 𝐽𝜃is the average negative log likelihood Minimizing objective function Maximizing predictive accuracy sometimes called a cost or loss function 24Word2vec objective function We want to minimize the objective function Question How to calculate 𝑃𝑤𝑡 𝑗 𝑤𝑡 𝜃 Answer We will use two vectors per word w', '3.3 Estimating a word2vec model from a corpus How do we train word2vec in practice Specifying the word2vec model is relatively transparent from the math we ve given above one constructs matrices U and V and can write out the math of the probability. However it may not yet be evident how to estimate the parameters 1 how to calculate the expectation in Eqn 5 for a given value of U and V and then 2 how to perform the minimization operation. Let s start with 1. Word2vec empirical loss. Let D be a set of documents d where each document is a sequence of words w d 1 . . . w d m with all w V. Let k N be a positive integer window size. Let s define how our center word random variable C and outside word r.v. O relate to this concrete dataset. O takes on the value of each word wi in each document and for each such wi the outside words are wi k . . . wi 1 wi 1 . . . wi k . So our Eqn 5 objective becomes L U V d D m i 1 k j 1 log pU V w d i j w d i 6 where you ll note we re taking the sum over 1 all documents of the sum over 2 all words in the document of the sum over 3 all words occuring in the window of the likelihood of the outside word given the center word. Now how do we do the minimization Gradient based estimation At a high level we try to find good U and V for the objective we ve specified by starting with a relatively uninformed guess and iteratively moving in the direction that locally best improves the guess. This is done by gradient based methods a full description of which is out of scope for this note.']",text-embedding-3-small,512,20,2,"
You are an AI Teaching Assistant for the SEP 775 course. 
Your job is to answer students' questions about course materials according to the instructions and context provided.
If you found the answer based on the context provided, you should provide the answer first, then at the end, beginning a new sentence with the words ""Source:"", followed by the name of the lecture, or assignment, or paper if possible.
",0.9999999999999994,1.0,0.9673166665545048,0.0833333333333333
45,What are the main learning goals of the course?,"The main learning goals of the course include Introduction to Deep Learning, Word representations, Language models, Pre-trained language models, Text generation, Seq2Seq models, Prompting Feedback systems, Multimodal models, and NLP applications such as Q&A systems. Students will also learn about various topics like Word2Vec, Optimization basics, Neural Networks, Gradients, Backpropagation, Recurrent Neural Networks, Self-attention and transformers, Conditioned Generation, Question Answering systems, and Project presentations. Additionally, the course aims to provide hands-on experience in dealing with textual data in Artificial Intelligence and understanding how machines can perform tasks related to natural language processing. 

Source: NLP Winter 2024 Course Outline.","['Instructor has the right to submit work to software to identify plagiarism. 3. SUB TOPIC S Week 1 Overview Human language Word meanings Word2Vec and Optimization basics Week 2 Intro to neural networks Gradients and backpropagation Week 3 Recurrent Neural Networks and Language Models Week 4 Conditioned Generation Week 5 Part 1 Self attention and transformers Part 2 Seq2Seq models Week 6 Midterm Test Week 7 Midterm Recess No class Week 8 Prompting Instruction Finetuning and RLHF Week 9 Question Answering systems Week 10 Multimodal models Week 11 Project presentation and Q A Week 12 Project presentation and Q A Week 13 Project presentation and Q A Classes end April 10th 4. ASSESSMENT OF LEARNING Weight 4 Assignments 20 4 Quizzes 10 Midterm Test 35 Group Project 35 TOTAL 100Note that the percentage distribution of each module may be adjusted. Percentage grades will be converted to letter grades and grade points per the University calendar. 5. LEARNING OUTCOMES By the end of this course the students will know about Introduction to Deep Learning Word representations Language models Pre trained language models Text generation Seq2Seq models Prompting Feedback systems Multimodal models NLP applications e.g. Q A systems 6. COURSE OUTLINE APPROVED ADVISORY STATEMENTS ANTI DISCRIMINATION The Faculty of Engineering is concerned with ensuring an environment that is free of all discrimination. If there is a problem individuals are reminded that they should contact the Associate Director Graduate Studies the Sexual Harassment Officer or the Human Rights Consultant as soon as possible. http www.mcmaster.ca policy General HR Discrimination_Harassment_Sexual_Harassment Prevention Response.pdf ACADEMIC INTEGRITY You are expected to exhibit honesty and use ethical behaviour in all aspects of the learning process. Academic credentials you earn are rooted in principles of honesty and academic integrity. It is your responsibility to understand what constitutes academic dishonesty. Academic dishonesty is to knowingly act or fail to act in a way that results or could result in unearned academic credit or advantage. This behaviour can result in serious consequences e.g.', 'file name: NLP Winter 2024 Course Outline. Course Outline 1. COURSE INFORMATION Session Offered Winter 2024 Course Name Introduction to Computational Natural Language Processing Course Code SEP 775 Date s and Time s of lectures Lectures In person Wednesday 3 30 pm 6 30 pm Program Name System and Technology Calendar Description This graduate course introduces fundamental concepts in computational natural language processing NLP and their applications to teaching students how to deal with textual data in Artificial Intelligence. This course demonstrates how machines can learn different tasks in natural language such as language modeling text generation machine translation and language understanding. In this regard we go over the most promising methods in this literature and the most recent state of the art techniques. Moreover this course explores different real world applications of NLP and helps students get hands on experience in this field. Instructor Hamidreza Mahyar E Mail mahyarh@mcmaster.ca Office Hours upon request 2. COURSE SPECIFICS Course Description This course covers some fundamental concepts in natural language processing NLP and how they apply in real world use cases. Instruction Type Code Type Hours per term C Classroom instruction 39 L Laboratory workshop or fieldwork T Tutorial DE Distance education Total Hours 39 Resources ISBN Textbook Title Edition Author Publisher Natural Language Processing Jacob Eisenstein Speech and Language Processing Dan Jurafsky and James H. Martin Deep Learning Ian Goodfellow Yoshua Bengio and Aaron Courville Prerequisite s Proficiency in Python programming language Some Machine Learning and or Deep Learning knowledge is a plus Corequisite s Antirequisite s Course Specific Policies All work must be shown to get full credit. Specific policy of Projects Assignments submissionsProjects Assignments will be conducted online by using related software. Completed Projects Assignments should be uploaded to the drop box before midnight of the due date. Projects Assignments missed due to legitimate reasons must be completed later mutually agreed with the instructor. Departmental Policies The use of cell phones iPods laptops and other personal electronic devices are prohibited from the classroom during the class time unless the instructor makes an explicit exception. Announcements made in class or placed on Avenue are considered to have been communicated to all students including those individuals that are not in class. Instructor has the right to submit work to software to identify plagiarism.']",text-embedding-3-small,512,20,2,"
You are an AI Teaching Assistant for the SEP 775 course. 
Your job is to answer students' questions about course materials according to the instructions and context provided.
If you found the answer based on the context provided, you should provide the answer first, then at the end, beginning a new sentence with the words ""Source:"", followed by the name of the lecture, or assignment, or paper if possible.
",0.9999999999999996,1.0,0.9231465154786204,0.1304347826086956
46,How is the course grade distributed?,"The course grade is distributed as follows: 4 Assignments worth 20%, 4 Quizzes worth 10%, Midterm Test worth 35%, and Group Project worth 35%, making a total of 100%. Please note that the percentage distribution of each module may be adjusted. Percentage grades will be converted to letter grades and grade points per the University calendar.","['Instructor has the right to submit work to software to identify plagiarism. 3. SUB TOPIC S Week 1 Overview Human language Word meanings Word2Vec and Optimization basics Week 2 Intro to neural networks Gradients and backpropagation Week 3 Recurrent Neural Networks and Language Models Week 4 Conditioned Generation Week 5 Part 1 Self attention and transformers Part 2 Seq2Seq models Week 6 Midterm Test Week 7 Midterm Recess No class Week 8 Prompting Instruction Finetuning and RLHF Week 9 Question Answering systems Week 10 Multimodal models Week 11 Project presentation and Q A Week 12 Project presentation and Q A Week 13 Project presentation and Q A Classes end April 10th 4. ASSESSMENT OF LEARNING Weight 4 Assignments 20 4 Quizzes 10 Midterm Test 35 Group Project 35 TOTAL 100Note that the percentage distribution of each module may be adjusted. Percentage grades will be converted to letter grades and grade points per the University calendar. 5. LEARNING OUTCOMES By the end of this course the students will know about Introduction to Deep Learning Word representations Language models Pre trained language models Text generation Seq2Seq models Prompting Feedback systems Multimodal models NLP applications e.g. Q A systems 6. COURSE OUTLINE APPROVED ADVISORY STATEMENTS ANTI DISCRIMINATION The Faculty of Engineering is concerned with ensuring an environment that is free of all discrimination. If there is a problem individuals are reminded that they should contact the Associate Director Graduate Studies the Sexual Harassment Officer or the Human Rights Consultant as soon as possible. http www.mcmaster.ca policy General HR Discrimination_Harassment_Sexual_Harassment Prevention Response.pdf ACADEMIC INTEGRITY You are expected to exhibit honesty and use ethical behaviour in all aspects of the learning process. Academic credentials you earn are rooted in principles of honesty and academic integrity. It is your responsibility to understand what constitutes academic dishonesty. Academic dishonesty is to knowingly act or fail to act in a way that results or could result in unearned academic credit or advantage. This behaviour can result in serious consequences e.g.', 'This behaviour can result in serious consequences e.g. the grade of zero on an assignment loss of credit with a notation on the transcript notation reads Grade of F assigned for academic dishonesty and or suspension or expulsion from the university. For information on the various types of academic dishonesty please refer to the Academic Integrity Policy located at https secretariat.mcmaster.ca university policies procedures guidelines The following illustrates only three forms of academic dishonesty plagiarism e.g. the submission of work that is not one s own or for which other credit has been obtained. improper collaboration in group work. copying or using unauthorized aids in tests and examinations. AUTHENTICITY PLAGIARISM DETECTION Some courses may use a web based service Turnitin.com to reveal authenticity and ownership of student submitted work. For courses using such software students will be expected to submit their work electronically either directly to Turnitin.com or via an online learning platform e.g. A2L etc. using plagiarism detection a service supported by Turnitin.com so it can be checked for academic dishonesty. Students who do not wish their work to be submitted through the plagiarism detection software must inform the Instructor before the assignment is due. No penalty will be assigned to a student who does not submit work to the plagiarism detection software. All submitted work is subject to normal verification that standards of academicintegrity have been upheld e.g. on line search other software etc. . For more details about McMaster s use of Turnitin.com please go to www.mcmaster.ca academicintegrity. COURSES WITH AN ON LINE ELEMENT Some courses may use on line elements e.g. e mail Avenue to Learn A2L LearnLink web pages capa Moodle ThinkingCap etc. . Students should be aware that when they access the electronic components of a course using these elements private information such as first and last names user names for the McMaster e mail accounts and program affiliation may become apparent to all other students in the same course. The available information is dependent on the technology used. Continuation in a course that uses on line elements will be deemed consent to this disclosure. If you have any questions or concerns about such disclosure please discuss this with the course instructor.']",text-embedding-3-small,512,20,2,"
You are an AI Teaching Assistant for the SEP 775 course. 
Your job is to answer students' questions about course materials according to the instructions and context provided.
If you found the answer based on the context provided, you should provide the answer first, then at the end, beginning a new sentence with the words ""Source:"", followed by the name of the lecture, or assignment, or paper if possible.
",0.9999999999999996,1.0,0.9593096804941648,0.0
47,What is the policy for late submissions in this course?,"The policy for late submissions in this course is not explicitly mentioned in the provided context information. However, it is advisable to refer to the course syllabus or contact the course instructor directly for specific details regarding late submissions. It is important to adhere to the guidelines provided by the instructor to avoid any penalties related to late submissions.","['This behaviour can result in serious consequences e.g. the grade of zero on an assignment loss of credit with a notation on the transcript notation reads Grade of F assigned for academic dishonesty and or suspension or expulsion from the university. For information on the various types of academic dishonesty please refer to the Academic Integrity Policy located at https secretariat.mcmaster.ca university policies procedures guidelines The following illustrates only three forms of academic dishonesty plagiarism e.g. the submission of work that is not one s own or for which other credit has been obtained. improper collaboration in group work. copying or using unauthorized aids in tests and examinations. AUTHENTICITY PLAGIARISM DETECTION Some courses may use a web based service Turnitin.com to reveal authenticity and ownership of student submitted work. For courses using such software students will be expected to submit their work electronically either directly to Turnitin.com or via an online learning platform e.g. A2L etc. using plagiarism detection a service supported by Turnitin.com so it can be checked for academic dishonesty. Students who do not wish their work to be submitted through the plagiarism detection software must inform the Instructor before the assignment is due. No penalty will be assigned to a student who does not submit work to the plagiarism detection software. All submitted work is subject to normal verification that standards of academicintegrity have been upheld e.g. on line search other software etc. . For more details about McMaster s use of Turnitin.com please go to www.mcmaster.ca academicintegrity. COURSES WITH AN ON LINE ELEMENT Some courses may use on line elements e.g. e mail Avenue to Learn A2L LearnLink web pages capa Moodle ThinkingCap etc. . Students should be aware that when they access the electronic components of a course using these elements private information such as first and last names user names for the McMaster e mail accounts and program affiliation may become apparent to all other students in the same course. The available information is dependent on the technology used. Continuation in a course that uses on line elements will be deemed consent to this disclosure. If you have any questions or concerns about such disclosure please discuss this with the course instructor.', '28652 or sas@mcmaster.ca to make arrangements with a Program Coordinator. For further information consult McMaster University s Academic Accommodation of Students with Disabilities policy. ACADEMIC ACCOMMODATION FOR RELIGIOUS INDIGENOUS OR SPIRITUAL OBSERVANCES RISOStudents requiring academic accommodation based on religious indigenous or spiritual observances should follow the procedures set out in the RISO policy. Students should submit their request to their Faculty Office normally within 10 working days of the beginning of term in which they anticipate a need for accommodation or to the Registrar s Office prior to their examinations. Students should also contact their instructors as soon as possible to make alternative arrangements for classes assignments and tests. http www.mcmaster.ca policy Students AcademicStudies Studentcode.pdf COPYRIGHT AND RECORDING Students are advised that lectures demonstrations performances and any other course material provided by an instructor include copyright protected works. The Copyright Act and copyright law protect every original literary dramatic musical and artistic work including lectures by University instructors The recording of lectures tutorials or other methods of instruction may occur during a course. Recording may be done by either the instructor for the purpose of authorized distribution or by a student for the purpose of personal study. Students should be aware that their voice and or image may be recorded by others during the class. Please speak with the instructor if this is a concern for you. EXTREME CIRCUMSTANCES The University reserves the right to change the dates and deadlines for any or all courses in extreme circumstances e.g. severe weather labour disruptions etc. . Changes will be communicated through regular McMaster communication channels such as McMaster Daily News A2L and or McMaster email.']",text-embedding-3-small,512,20,2,"
You are an AI Teaching Assistant for the SEP 775 course. 
Your job is to answer students' questions about course materials according to the instructions and context provided.
If you found the answer based on the context provided, you should provide the answer first, then at the end, beginning a new sentence with the words ""Source:"", followed by the name of the lecture, or assignment, or paper if possible.
",0.0,0.6666666666666666,0.872553856270941,0.0
48,What does the course hope to teach regarding word vectors?,"The course aims to teach about representing word semantics not as one hot vectors, but as a collection of features and relationships to linguistic categories and other words. It emphasizes the idea of building word vectors based on annotated information about words, such as grammatical, derivational, and semantic information, rather than solely relying on one hot vectors. Additionally, the course will explore the limitations of human annotated resources in comparison to methods that can draw vocabulary from naturally occurring text sources. It will also discuss the tradeoff between dimensionality and utility of word embeddings, as well as the importance of allowing data to determine text representations rather than relying solely on human ideas.","['2.3 Vectors from annotated discrete properties. Should we represent word semantics not as one hot vectors but instead as a collection of features and relationships to linguistic categories and other words For any word say runners there is a wealth of information we can annotate about that word. There is grammatical information like plurality there s derivational information like how the runners is something like the verb to run plus a notion of doer or agent think one who runs. There s also semantic information like how runners might be a hyponym of humans or animals or entities. A hyponym is a member of an is a relationship e.g. a runner is a human. There are substantial existing resources in English and a few other languages for various kinds of annotated information about words. WordNet Miller 1995 annotates for synonyms hyponyms and other semantic relations UniMorph Batsuren et al. 2022 annotates for morphology subword structure information across many lan guages. With such resources one could build word vectors that look something like vtea 0 0 1 . . . 1 plural noun 3rd singular verb hyponym of beverage . . . synonym of chai 3 In 2023 word vectors resulting from these methods are not the norm and they won t be the focus of this course. One main failure is that human annotated resources are always lacking in vocabulary compared to methods that can draw a vocabulary from a naturally occuring text source updating these resources is costly and they re always incomplete. Another failure is a tradeoff between dimension ality and utility of the embedding it takes a very high dimensional vector think much larger than the vocabulary size to represent all of these categories and modern neural methods that tend to operate on dense vectors do not behave well with such vectors. Finally a continual theme we ll see in this course is that human ideas of what the right representations should be for text tend to underperform methods that allow data to determine more aspects at least when one has a lot of data to learn from. 3 Distributional semantics and Word2vec A promise of deep learning is to learn rich representations of com plex objects from data. Increasingly relevant in NLP is the idea that we can unsupervisedly learn rich representations from data.', 'This has been done on various datasets that contain human judgement survey data. Model Size WS353 MC RG SCWS RW SVD 6B 35.3 35.1 42.5 38.3 25.6 SVD S 6B 56.5 71.5 71.0 53.6 34.7 SVD L 6B 65.7 72.7 75.1 56.5 37.0 CBOW 6B 57.2 65.6 68.2 57.0 32.5 SG 6B 62.8 65.2 69.7 58.1 37.2 GloVe 6B 65.8 72.7 77.8 53.9 38.1 SVD L 42B 74.0 76.4 74.1 58.3 39.9 GloVe 42B 75.9 83.6 82.9 59.6 47.8 CBOW 100B 68.4 79.6 75.4 59.4 45.5 Table 6 Here we see the correlations be tween of word vector similarities using different embedding techniques with different human judgment datasets 2.6 Further Reading Dealing With Ambiguity One might wonder how we handle the situation where we want to capture the same word with different vectors for its different uses in natural language. For instance run is both a noun and a verb and is used and interpreted differently based on the context. Improving Word Representations Via Global Context And Multi ple Word Prototypes Huang et al 2012 describes how such cases can also be handled in NLP. The essence of the method is the following 1. Gather ﬁxed size context windows of all occurrences of the word for instance 5 before and 5 after 2. Each context is represented by a weighted average of the context words vectors using idf weighting 3. Apply spherical k means to cluster these context representations. 4. Finally each word occurrence is re labeled to its associated cluster and is used to train the word representation for that cluster.']",text-embedding-3-small,512,20,2,"
You are an AI Teaching Assistant for the SEP 775 course. 
Your job is to answer students' questions about course materials according to the instructions and context provided.
If you found the answer based on the context provided, you should provide the answer first, then at the end, beginning a new sentence with the words ""Source:"", followed by the name of the lecture, or assignment, or paper if possible.
",0.9025042410701696,0.8,0.9086647537820284,0.0454545454545454
49,How does Word2vec represent word meaning?,"Word2vec represents word meaning by assigning a dense vector to each word in such a way that words with similar meanings have vectors that are close together in the vector space. This is achieved by capturing the context in which words appear in a large corpus of text and learning to encode similarity in the vectors themselves based on the words that frequently appear close by. The vectors are adjusted to maximize the probability of context words given the center word or vice versa, ultimately creating word embeddings that capture semantic relationships between words.","['500 000 Means one 1 the rest 0s 16Problem with words as discrete symbols 17 Example in web search if a user searches for Seattle motel we would like to match documents containing Seattle hotel But motel 0 0 0 0 0 0 0 0 0 0 1 0 0 0 0 hotel 0 0 0 0 0 0 0 1 0 0 0 0 0 0 0 These two vectors are orthogonal There is no natural notion of similarity for one hot vectors Solution Could try to rely on WordNet s list of synonyms to get similarity But it is well known to fail badly incompleteness etc. Instead learn to encode similarity in the vectors themselves Sec. 9.2.2Representing words by their context 21 Distributional semantics A word s meaning is given by the words that frequently appear close by You shall know a word by the company it keeps J. R. Firth 1957 11 One of the most successful ideas of modern statistical NLP When a word w appears in a text its context is the set of words that appear nearby within a fixed size window . We use the many contexts of w to build up a representation of w government debt problems turning into banking crises as happened in 2009 saying that Europe needs unified banking regulation to replace the hodgepodge India has just given its banking system a shot in the arm These context words will represent bankingWord vectors We will build a dense vector for each word chosen so that it is similar to vectors of words that appear in similar contexts measuring similarity as the vector dot scalar product Note word vectors are also called word embeddings or neural word representations They are a distributed representation banking 0.286 0.792 0.177 0.107 0.109 0.542 0.349 0.271 monetary 0.413 0.582 0.007 0.247 0.216 0.718 0.147 0.051 19Word meaning as a neural word vector visualization 0.286 0.792 0.177 0.107 0.109 0.542 0.349 0.271 0.487 expect 203.', 'Word2vec Overview 21 Word2vec Mikolov et al. 2013 is a framework for learning word vectors Idea We have a large corpus body of text a long list of words Every word in a fixed vocabulary is represented by a vector Go through each position t in the text which has a center word c and context outside words o Use the similarity of the word vectors for c and o to calculate the probability of o given c or vice versa Keep adjusting the word vectors to maximize this probabilityWord2Vec Overview Example windows and process for computing 𝑃𝑤𝑡 𝑗 𝑤𝑡 crises banking into turning problems as center word at position t outside context words in window of size 2 outside context words in window of size 2 𝑃𝑤𝑡 1 𝑤𝑡 22 𝑃𝑤𝑡 2 𝑤𝑡 𝑃𝑤𝑡 1 𝑤𝑡 𝑃𝑤𝑡 2 𝑤𝑡Word2Vec Overview Example windows and process for computing 𝑃𝑤𝑡 𝑗 𝑤𝑡 crises banking into turning problems as center word at position t outside context words in window of size 2 outside context words in window of size 2 𝑃𝑤𝑡 2 𝑤𝑡 𝑃𝑤𝑡 1 𝑤𝑡 23 𝑃𝑤𝑡 2 𝑤𝑡 𝑃𝑤𝑡 1 𝑤𝑡Word2vec objective function For each position 𝑡 1 𝑇 predict context words within a window of fixed size m given center word 𝑤𝑡. Data likelihood The objective function 𝐽𝜃is the average negative log likelihood Minimizing objective function Maximizing predictive accuracy sometimes called a cost or loss function 24Word2vec objective function We want to minimize the objective function Question How to calculate 𝑃𝑤𝑡 𝑗 𝑤𝑡 𝜃 Answer We will use two vectors per word w']",text-embedding-3-small,512,20,2,"
You are an AI Teaching Assistant for the SEP 775 course. 
Your job is to answer students' questions about course materials according to the instructions and context provided.
If you found the answer based on the context provided, you should provide the answer first, then at the end, beginning a new sentence with the words ""Source:"", followed by the name of the lecture, or assignment, or paper if possible.
",0.9861516959628354,1.0,0.9559762956099018,0.2
50,What is the main focus of this lecture on neural networks?,"The main focus of this lecture on neural networks is to introduce single and multilayer neural networks, explain how they can be used for classification purposes, discuss how they can be trained using backpropagation, provide practical tips and tricks for training neural networks, and motivate the use of recurrent neural networks as a language model.","['file name: lecture02 notes Backpropagation.  Neural networks. Forward computation. Backward propagation. Neuron Units. Max margin Loss. Gradient checks. Xavier parameter initialization. Learning rates. Adagrad. This set of notes introduces single and multilayer neural networks and how they can be used for classiﬁcation purposes. We then dis cuss how they can be trained using a distributed gradient descent technique known as backpropagation. We will see how the chain rule can be used to make parameter updates sequentially. After a rigorous mathematical discussion of neural networks we will discuss some practical tips and tricks in training neural networks involving neuron units non linearities gradient checks Xavier parameter ini tialization learning rates Adagrad etc. Lastly we will motivate the use of recurrent neural networks as a language model. 1 Neural Networks Foundations Figure 1 We see here how a non linear decision boundary separates the data very well. This is the prowess of neural networks. Fun Fact Neural networks are biologically in spired classiﬁers which is why they are often called artiﬁcial neural networks to distinguish them from the organic kind. However in reality human neural networks are so much more capable and complex from artiﬁcial neural net works that it is usually better to not draw too many parallels between the two. We established in our previous discussions the need for non linear classiﬁers since most data are not linearly separable and thus our classiﬁcation performance on them is limited. Neural networks are a family of classiﬁers with non linear decision boundary as seen in Figure 1. Now that we know the sort of decision boundaries neural networks create let us see how they manage doing so. 1.1 A Neuron A neuron is a generic computational unit that takes n inputs and produces a single output. What differentiates the outputs of different neurons is their parameters also referred to as their weights . One of the most popular choices for neurons is the sigmoid or binary lo gistic regression unit.', 'file name: lecture03 RNNs and LLMs. Hamidreza Mahyar mahyarh@mcmaster.ca Computational Natural Language Processing Language Models and Recurrent Neural NetsLecture Plan 1. A bit more about neural networks Language modeling RNNs 2. A new NLP task Language Modeling 4. Problems with RNNs 5. Recap on RNNs LMs Reminders You should have started working on Assignment 1 2 motivates 3. A new family of neural networks Recurrent Neural Networks RNNs This is the most important concept in the class It leads to GPT 3 and ChatGPT Important and used in Ass1 but not the only way to build LMs0 model power Training error Test error Classic view Regularization works to prevent overfitting when we have a lot of features or later a very powerful deep model etc. Now Regularization produces models that generalize well when we have a big model We do not care that our models overfit on the training data even though they are hugely overfit error overfitting We have models with many parameters Regularization 3 A full loss function includes regularization over all parameters 𝜃 e.g. L2 regularizationDropout Srivastava Hinton Krizhevsky Sutskever Salakhutdinov 2012 JMLR 2014 4 Preventing Feature Co adaptation Good Regularization Method Use it everywhere Training time at each instance of evaluation in online SGD training randomly set 50 p of the inputs to each neuron to 0 Test time halve the model weights now twice as many Except usually only drop first layer inputs a little 15 or not at all This prevents feature co adaptation A feature cannot only be useful in the presence of particular other features In a single layer A kind of middle ground between Naïve Bayes where all feature weights are set independently and logistic regression models where weights are set in the context of all others Can be thought of as a form of model bagging i.e.']",text-embedding-3-small,512,20,2,"
You are an AI Teaching Assistant for the SEP 775 course. 
Your job is to answer students' questions about course materials according to the instructions and context provided.
If you found the answer based on the context provided, you should provide the answer first, then at the end, beginning a new sentence with the words ""Source:"", followed by the name of the lecture, or assignment, or paper if possible.
",1.0000000000000002,1.0,0.9088973675431102,0.0357142857142857
51,What are the non-linear functions mentioned for neural networks?,"The non-linear functions mentioned for neural networks are logistic, tanh, ReLU, Swish, Leaky ReLU, Parametric ReLU, and GELU. These functions are used for introducing non-linearities in neural networks to perform tasks like function approximation. 

Source: lecture02 Neural Nets. Hamidreza Mahyar","['file name: lecture02 Neural Nets. Hamidreza Mahyar mahyarh@mcmaster.ca Computational Natural Language Processing Neural Networks Gradients and BackpropagationBinary classification for center word being location We do supervised training and want high score if it s a location 𝐽𝑡𝜃 𝜎𝑠 1 1 𝑒 𝑠 x xmuseums xin xParis xare xamazing predicted model probability of class f Some element wise non linear function e.g. logistic tanh ReLU 2 R5d Embedding of 1 hot wordsNeural computation Original McCulloch Pitts 1943 threshold unit 𝟏 𝑊𝑥 𝜃 𝟏 𝑊𝑥 𝜃 0 This function has no slope so no gradient based learning 3tanh is just a rescaled and shifted sigmoid 2 as steep 1 1 tanh z 2logistic 2z 1 Logistic and tanh are still used e.g. logistic to get a probability However now for deep networks the first thing to try is ReLU it trains quickly and performs well due to good gradient backflow. ReLU has a negative dead zone that recent proposals mitigate GELU is frequently used with Transformers BERT RoBERTa etc. Non linearities old and new logistic sigmoid tanh hard tanh 1 0 1 1 Swish arXiv 1710.05941 swish 𝑥 𝑥. logistic 𝑥 Rectified Linear Unit ReLU ReLU 𝑧 max 𝑧 0 Leaky ReLU Parametric ReLU 0 0 0 GELU arXiv 1606.08415 GELU 𝑥 𝑥. 𝑃𝑋 𝑥 𝑋 𝑁 0 1 𝑥. logistic 1.702𝑥Non linearities i.e. f on previous slide Why they re needed Neural networks do function approximation e.g.', 'Then during back propagation we only pass gradients through neurons that were kept alive during the forward pass. Finally during testing we compute the forward pass using all of the neurons in the network. However a key sub tlety is that in order for dropout to work effectively the expected output of a neuron during testing should be approximately the same as it was during training else the magnitude of the outputs could be radically different and the behavior of the network is no longer well deﬁned. Thus we must typically divide the outputs of each neuron during testing by a certain value it is left as an exercise to the reader to determine what this value should be in order for the expected outputs during training and testing to be equivalent. 2.4 Neuron Units So far we have discussed neural networks that contain sigmoidal neurons to introduce nonlinearities however in many applications better networks can be designed using other activation functions. Some common choices are listed here with their function and gra dient deﬁnitions and these can be substituted with the sigmoidal functions discussed above. Sigmoid This is the default choice we have discussed the activation function σ is given by Figure 9 The response of a sigmoid nonlinearity σ z 1 1 exp z where σ z 0 1 The gradient of σ z is σ z exp z 1 exp z σ z 1 σ z Tanh The tanh function is an alternative to the sigmoid function that is often found to converge faster in practice. The primary differ ence between tanh and sigmoid is that tanh output ranges from 1 to 1 while the sigmoid ranges from 0 to 1. Figure 10 The response of a tanh nonlinearity tanh z exp z exp z exp z exp z 2σ 2z 1 where tanh z 1 1 The gradient of tanh z is tanh z 1 exp z exp z exp z exp z 2 1 tanh2 z Hard tanh The hard tanh function is sometimes preferred over the tanh function since it is computationally cheaper. It does however saturate for magnitudes of z greater than 1.']",text-embedding-3-small,512,20,2,"
You are an AI Teaching Assistant for the SEP 775 course. 
Your job is to answer students' questions about course materials according to the instructions and context provided.
If you found the answer based on the context provided, you should provide the answer first, then at the end, beginning a new sentence with the words ""Source:"", followed by the name of the lecture, or assignment, or paper if possible.
",0.990252641413291,1.0,0.9618858332808448,0.0588235294117647
52,What is the purpose of non-linearities in neural networks?,"The purpose of non-linearities in neural networks is to enable them to approximate complex functions that cannot be represented by linear transformations alone. Non-linearities allow neural networks to create non-linear decision boundaries, which are essential for improving classification performance on data that is not linearly separable.","['file name: lecture02 notes Backpropagation.  Neural networks. Forward computation. Backward propagation. Neuron Units. Max margin Loss. Gradient checks. Xavier parameter initialization. Learning rates. Adagrad. This set of notes introduces single and multilayer neural networks and how they can be used for classiﬁcation purposes. We then dis cuss how they can be trained using a distributed gradient descent technique known as backpropagation. We will see how the chain rule can be used to make parameter updates sequentially. After a rigorous mathematical discussion of neural networks we will discuss some practical tips and tricks in training neural networks involving neuron units non linearities gradient checks Xavier parameter ini tialization learning rates Adagrad etc. Lastly we will motivate the use of recurrent neural networks as a language model. 1 Neural Networks Foundations Figure 1 We see here how a non linear decision boundary separates the data very well. This is the prowess of neural networks. Fun Fact Neural networks are biologically in spired classiﬁers which is why they are often called artiﬁcial neural networks to distinguish them from the organic kind. However in reality human neural networks are so much more capable and complex from artiﬁcial neural net works that it is usually better to not draw too many parallels between the two. We established in our previous discussions the need for non linear classiﬁers since most data are not linearly separable and thus our classiﬁcation performance on them is limited. Neural networks are a family of classiﬁers with non linear decision boundary as seen in Figure 1. Now that we know the sort of decision boundaries neural networks create let us see how they manage doing so. 1.1 A Neuron A neuron is a generic computational unit that takes n inputs and produces a single output. What differentiates the outputs of different neurons is their parameters also referred to as their weights . One of the most popular choices for neurons is the sigmoid or binary lo gistic regression unit.', 'f on previous slide Why they re needed Neural networks do function approximation e.g. regression or classification Without non linearities deep neural networks can t do anything more than a linear transform Extra layers could just be compiled down into a single linear transform W1 W2 x Wx But with more layers that include non linearities they can approximate any complex function 5Training with cross entropy loss you use this in PyTorch Until now our objective was stated as to maximize the probability of the correct class y or equivalently we can minimize the negative log probability of that class Now restated in terms of cross entropy a concept from information theory Let the true probability distribution be p let our computed model probability be q The cross entropy is Assuming a ground truth or true or gold or target probability distribution that is 1 at the right class and 0 everywhere else p 0 0 1 0 0 then Because of one hot p the only term left is the negative log probability of the true class yi log 𝑝 𝑦i 𝑥i Cross entropy can be used in other ways with a more interesting p but for now just know that you ll want to use it as the loss in PyTorch 6Remember Stochastic Gradient Descent Update equation i.e. for each parameter In deep learning 𝜃includes the data representation e.g. word vectors too How can we compute 𝜃𝐽 𝜃 1. By hand 2. Algorithmically the backpropagation algorithm 𝛼 step size or learning rate 7Lecture Plan 8 Gradients 1. Introduction 2. Matrix calculus 3.']",text-embedding-3-small,512,20,2,"
You are an AI Teaching Assistant for the SEP 775 course. 
Your job is to answer students' questions about course materials according to the instructions and context provided.
If you found the answer based on the context provided, you should provide the answer first, then at the end, beginning a new sentence with the words ""Source:"", followed by the name of the lecture, or assignment, or paper if possible.
",1.0000000000000004,1.0,0.929837958729138,0.04
53,What is cross entropy loss used for in PyTorch?,"Cross entropy loss is used in PyTorch to minimize the negative log probability of the correct class, which helps in training neural networks effectively by updating the model parameters to improve its performance in tasks like regression or classification. It is a concept from information theory that compares the true probability distribution with the computed model probability distribution. By using cross entropy loss, the model aims to improve its predictions by minimizing the difference between the two distributions. 

Source: Lecture02_Neural_Nets.","['f on previous slide Why they re needed Neural networks do function approximation e.g. regression or classification Without non linearities deep neural networks can t do anything more than a linear transform Extra layers could just be compiled down into a single linear transform W1 W2 x Wx But with more layers that include non linearities they can approximate any complex function 5Training with cross entropy loss you use this in PyTorch Until now our objective was stated as to maximize the probability of the correct class y or equivalently we can minimize the negative log probability of that class Now restated in terms of cross entropy a concept from information theory Let the true probability distribution be p let our computed model probability be q The cross entropy is Assuming a ground truth or true or gold or target probability distribution that is 1 at the right class and 0 everywhere else p 0 0 1 0 0 then Because of one hot p the only term left is the negative log probability of the true class yi log 𝑝 𝑦i 𝑥i Cross entropy can be used in other ways with a more interesting p but for now just know that you ll want to use it as the loss in PyTorch 6Remember Stochastic Gradient Descent Update equation i.e. for each parameter In deep learning 𝜃includes the data representation e.g. word vectors too How can we compute 𝜃𝐽 𝜃 1. By hand 2. Algorithmically the backpropagation algorithm 𝛼 step size or learning rate 7Lecture Plan 8 Gradients 1. Introduction 2. Matrix calculus 3.', 'The cross entropy can never be lower than the true entropy so a model cannot err by underestimating the true entropy. We are ﬁnally ready to see the relation between perplexity and cross entropy as we saw it in Eq. 3.51. Cross entropy is deﬁned in the limit as the length of the observed word sequence goes to inﬁnity. We will need an approximation to cross entropy relying on a sufﬁciently long sequence of ﬁxed length. This approxima tion to the cross entropy of a model M P wi wi N 1 i 1 on a sequence of words W is H W 1 N logP w1w2 ...wN 3.53 The perplexity of a model P on a sequence of words W is now formally deﬁned as perplexity 2 raised to the power of this cross entropy3.9 SUMMARY 25 Perplexity W 2H W P w1w2 ...wN 1 N N s 1 P w1w2 ...wN N v u u t N Y i 1 1 P wi w1 ...wi 1 3.54 3.9 Summary This chapter introduced language modeling and the n gram one of the most widely used tools in language processing. Language models offer a way to assign a probability to a sentence or other sequence of words and to predict a word from preceding words. n grams are Markov models that estimate words from a ﬁxed window of pre vious words. n gram probabilities can be estimated by counting in a corpus and normalizing the maximum likelihood estimate . n gram language models are evaluated extrinsically in some task or intrinsi cally using perplexity. The perplexity of a test set according to a language model is the geometric mean of the inverse test set probability computed by the model. Smoothing algorithms provide a more sophisticated way to estimate the prob ability of n grams. Commonly used smoothing algorithms for n grams rely on lower order n gram counts through backoff or interpolation. Both backoff and interpolation require discounting to create a probability dis tribution. Kneser Ney smoothing makes use of the probability of a word being a novel continuation.']",text-embedding-3-small,512,20,2,"
You are an AI Teaching Assistant for the SEP 775 course. 
Your job is to answer students' questions about course materials according to the instructions and context provided.
If you found the answer based on the context provided, you should provide the answer first, then at the end, beginning a new sentence with the words ""Source:"", followed by the name of the lecture, or assignment, or paper if possible.
",0.9999999999999988,1.0,0.9675997732045024,0.0476190476190476
54,What is the significance of the backpropagation algorithm?,"The significance of the backpropagation algorithm lies in its ability to efficiently calculate loss gradients for parameters in a neural network by utilizing the chain rule of differentiation. This allows for updating parameters through techniques like gradient descent, enabling the model to learn and improve its performance over time. Backpropagation is crucial for training neural networks as it provides a systematic way to adjust the model's parameters based on the error signal propagated backwards through the network, ultimately leading to better accuracy and convergence during the training process.","['No parameter updates are necessary if the cost is 0. Since we typically update parameters using gradient descent or a variant such as SGD we typically need the gradient information for any parameter as required in the update equation θ t 1 θ t α θ t J Backpropagation is technique that allows us to use the chain rule of differentiation to calculate loss gradients for any parameter used in the feed forward computation on the model. To understand this further let us understand the toy network shown in Figure 5 for which we will perform backpropagation. Figure 5 This is a 4 2 1 neural network where neuron j on layer k receives input z k j and produces activation output a k j . Here we use a neural network with a single hidden layer and a single unit output. Let us establish some notation that will make it easier to generalize this model later xi is an input to the neural network. s is the output of the neural network. Each layer including the input and output layers has neurons which receive an input and produce an output. The j th neuron of layer k receives the scalar input z k j and produces the scalar activation output a k j . We will call the backpropagated error calculated at z k j as δ k j . Layer 1 refers to the input layer and not the ﬁrst hidden layer. For the input layer xj z 1 j a 1 j . W k is the transfer matrix that maps the output from the k th layer to the input to the k 1 th Thus W 1 W and W 2 U to put this new generalized notation in perspective of Section 1.3. Backpropagation Notation xi is an input to the neural network. s is the output of the neural net work. The j th neuron of layer k receives the scalar input z k j and produces the scalar activation output a k j . For the input layer xj z 1 j a 1 j . W k is the transfer matrix that maps the output from the k th layer to the input to the k 1 th. Thus W 1 W and W 2 UT using notation from Section 1.3.', 'Figure 6 This subnetwork shows the relevant parts of the network required to update W 1 ij Let us discuss the error sharing distribution interpretation of backpropagation better using Figure 6 as an example. Say we were to update W 1 14 1. We start with the an error signal of 1 propagating backwards from a 3 1 . 2. We then multiply this error by the local gradient of the neuron which maps z 3 1 to a 3 1 . This happens to be 1 in this case and thus the error is still 1. This is now known as δ 3 1 1. 3. At this point the error signal of 1 has reached z 3 1 . We now need to distribute the error signal so that the fair share of the error reaches to a 2 1 . 4. This amount is the error signal at z 3 1 δ 3 1 W 2 1 W 2 1 . Thus the error at a 2 1 W 2 1 . 5. As we did in step 2 we need to move the error across the neuron which maps z 2 1 to a 2 1 . We do this by multiplying the error signal at a 2 1 by the local gradient of the neuron which happens to be f z 2 1 . 6. Thus the error signal at z 2 1 is f z 2 1 W 2 1 . This is known as δ 2 1 . 7. Finally we need to distribute the fair share of the error to W 1 14 by simply multiplying it by the input it was responsible for for warding which happens to be a 1 4 . 8. Thus the gradient of the loss with respect to W 1 14 is calculated to be a 1 4 f z 2 1 W 2 1 . Notice that the result we arrive at using this approach is exactly the same as that we arrived at using explicit differentiation earlier.']",text-embedding-3-small,512,20,2,"
You are an AI Teaching Assistant for the SEP 775 course. 
Your job is to answer students' questions about course materials according to the instructions and context provided.
If you found the answer based on the context provided, you should provide the answer first, then at the end, beginning a new sentence with the words ""Source:"", followed by the name of the lecture, or assignment, or paper if possible.
",1.000000000000001,1.0,0.9525436040262028,0.03125
55,What does the Jacobian matrix represent in the context of neural networks?,"The Jacobian matrix in the context of neural networks represents an m x n matrix of partial derivatives, where m is the number of outputs and n is the number of inputs of a given function. It generalizes the concept of the gradient to functions with multiple outputs and inputs, providing a comprehensive view of how each input affects each output simultaneously. The Jacobian matrix is crucial for understanding the sensitivity of the outputs to changes in the inputs in complex neural network architectures. 

Source: lecture02_Neural_Nets.txt","['So if k i everything in the sum is zero and the gradient is zero. Otherwise the only nonzero element of the sum is when l j so we just get xj. Thus we ﬁnd zk Wij xj if k i and 0 if otherwise. Another way of writing this is z Wij 0 . . . 0 xj 0 . . . 0 ith element Now let s compute J Wij J Wij J z z Wij δ z Wij m X k 1 δk zk Wij δixj the only nonzero term in the sum is δi zi Wij . To get J W we want a ma trix where entry i j is δixj. This matrix is equal to the outer product J W δT xT 6 Row vector time matrix with respect to the matrix z xW δ J z what is J W δ z W A similar computation to 5 shows that J W xT δ . 7 Cross entropy loss with respect to logits ˆ y softmax θ J CE y ˆ y what is J θ The gradient is J θ ˆ y y or ˆ y y T if y is a column vector . 4These identities will be enough to let you quickly compute the gradients for many neural networks. However it s important to know how to compute Jacobians for other functions as well in case they show up. Some examples if you want practice dot product of two vectors elementwise product of two vectors 2 norm of a vector. Feel free to use these identities in the assignments. One option is just to memorize them. Another option is to ﬁgure them out by looking at the dimensions. For example only one ordering orientation of δ and x will produce the correct shape for J W assuming W is not square . 4 Gradient Layout Jacobean formulation is great for applying the chain rule you just have to mul tiply the Jacobians. However when doing SGD it s more convenient to follow the convention the shape of the gradient equals the shape of the parameter as we did when computing J W . That way subtracting the gradient times the learning rate from the parameters is easy. We expect answers to homework questions to follow this convention.', 'Introduction 2. Matrix calculus 3. BackpropagationComputing Gradients by Hand 9 Matrix calculus Fully vectorized gradients Multivariable calculus is just like single variable calculus if you use matrices Much faster and more useful than non vectorized gradients But doing a non vectorized gradient can be good for intuition recall the first lecture for an exampleGradients Given a function with 1 output and 1 input 𝑓𝑥 𝑥3 It s gradient slope is its derivative 𝑑f 3𝑥2 10 𝑑𝑥 How much will the output change if we change the input a bit At x 1 it changes about 3 times as much 1.013 1.03 At x 4 it changes about 48 times as much 4.013 64.48Gradients Given a function with 1 output and n inputs Its gradient is a vector of partial derivatives with respect to each input 11Jacobian Matrix Generalization of the Gradient Given a function with m outputs and n inputs It s Jacobian is an m x n matrix of partial derivatives 12Chain Rule For composition of one variable functions multiply derivatives For multiple variables functions multiply Jacobians 13Example Jacobian Elementwise activation Function 14Example Jacobian Elementwise activation Function Function has n outputs and n inputs n by n Jacobian 15Example Jacobian Elementwise activation Function 16Example Jacobian Elementwise activation Function 17Example Jacobian Elementwise activation Function 18Other Jacobians Compute these at home for practice Check your answers with the lecture notes 19Other Jacobians Compute these at home for practice Check your answers with the lecture notes 20Other Jacobians Compute these at home for practice Check your answers with the lecture notes Fine print This is the correct Jacobian. Later we discuss the shape convention using it the answer would be h. 21Other Jacobians Compute these at home for practice 22Back to our Neural Net x xmuseums xin xParis xare xamazing 23Back to our Neural Net Let s find Really we care about the gradient of the loss Jt but we will compute the gradient of the score for simplicity x xmuseums xin xParis xare xamazing 241.']",text-embedding-3-small,512,20,2,"
You are an AI Teaching Assistant for the SEP 775 course. 
Your job is to answer students' questions about course materials according to the instructions and context provided.
If you found the answer based on the context provided, you should provide the answer first, then at the end, beginning a new sentence with the words ""Source:"", followed by the name of the lecture, or assignment, or paper if possible.
",0.9999999999999988,1.0,0.9400541351341388,0.6956521739130435
56,How is the derivative with respect to a matrix described?,"The derivative with respect to a matrix is described as a Jacobian matrix. When computing the gradient of a loss function with respect to a matrix W, the Jacobian J W is arranged as an n x m matrix, where each entry represents the derivative of the loss function with respect to a specific entry in the matrix W. This arrangement allows for easier handling of gradients during optimization algorithms like gradient descent.","['So z x ij zi xj xj f xi f xi if i j 0 if otherwise So we see that the Jacobian z x is a diagonal matrix where the entry at i i is the derivative of f applied to xi. We can write this as z x diag f x . Since multiplication by a diagonal matrix is the same as doing elementwise multiplication by the diagonal we could also write f x when applying the chain rule. 5 Matrix times column vector with respect to the matrix z W x δ J z what is J W J z z W δ z W This is a bit more complicated than the other identities. The reason for in cluding J z in the above problem formulation will become clear in a moment. First suppose we have a loss function J a scalar and are computing its gradient with respect to a matrix W Rn m. Then we could think of J as a function of W taking nm inputs the entries of W to a single output J . This means the Jacobian J W would be a 1 nm vector. But in practice this is not a very useful way of arranging the gradient. It would be much nicer if the derivatives were in a n m matrix like this J W J W11 . . . J W1m . . . ... . . . J Wn1 . . . J Wnm Since this matrix has the same shape as W we could just subtract it times the learning rate from W when doing gradient descent. So in a slight abuse of notation let s ﬁnd this matrix as J W instead. This way of arranging the gradients becomes complicated when computing z W . Unlike J z is a vector. So if we are trying to rearrange the gradients like with J W z W would be an n m n tensor Luckily we can avoid the issue by taking the gradient with respect to a single weight Wij instead. 3z Wij is just a vector which is much easier to deal with. We have zk m X l 1 Wklxl zk Wij m X l 1 xl Wij Wkl Note that Wij Wkl 1 if i k and j l and 0 if otherwise. So if k i everything in the sum is zero and the gradient is zero.', 'Using the regular chain rule we can compute the derivative of g as the Jacobian g x xg1 f1 x f2 x xg2 f1 x f2 x g1 f1 f1 x g1 f2 f2 x g2 f1 f1 x g2 f2 f2 x 1And we see this is the same as multiplying the two Jacobians g x g f f x g1 f1 g1 f2 g2 f1 g2 f2 f1 x f2 x 3 Useful Identities This section will now go over how to compute the Jacobian for several simple functions. It will provide some useful identities you can apply when taking neu ral network gradients. 1 Matrix times column vector with respect to the column vector z W x what is z x Suppose W Rn m. Then we can think of z as a function of x taking an m dimensional vector to an n dimensional vector. So its Jacobian will be n m. Note that zi m X k 1 Wikxk So an entry z x ij of the Jacobian will be z x ij zi xj xj m X k 1 Wikxk m X k 1 Wik xj xk Wij because xj xk 1 if k j and 0 if otherwise. So we see that z x W 2 Row vector times matrix with respect to the row vector z xW what is z x A computation similar to 1 shows that z x W T . 3 A vector with itself z x what is z x We have zi xi. So z x ij zi xj xj xi 1 if i j 0 if otherwise So we see that the Jacobian z x is a diagonal matrix where the entry at i i is 1. This is just the identity matrix z x I . When applying the chain 2rule this term will disappear because a matrix or vector multiplied by the identity matrix does not change. 4 An elementwise function applied a vector z f x what is z x Since f is being applied elementwise we have zi f xi .']",text-embedding-3-small,512,20,2,"
You are an AI Teaching Assistant for the SEP 775 course. 
Your job is to answer students' questions about course materials according to the instructions and context provided.
If you found the answer based on the context provided, you should provide the answer first, then at the end, beginning a new sentence with the words ""Source:"", followed by the name of the lecture, or assignment, or paper if possible.
",0.9682711592357608,1.0,0.8858172847164687,0.0344827586206896
57,What role does automatic differentiation play in modern deep learning frameworks?,"Automatic differentiation plays a crucial role in modern deep learning frameworks as they compute gradients for you, which simplifies the process of training neural networks. Understanding how automatic differentiation works is essential for debugging and improving models, as backpropagation doesn't always work perfectly out of the box. It allows developers to focus on designing and implementing neural network architectures without having to manually calculate gradients, making the training process more efficient and less error-prone. (Source: SEP 775 - Computational Natural Language Processing, lecture02_Neural_Nets.txt)","['do backpropagation for you but mainly leave layer node writer to hand calculate the local derivative 74Backprop Implementations 75Implementation forward backward API 76Implementation forward backward API 77Manual Gradient checking Numeric Gradient For small h 1e 4 Easy to implement correctly But approximate and very slow You have to recompute f for every parameter of our model Useful for checking your implementation In the old days we hand wrote everything doing this everywhere was the key test Now much less needed you can use it to check layers are correctly implemented 78Summary We ve mastered the core technology of neural nets Backpropagation recursively and hence efficiently apply the chain rule along computation graph downstream gradient upstream gradient x local gradient Forward pass compute results of operations and save intermediate values Backward pass apply chain rule to compute gradients 79Why learn all these details about gradients 80 Modern deep learning frameworks compute gradients for you But why take a class on compilers or systems when they are implemented for you Understanding what is going on under the hood is useful Backpropagation doesn t always work perfectly out of the box Understanding why is crucial for debugging and improving models See Karpathy article https medium.com @karpathy yes you should understand backprop e2f06eab496b Example in future lecture exploding and vanishing gradients', 'Introduction 2. Matrix calculus 3. BackpropagationComputing Gradients by Hand 9 Matrix calculus Fully vectorized gradients Multivariable calculus is just like single variable calculus if you use matrices Much faster and more useful than non vectorized gradients But doing a non vectorized gradient can be good for intuition recall the first lecture for an exampleGradients Given a function with 1 output and 1 input 𝑓𝑥 𝑥3 It s gradient slope is its derivative 𝑑f 3𝑥2 10 𝑑𝑥 How much will the output change if we change the input a bit At x 1 it changes about 3 times as much 1.013 1.03 At x 4 it changes about 48 times as much 4.013 64.48Gradients Given a function with 1 output and n inputs Its gradient is a vector of partial derivatives with respect to each input 11Jacobian Matrix Generalization of the Gradient Given a function with m outputs and n inputs It s Jacobian is an m x n matrix of partial derivatives 12Chain Rule For composition of one variable functions multiply derivatives For multiple variables functions multiply Jacobians 13Example Jacobian Elementwise activation Function 14Example Jacobian Elementwise activation Function Function has n outputs and n inputs n by n Jacobian 15Example Jacobian Elementwise activation Function 16Example Jacobian Elementwise activation Function 17Example Jacobian Elementwise activation Function 18Other Jacobians Compute these at home for practice Check your answers with the lecture notes 19Other Jacobians Compute these at home for practice Check your answers with the lecture notes 20Other Jacobians Compute these at home for practice Check your answers with the lecture notes Fine print This is the correct Jacobian. Later we discuss the shape convention using it the answer would be h. 21Other Jacobians Compute these at home for practice 22Back to our Neural Net x xmuseums xin xParis xare xamazing 23Back to our Neural Net Let s find Really we care about the gradient of the loss Jt but we will compute the gradient of the score for simplicity x xmuseums xin xParis xare xamazing 241.']",text-embedding-3-small,512,20,2,"
You are an AI Teaching Assistant for the SEP 775 course. 
Your job is to answer students' questions about course materials according to the instructions and context provided.
If you found the answer based on the context provided, you should provide the answer first, then at the end, beginning a new sentence with the words ""Source:"", followed by the name of the lecture, or assignment, or paper if possible.
",1.0000000000000002,0.0,0.9206751587456968,0.1666666666666666
58,What is the purpose of manual gradient checking?,"The purpose of manual gradient checking is to compare analytical gradients with numerical gradients in order to verify the correctness of the analytical gradients. This process helps ensure that the gradients calculated analytically are accurate and can be used for training neural networks effectively. It provides a way to validate the implementation of backpropagation by comparing the gradients computed through backpropagation with numerical approximations, helping to catch errors in the gradient computation process. 

Source: SEP 775 - Computational Natural Language Processing, lecture02_notes_Backpropagation.txt","['We note that this deﬁnition of the numerical gradient follows very naturally from the deﬁnition of the derivative where in the scalar case f x f x ϵ f x ϵ Gradient checks are a great way to compare analytical and numerical gradients. Analytical gradients should be close and numerical gradients can be calculated using f θ J θ i J θ i 2ϵ J θ i and J θ i can be evalu ated using two forward passes. An implementation of this can be seen in Snippet 2.1. Of course there is a slight difference the deﬁnition above only perturbs x in the positive direction to compute the gradient. While it would have been perfectly acceptable to deﬁne the numerical gradi ent in this way in practice it is often more precise and stable to use the centered difference formula where we perturb a parameter in both directions. The intuition is that to get a better approximation of the derivative slope around a point we need to examine the func tion f s behavior both to the left and right of that point. It can also be shown using Taylor s theorem that the centered difference formula has an error proportional to ϵ2 which is quite small whereas the derivative deﬁnition is more error prone. Now a natural question you might ask is if this method is so pre cise why do we not use it to compute all of our network gradients instead of applying back propagation The simple answer as hinted earlier is inefﬁciency recall that every time we want to compute the gradient with respect to an element we need to make two forward passes through the network which will be computationally expen sive. Furthermore many large scale neural networks can contain millions of parameters and computing two passes per parameter is clearly not optimal. And since in optimization techniques such as SGD we must compute the gradients once per iteration for several thousands of iterations it is obvious that this method quickly grows intractable. This inefﬁciency is why we only use gradient check to verify the correctness of our analytic gradients which are much quicker to compute.', 'This means that when stochastic gradient descent SGD reaches the wall and does a gradient descent step it will be forced to jump across the valley moving perpen dicular to the steep walls possibly leaving the valley and disrupting the learning process. The dashed arrows in Fig. 6 correspond to ignoring the norm of this large step ensuring that the model stays close to the wall. The key insight is that all the steps taken when the gradient explodes are aligned with v and ignore other descent direction i.e. the model moves perpendicular to the wall . At the wall a small norm step in the direction of the gradient there fore merely pushes us back inside the smoother low curvature region besides the wall whereas a regular gradient step would bring us very far thus slowing or preventing further training. Instead with a bounded step we get back in that smooth region near the wall where SGD is free to explore other descent directions. The important addition in this scenario to the classical high curvature valley is that we assume that the val ley is wide as we have a large region around the wall where if we land we can rely on ﬁrst order methods to move towards the local minima. This is why just clipping the gradient might be suﬃcient not requiring the use a second order method. Note that this algo rithm should work even when the rate of growth of the gradient is not the same as the one of the curvature a case for which a second order method would fail as the ratio between the gradient and curvature could still explode . Our hypothesis could also help to understand the re cent success of the Hessian Free approach compared to other second order methods. There are two key dif ferences between Hessian Free and most other second order algorithms. First it uses the full Hessian matrix and hence can deal with exploding directions that are not necessarily axis aligned. Second it computes a new estimate of the Hessian matrix before each up date step and can take into account abrupt changes in curvature such as the ones suggested by our hypothe sis while most other approaches use a smoothness as sumption i.e. averaging 2nd order signals over many steps. 3. Dealing with the exploding and vanishing gradient 3.1.']",text-embedding-3-small,512,20,2,"
You are an AI Teaching Assistant for the SEP 775 course. 
Your job is to answer students' questions about course materials according to the instructions and context provided.
If you found the answer based on the context provided, you should provide the answer first, then at the end, beginning a new sentence with the words ""Source:"", followed by the name of the lecture, or assignment, or paper if possible.
",0.9999999999999996,0.6666666666666666,0.9342756035921048,0.04
59,Why is understanding gradients important despite automatic differentiation?,"Understanding gradients is important despite automatic differentiation because it helps in debugging and improving models. Backpropagation doesn't always work perfectly out of the box, so understanding why is crucial for addressing issues like exploding and vanishing gradients. Source: SEP 775 - Computational Natural Language Processing, lecture02_Neural_Nets.txt","['We note that this deﬁnition of the numerical gradient follows very naturally from the deﬁnition of the derivative where in the scalar case f x f x ϵ f x ϵ Gradient checks are a great way to compare analytical and numerical gradients. Analytical gradients should be close and numerical gradients can be calculated using f θ J θ i J θ i 2ϵ J θ i and J θ i can be evalu ated using two forward passes. An implementation of this can be seen in Snippet 2.1. Of course there is a slight difference the deﬁnition above only perturbs x in the positive direction to compute the gradient. While it would have been perfectly acceptable to deﬁne the numerical gradi ent in this way in practice it is often more precise and stable to use the centered difference formula where we perturb a parameter in both directions. The intuition is that to get a better approximation of the derivative slope around a point we need to examine the func tion f s behavior both to the left and right of that point. It can also be shown using Taylor s theorem that the centered difference formula has an error proportional to ϵ2 which is quite small whereas the derivative deﬁnition is more error prone. Now a natural question you might ask is if this method is so pre cise why do we not use it to compute all of our network gradients instead of applying back propagation The simple answer as hinted earlier is inefﬁciency recall that every time we want to compute the gradient with respect to an element we need to make two forward passes through the network which will be computationally expen sive. Furthermore many large scale neural networks can contain millions of parameters and computing two passes per parameter is clearly not optimal. And since in optimization techniques such as SGD we must compute the gradients once per iteration for several thousands of iterations it is obvious that this method quickly grows intractable. This inefﬁciency is why we only use gradient check to verify the correctness of our analytic gradients which are much quicker to compute.', 'do backpropagation for you but mainly leave layer node writer to hand calculate the local derivative 74Backprop Implementations 75Implementation forward backward API 76Implementation forward backward API 77Manual Gradient checking Numeric Gradient For small h 1e 4 Easy to implement correctly But approximate and very slow You have to recompute f for every parameter of our model Useful for checking your implementation In the old days we hand wrote everything doing this everywhere was the key test Now much less needed you can use it to check layers are correctly implemented 78Summary We ve mastered the core technology of neural nets Backpropagation recursively and hence efficiently apply the chain rule along computation graph downstream gradient upstream gradient x local gradient Forward pass compute results of operations and save intermediate values Backward pass apply chain rule to compute gradients 79Why learn all these details about gradients 80 Modern deep learning frameworks compute gradients for you But why take a class on compilers or systems when they are implemented for you Understanding what is going on under the hood is useful Backpropagation doesn t always work perfectly out of the box Understanding why is crucial for debugging and improving models See Karpathy article https medium.com @karpathy yes you should understand backprop e2f06eab496b Example in future lecture exploding and vanishing gradients']",text-embedding-3-small,512,20,2,"
You are an AI Teaching Assistant for the SEP 775 course. 
Your job is to answer students' questions about course materials according to the instructions and context provided.
If you found the answer based on the context provided, you should provide the answer first, then at the end, beginning a new sentence with the words ""Source:"", followed by the name of the lecture, or assignment, or paper if possible.
",0.9999999999999994,0.75,0.936509961300784,0.0833333333333333
60,What is the core concept introduced in this class that leads to GPT-3 and ChatGPT?,"The core concept introduced in this class that leads to GPT-3 and ChatGPT is the idea of emergent zero-shot learning, which refers to the ability of models like GPT-2 and GPT-3 to perform tasks without specific examples or gradient updates by specifying the right sequence prediction problem. This allows these models to excel at various tasks without task-specific fine-tuning, showcasing their adaptability and versatility in natural language processing tasks.","['2019 Same architecture as GPT just bigger 117M 1.5B But trained on much more data 4GB 40GB of internet text data WebText Scrape links posted on Reddit w at least 3 upvotes rough proxy of human quality GPT 2018 GPT 2 2019 117M 1.5B 15One key emergent ability in GPT 2 is zero shot learning the ability to do many tasks with no examples and no gradient updates by simply Specifying the right sequence prediction problem e.g. question answering Passage Tom Brady... Q Where was Tom Brady born A ... Comparing probabilities of sequences e.g. Winograd Schema Challenge Levesque 2011 16 The cat couldn t fit into the hat because it was too big. Does it the cat or the hat Is P ...because the cat was too big P ...because the hat was too big Emergent zero shot learning Radford et al. 2019Emergent zero shot learning GPT 2 beats SoTA on language modeling benchmarks with no task specific fine tuning LAMBADA language modeling w long discourse dependencies Paperno et al. 2016 Radford et al. 2019 17Emergent zero shot learning 18 You can get interesting zero shot behavior if you re creative enough with how you specify your task Summarization on CNN DailyMail dataset See et al. 2017 SAN FRANCISCO California CNN A magnitude 4.2 earthquake shook the San Francisco ... overturn unstable Radford et al. 2019 2018 SoTA Supervised 287K Too Long Didn t Read Prompting objects. TL DR Select from article ROUGEEmergent abilities of large language models GPT 3 2020 19 GPT 3 175B parameters Brown et al.', 'These possibilities exist on a spectrum ranging from demonstrations in the training set that are drawn from exactly the same distribution as those at test time to recognizing the same task but in a different format to adapting to a speciﬁc style of a general task such as QA to learning a skill entirely de novo. Where GPT 3 is on this spectrum may also vary from task to task. Synthetic tasks such as wordscrambling or deﬁning nonsense words seem especially likely to be learned de novo whereas translation clearly must be learned during pretraining although possibly from data that is very different in organization and style than the test data. Ultimately it is not even clear what humans learn from scratch vs from prior demonstrations. Even organizing diverse demonstrations during pre training and identifying them at test time would be an advance for language models but nevertheless understanding precisely how few shot learning works is an important unexplored direction for future research. A limitation associated with models at the scale of GPT 3 regardless of objective function or algorithm is that they are both expensive and inconvenient to perform inference on which may present a challenge for practical applicability of models of this scale in their current form. One possible future direction to address this is distillation HVD15 of large models down to a manageable size for speciﬁc tasks. Large models such as GPT 3 contain a very wide range of skills most of which are not needed for a speciﬁc task suggesting that in principle aggressive distillation may be possible. Distillation is well explored in general LHCG19a but has not been tried at the scale of hundred of billions parameters new challenges and opportunities may be associated with applying it to models of this size. Finally GPT 3 shares some limitations common to most deep learning systems its decisions are not easily interpretable it is not necessarily well calibrated in its predictions on novel inputs as observed by the much higher variance in performance than humans on standard benchmarks and it retains the biases of the data it has been trained on. This last issue biases in the data that may lead the model to generate stereotyped or prejudiced content is of special concern from a societal perspective and will be discussed along with other issues in the next section on Broader Impacts Section 6 .']",text-embedding-3-small,512,20,2,"
You are an AI Teaching Assistant for the SEP 775 course. 
Your job is to answer students' questions about course materials according to the instructions and context provided.
If you found the answer based on the context provided, you should provide the answer first, then at the end, beginning a new sentence with the words ""Source:"", followed by the name of the lecture, or assignment, or paper if possible.
",0.9999346746160052,0.5,0.8785197484662766,0.0625
61,What is the purpose of Dropout as mentioned in the document?,"The purpose of Dropout, as mentioned in the document, is to act as a powerful technique for regularization in neural networks. During training, Dropout randomly drops a subset of neurons with a certain probability during each forward and backward pass, which helps prevent overfitting, allows the network to learn more meaningful information from the data, and typically leads to higher performance on the task at hand. By training exponentially many smaller networks at once and averaging over their predictions, Dropout helps improve the overall performance of the neural network.","['Imposing such a con straint can also be interpreted as the prior Bayesian belief that the optimal weights are close to zero how close depends on the value of λ. Choosing the right value of λ is critical and must be chosen via hyperparameter tuning. Too high a value of λ causes most of the weights to be set too close to 0 and the model does not learn anything meaningful from the training data often obtaining poor ac curacy on training validation and testing sets. Too low a value and we fall into the domain of overﬁtting once again. It must be noted that the bias terms are not regularized and do not contribute to the cost term above try thinking about why this is the case There are indeed other types of regularization that are sometimes used such as L1 regularization which sums over the absolute values rather than squares of parameter elements however this is less commonly applied in practice since it leads to sparsity of parameter weights. In the next section we discuss dropout which effectively acts as another form of regularization by randomly dropping i.e. setting to zero neurons in the forward pass. 2.3 Dropout Dropout is a powerful technique for regularization ﬁrst introduced by Srivastava et al. in Dropout A Simple Way to Prevent Neural Net works from Overﬁtting. The idea is simple yet effective during train ing we will randomly drop with some probability 1 p a subset of neurons during each forward backward pass or equivalently we will keep alive each neuron with a probability p . Then during testing we will use the full network to compute our predictions. The result is that the network typically learns more meaningful informa tion from the data is less likely to overﬁt and usually obtains higher performance overall on the task at hand. One intuitive reason why this technique should be so effective is that what dropout is doing is essentially doing is training exponentially many smaller networks at once and averaging over their predictions. Dropout applied to an artiﬁcial neural network. Image credits to Srivastava et al. In practice the way we introduce dropout is that we take the out put h of each layer of neurons and keep each neuron with prob ability p and else set it to 0. Then during back propagation we only pass gradients through neurons that were kept alive during the forward pass.', 'like an ensemble model Nowadays usually thought of as strong feature dependent regularizer Wager Wang Liang 2013DropoutDropout Srivastava Hinton Krizhevsky Sutskever Salakhutdinov 2012 JMLR 2014 During training For each data point each time Randomly set input to 0 with probability 𝑝 dropout ratio often p 0.5 except p 0.15 for input layer via dropout mask During testing Multiply all weights by 1 𝑝 No other dropout 𝑥2 𝑥3 0 𝑤1 𝑤2 𝑤3 𝑤4 𝑏 1 𝑦 𝑤1𝑥1 𝑤2𝑥2 𝑤3𝑥3 𝑥 𝑥 1 1 Train 1 Train 2 Test 𝑥3 0 1 𝑦 𝑤1𝑥1 𝑤3𝑥3 𝑏 𝑤1 𝑤2 𝑤3 𝑤4 𝑏 𝑥1 0 𝑥2 𝑥3 𝑥4 𝑤1 𝑤2 𝑤3 𝑤4 𝑏 1 𝑦 1 𝑝 𝑤1𝑥1 𝑤2𝑥2 𝑤3𝑥3 𝑤4𝑥4 6Vectorization E.g. looping over word vectors versus concatenating them all into one large matrix and then multiplying the softmax weights with that matrix for loop 1000 loops best of 3 639 µs per loop Using single a C x N matrix 10000 loops best of 3 53.8 µs per loop Matrices are awesome Always try to use vectors and matrices rather than for loops The speed gain goes from 1 to 2 orders of magnitude with GPUs 7Parameter Initialization You normally must initialize weights to small random values i.e. not zero matrices To avoid symmetries that prevent learning specialization Initialize hidden layer biases to 0 and output or reconstruction biases to optimal value if weights were 0 e.g.']",text-embedding-3-small,512,20,2,"
You are an AI Teaching Assistant for the SEP 775 course. 
Your job is to answer students' questions about course materials according to the instructions and context provided.
If you found the answer based on the context provided, you should provide the answer first, then at the end, beginning a new sentence with the words ""Source:"", followed by the name of the lecture, or assignment, or paper if possible.
",0.9300597327790432,1.0,0.9248634002402332,0.0625
62,What are some approaches to address the vanishing gradient problem in RNNs?,"Some approaches to address the vanishing gradient problem in RNNs include using RNNs with separate memory (such as LSTMs), creating more direct and linear pass-through connections in the model (such as attention mechanisms and residual connections), and utilizing Long Short-Term Memory RNNs (LSTMs) proposed by Hochreiter and Schmidhuber in 1997. These approaches aim to tackle the challenge of preserving information over many timesteps and mitigating the issue of vanishing gradients in RNNs. 

Source: Lecture03_RNNs_and_LLMs","['Problems with RNNs Vanishing and Exploding Gradients 48Vanishing gradient intuition 49Vanishing gradient intuition chain rule 50Vanishing gradient intuition chain rule 51Vanishing gradient intuition chain rule 52Vanishing gradient intuition What happens if these are small Vanishing gradient problem When these are small the gradient signal gets smaller and smaller as it backpropagates further 53Vanishing gradient proof sketch linear case Recall What if were the identity function 53 Source On the difficulty of training recurrent neural networks Pascanu et al 2013. http proceedings.mlr.press v28 pascanu13.pdf and supplemental materials at http proceedings.mlr.press v28 pascanu13 supp.pdf If Wh is small then this term gets exponentially problematic as becomes large chain rule Consider the gradient of the loss on step with respect to the hidden state on some previous step . Let chain rule value of ONLY READ IF INTERESTEDVanishing gradient proof sketch linear case What s wrong with Consider if the eigenvalues of are all less than 1 We can write as a basis What about nonlinear activations i.e. what we use Pretty much the same thing except the proof requires for some dependent on dimensionality and Source On the difficulty of training recurrent neural networks Pascanu et al 2013. http proceedings.mlr.press v28 pascanu13.pdf and supplemental materials at http proceedings.mlr.press v28 pascanu13 supp.pdf 54 eigenvectors using the eigenvectors of Approaches 0 as grows so gradient vanishes sufficient but not necessary ONLY READ IF INTERESTEDWhy is vanishing gradient a problem Gradient signal from far away is lost because it s much smaller than gradient signal from close by. So model weights are updated only with respect to near effects not long term effects. 56Effect of vanishing gradient on RNN LM 57 LM task When she tried to print her tickets she found that the printer was out of toner. She went to the stationery store to buy more toner. It was very overpriced. After installing the toner into the printer she finally printed her To learn from this training example the RNN LM needs to model the dependency between tickets on the 7th step and the target word tickets at the end.', 'But if the gradient is small the model can t learn this dependency So the model is unable to predict similar long distance dependencies at test timeWhy is exploding gradient a problem If the gradient becomes too big then the SGD update step becomes too big learning rate gradient This can cause bad updates we take too large a step and reach a weird and bad parameter configuration with large loss You think you ve found a hill to climb but suddenly you re in Iowa In the worst case this will result in Inf or NaN in your network then you have to restart training from an earlier checkpoint 58Gradient clipping solution for exploding gradient 58 Gradient clipping if the norm of the gradient is greater than some threshold scale it down before applying SGD update Intuition take a step in the same direction but a smaller step In practice remembering to clip gradients is important but exploding gradients are an easy problem to solve Source On the difficulty of training recurrent neural networks Pascanu et al 2013. http proceedings.mlr.press v28 pascanu13.pdfHow to fix the vanishing gradient problem The main problem is that it s too difficult for the RNN to learn to preserve information over many timesteps. In a vanilla RNN the hidden state is constantly being rewritten First off next time How about an RNN with separate memory which is added to LSTMs And then Creating more direct and linear pass through connections in model Attention residual connections etc. 60Long Short Term Memory RNNs LSTMs A type of RNN proposed by Hochreiter and Schmidhuber in 1997 as a solution to the problem of vanishing gradients Everyone cites that paper but really a crucial part of the modern LSTM is from Gers et al. 2000 Only started to be recognized as promising through the work of S s student Alex Graves c. 2006 Work in which he also invented CTC connectionist temporal classification for speech recognition But only really became well known after Hinton brought it to Google in 2013 Following Graves having been a postdoc with Hinton 61 Hochreiter and Schmidhuber 1997. Long short term memory. https www.bioinf.jku.at publications older 2604.pdf Gers Schmidhuber and Cummins 2000. Learning to Forget Continual Prediction with LSTM.']",text-embedding-3-small,512,20,2,"
You are an AI Teaching Assistant for the SEP 775 course. 
Your job is to answer students' questions about course materials according to the instructions and context provided.
If you found the answer based on the context provided, you should provide the answer first, then at the end, beginning a new sentence with the words ""Source:"", followed by the name of the lecture, or assignment, or paper if possible.
",1.0000000000000009,1.0,0.8867885742759666,0.0625
63,"What is perplexity, and how is it used in evaluating language models?","Perplexity is a measure used in evaluating language models. It is the geometric mean of the probabilities assigned by the model to each word in a test set. A lower perplexity indicates that the model is more confident in predicting the test set. In evaluating language models, minimizing perplexity is equivalent to maximizing the test set probability according to the language model. Perplexity can also be interpreted as the weighted average branching factor of a language, representing the number of possible next words that can follow any word. It is important to note that the perplexity of two language models is only comparable if they use identical vocabularies, and intrinsic improvements in perplexity do not guarantee extrinsic improvements in language processing tasks like speech recognition or machine translation. Perplexity is commonly used as a quick check on an algorithm's performance, but any improvement in perplexity should be confirmed by a real task evaluation before concluding the model evaluation.

Source: Lecture notes ""N-gram Language Models""","['Here s the perplexity of W with a unigram language model just the geometric mean of the unigram probabilities perplexity W N v u u t N Y i 1 1 P wi 3.16 The perplexity of W computed with a bigram language model is still a geometric mean but now of the bigram probabilities perplexity W N v u u t N Y i 1 1 P wi wi 1 3.17 Note that because of the inverse in Eq. 3.15 the higher the conditional probabil ity of the word sequence the lower the perplexity. Thus minimizing perplexity is equivalent to maximizing the test set probability according to the language model. What we generally use for word sequence in Eq. 3.15 or Eq. 3.17 is the entire se quence of words in some test set. Since this sequence will cross many sentence boundaries we need to include the begin and end sentence markers s and s in the probability computation. We also need to include the end of sentence marker s but not the beginning of sentence marker s in the total count of word to kens N. There is another way to think about perplexity as the weighted average branch ing factor of a language. The branching factor of a language is the number of possi ble next words that can follow any word. Consider the task of recognizing the digits3.2 EVALUATING LANGUAGE MODELS 9 in English zero one two ... nine given that both in some training set and in some test set each of the 10 digits occurs with equal probability P 1 10. The perplexity of this mini language is in fact 10. To see that imagine a test string of digits of length N and assume that in the training set all the digits occurred with equal probability. By Eq. 3.15 the perplexity will be perplexity W P w1w2 ...wN 1 N 1 10 N 1 N 1 10 1 10 3.18 But suppose that the number zero is really frequent and occurs far more often than other numbers. Let s say that 0 occur 91 times in the training set and each of the other digits occurred 1 time each.', 'Any kind of knowledge of the test set can cause the perplexity to be artiﬁcially low. The perplexity of two language models is only comparable if they use identical vocabularies. An intrinsic improvement in perplexity does not guarantee an extrinsic im provement in the performance of a language processing task like speech recognition10 CHAPTER 3 N GRAM LANGUAGE MODELS or machine translation. Nonetheless because perplexity often correlates with such improvements it is commonly used as a quick check on an algorithm. But a model s improvement in perplexity should always be conﬁrmed by an end to end evaluation of a real task before concluding the evaluation of the model. 3.3 Sampling sentences from a language model One important way to visualize what kind of knowledge a language model embodies is to sample from it. Sampling from a distribution means to choose random points sampling according to their likelihood. Thus sampling from a language model which rep resents a distribution over sentences means to generate some sentences choosing each sentence according to its likelihood as deﬁned by the model. Thus we are more likely to generate sentences that the model thinks have a high probability and less likely to generate sentences that the model thinks have a low probability. This technique of visualizing a language model by sampling was ﬁrst suggested very early on by Shannon 1951 and Miller and Selfridge 1950 . It s simplest to visualize how this works for the unigram case. Imagine all the words of the English language covering the probability space between 0 and 1 each word covering an interval proportional to its frequency. Fig. 3.3 shows a visualization using a unigram LM computed from the text of this book. We choose a random value between 0 and 1 ﬁnd that point on the probability line and print the word whose interval includes this chosen value. We continue choosing random numbers and generating words until we randomly generate the sentence ﬁnal token s .']",text-embedding-3-small,512,20,2,"
You are an AI Teaching Assistant for the SEP 775 course. 
Your job is to answer students' questions about course materials according to the instructions and context provided.
If you found the answer based on the context provided, you should provide the answer first, then at the end, beginning a new sentence with the words ""Source:"", followed by the name of the lecture, or assignment, or paper if possible.
",0.9077103422875468,0.8,0.9467094731697058,0.0333333333333333
64,How does LSTM solve the vanishing gradient problem?,"LSTMs (Long Short Term Memory networks) were proposed as a solution to the vanishing gradient problem in RNNs. They address this issue by introducing a mechanism that allows the network to retain information over many time steps. This is achieved through the use of a separate memory component in LSTMs, which helps in preserving long-term dependencies by controlling the flow of information through a series of gates. Additionally, LSTMs incorporate more direct and linear pass-through connections in the model, such as attention mechanisms and residual connections, which further aid in mitigating the vanishing gradient problem. (Source: lecture03_RNNs_and_LLMs)","['But if the gradient is small the model can t learn this dependency So the model is unable to predict similar long distance dependencies at test timeWhy is exploding gradient a problem If the gradient becomes too big then the SGD update step becomes too big learning rate gradient This can cause bad updates we take too large a step and reach a weird and bad parameter configuration with large loss You think you ve found a hill to climb but suddenly you re in Iowa In the worst case this will result in Inf or NaN in your network then you have to restart training from an earlier checkpoint 58Gradient clipping solution for exploding gradient 58 Gradient clipping if the norm of the gradient is greater than some threshold scale it down before applying SGD update Intuition take a step in the same direction but a smaller step In practice remembering to clip gradients is important but exploding gradients are an easy problem to solve Source On the difficulty of training recurrent neural networks Pascanu et al 2013. http proceedings.mlr.press v28 pascanu13.pdfHow to fix the vanishing gradient problem The main problem is that it s too difficult for the RNN to learn to preserve information over many timesteps. In a vanilla RNN the hidden state is constantly being rewritten First off next time How about an RNN with separate memory which is added to LSTMs And then Creating more direct and linear pass through connections in model Attention residual connections etc. 60Long Short Term Memory RNNs LSTMs A type of RNN proposed by Hochreiter and Schmidhuber in 1997 as a solution to the problem of vanishing gradients Everyone cites that paper but really a crucial part of the modern LSTM is from Gers et al. 2000 Only started to be recognized as promising through the work of S s student Alex Graves c. 2006 Work in which he also invented CTC connectionist temporal classification for speech recognition But only really became well known after Hinton brought it to Google in 2013 Following Graves having been a postdoc with Hinton 61 Hochreiter and Schmidhuber 1997. Long short term memory. https www.bioinf.jku.at publications older 2604.pdf Gers Schmidhuber and Cummins 2000. Learning to Forget Continual Prediction with LSTM.', 'Problems with RNNs Vanishing and Exploding Gradients 48Vanishing gradient intuition 49Vanishing gradient intuition chain rule 50Vanishing gradient intuition chain rule 51Vanishing gradient intuition chain rule 52Vanishing gradient intuition What happens if these are small Vanishing gradient problem When these are small the gradient signal gets smaller and smaller as it backpropagates further 53Vanishing gradient proof sketch linear case Recall What if were the identity function 53 Source On the difficulty of training recurrent neural networks Pascanu et al 2013. http proceedings.mlr.press v28 pascanu13.pdf and supplemental materials at http proceedings.mlr.press v28 pascanu13 supp.pdf If Wh is small then this term gets exponentially problematic as becomes large chain rule Consider the gradient of the loss on step with respect to the hidden state on some previous step . Let chain rule value of ONLY READ IF INTERESTEDVanishing gradient proof sketch linear case What s wrong with Consider if the eigenvalues of are all less than 1 We can write as a basis What about nonlinear activations i.e. what we use Pretty much the same thing except the proof requires for some dependent on dimensionality and Source On the difficulty of training recurrent neural networks Pascanu et al 2013. http proceedings.mlr.press v28 pascanu13.pdf and supplemental materials at http proceedings.mlr.press v28 pascanu13 supp.pdf 54 eigenvectors using the eigenvectors of Approaches 0 as grows so gradient vanishes sufficient but not necessary ONLY READ IF INTERESTEDWhy is vanishing gradient a problem Gradient signal from far away is lost because it s much smaller than gradient signal from close by. So model weights are updated only with respect to near effects not long term effects. 56Effect of vanishing gradient on RNN LM 57 LM task When she tried to print her tickets she found that the printer was out of toner. She went to the stationery store to buy more toner. It was very overpriced. After installing the toner into the printer she finally printed her To learn from this training example the RNN LM needs to model the dependency between tickets on the 7th step and the target word tickets at the end.']",text-embedding-3-small,512,20,2,"
You are an AI Teaching Assistant for the SEP 775 course. 
Your job is to answer students' questions about course materials according to the instructions and context provided.
If you found the answer based on the context provided, you should provide the answer first, then at the end, beginning a new sentence with the words ""Source:"", followed by the name of the lecture, or assignment, or paper if possible.
",0.8623146416943716,0.75,0.9182580942094954,0.0625
65,"What is the impact of bidirectional RNNs, and where are they applicable?","Bidirectional RNNs have the capability to make predictions based on future words by reading through the corpus backwards. They maintain two hidden layers, one for left-to-right propagation and another for right-to-left propagation. This allows them to summarize both past and future word representations around a single token, impacting the model's ability to capture context from both directions. Bidirectional RNNs are applicable in tasks where understanding context from both past and future information is crucial, such as machine translation and sentiment analysis. 

Source: Lecture03 - Computational Natural Language Processing.","['h h h Figure 8 A bi directional RNN model h t f W xt V h t 1 b 17 h t f W xt V h t 1 b 18 ˆ yt g Uht c g U h t h t c 19 RNNs can also be multi layered. Figure 9 shows a multi layer bi directional RNN where each lower layer feeds the next layer. As shown in this ﬁgure in this network architecture at time step t each interme diate neuron receives one set of parameters from the previous time step in the same RNN layer and two sets of parameters from the previous RNN hidden layer one input comes from the left to right RNN and the other from the right to left RNN. To construct a Deep RNN with L layers the above relationships are modiﬁed to the relationships in Equations 20 and 21 where the input to each intermediate neuron at level i is the output of the RNN at layer i 1 at the same time step t. The output ˆ y at each time step is the result of propagating input parameters through all hidden layers Equation 22 . Going Deep h i t f W i ht i 1 h i t f W i ht i 1 yt g U h t L h y h 3 x Each memory layer passes an intermediate seq representation to the next. h 2 h 1 Figure 9 A deep bi directional RNN with three RNN layers. h i t f W i h i 1 t V i h i t 1 b i 20 h i t f W i h i 1 t V i h i t 1 b i 21 ˆ yt g Uht c g U h L t h L t c 22 2.6 Application RNN Translation Model Traditional translation models are quite complex they consist of nu merous machine learning algorithms applied to different stages of the language translation pipeline. In this section we discuss the potential for adopting RNNs as a replacement to traditional translation mod ules. Consider the RNN example model shown in Figure 10 here the German phrase Echt dicke Kiste is translated to Awesome sauce.', 'av steps. 3. Dealing wi vanishing g 3.1. Previous so Using an L1 or L2 help with explodin ters initialized wit Wrec is probably that the gradient tion found in secti ensure that durin exceeds 1. This a ple regime with a where any informa Figure 7 Gradient explosion clipping visualization To solve the problem of vanishing gradients we introduce two tech niques. The ﬁrst technique is that instead of initializing W hh ran domly start off from an identity matrix initialization. The second technique is to use the Rectiﬁed Linear Units ReLU in stead of the sigmoid function. The derivative for the ReLU is either 0 or 1. This way gradients would ﬂow through the neurons whose deriva tive is 1 without getting attenuated while propagating back through time steps. 2.5 Deep Bidirectional RNNs So far we have focused on RNNs that condition on past words to predict the next word in the sequence. It is possible to make predic tions based on future words by having the RNN model read through the corpus backwards. Irsoy et al. shows a bi directional deep neu ral network at each time step t this network maintains two hidden layers one for the left to right propagation and another for the right to left propagation. To maintain two hidden layers at any time this network consumes twice as much memory space for its weight and bias parameters. The ﬁnal classiﬁcation result ˆ yt is generated through combining the score results produced by both RNN hidden layers. Fig ure 8 shows the bi directional network architecture and Equations 17 and 18 show the mathematical formulation behind setting up the bi directional RNN hidden layer. The only difference between these two relationships is in the direction of recursing through the corpus. Equa tion 19 shows the classiﬁcation relationship used for predicting the next word via summarizing past and future word representations. Bidirectionality h t f W xt V h t f W xt V yt g U h t h t y h x now represents summarizes the past and around a single token.']",text-embedding-3-small,512,20,2,"
You are an AI Teaching Assistant for the SEP 775 course. 
Your job is to answer students' questions about course materials according to the instructions and context provided.
If you found the answer based on the context provided, you should provide the answer first, then at the end, beginning a new sentence with the words ""Source:"", followed by the name of the lecture, or assignment, or paper if possible.
",0.9317676470495831,1.0,0.9370502991038152,0.0357142857142857
66,Describe the concept of multi-layer or stacked RNNs and their benefit.,"Multi-layer or stacked RNNs involve applying multiple RNNs on top of each other, allowing the network to compute more complex representations. The lower RNN layers are responsible for computing lower-level features, while the higher RNN layers compute higher-level features. Stacked RNNs work better than having just one layer of high-dimensional encodings. High-performing RNNs are usually multi-layered, but not as deep as convolutional or feedforward networks. For example, in Neural Machine Translation, 2 to 4 layers are found to be best for the encoder RNN and 4 layers for the decoder RNN. Skip connections or dense connections are often needed to train deeper RNNs effectively. Transformer-based networks, like BERT, are usually deeper, with 12 or 24 layers.

Source: Lecture03_RNNs_and_LLMs","['You will learn more about transformers including BERT in a couple of weeksMulti layer RNNs RNNs are already deep on one dimension they unroll over many timesteps We can also make them deep in another dimension by applying multiple RNNs this is a multi layer RNN. This allows the network to compute more complex representations The lower RNNs should compute lower level features and the higher RNNs should compute higher level features. Multi layer RNNs are also called stacked RNNs. 80Multi layer RNNs was terribly exciting the movie RNN layer 1 RNN layer 2 81 RNN layer 3 The hidden states from RNN layer i are the inputs to RNN layer i 1Multi layer RNNs in practice 39 Multi layer or stacked RNNs allow a network to compute more complex representations they work better than just have one layer of high dimensional encodings The lower RNNs should compute lower level features and the higher RNNs should compute higher level features. High performing RNNs are usually multi layer but aren t as deep as convolutional or feed forward networks For example In a 2017 paper Britz et al. find that for Neural Machine Translation 2 to 4 layers is best for the encoder RNN and 4 layers is best for the decoder RNN Often 2 layers is a lot better than 1 and 3 might be a little better than 2 Usually skip connections dense connections are needed to train deeper RNNs e.g. 8 layers Transformer based networks e.g. BERT are usually deeper like 12 or 24 layers. You will learn about Transformers later they have a lot of skipping like connections Massive Exploration of Neural Machine Translation Architecutres Britz et al 2017. https arxiv.org pdf 1703.03906.pdfTerminology By the end of the course You will understand phrases like stacked bidirectional LSTMs with residual connections and self attention The RNN described in this lecture simple vanilla Elman RNN You learned about other RNN flavors like LSTM and GRU and multi layer RNNs 83', 'h h h Figure 8 A bi directional RNN model h t f W xt V h t 1 b 17 h t f W xt V h t 1 b 18 ˆ yt g Uht c g U h t h t c 19 RNNs can also be multi layered. Figure 9 shows a multi layer bi directional RNN where each lower layer feeds the next layer. As shown in this ﬁgure in this network architecture at time step t each interme diate neuron receives one set of parameters from the previous time step in the same RNN layer and two sets of parameters from the previous RNN hidden layer one input comes from the left to right RNN and the other from the right to left RNN. To construct a Deep RNN with L layers the above relationships are modiﬁed to the relationships in Equations 20 and 21 where the input to each intermediate neuron at level i is the output of the RNN at layer i 1 at the same time step t. The output ˆ y at each time step is the result of propagating input parameters through all hidden layers Equation 22 . Going Deep h i t f W i ht i 1 h i t f W i ht i 1 yt g U h t L h y h 3 x Each memory layer passes an intermediate seq representation to the next. h 2 h 1 Figure 9 A deep bi directional RNN with three RNN layers. h i t f W i h i 1 t V i h i t 1 b i 20 h i t f W i h i 1 t V i h i t 1 b i 21 ˆ yt g Uht c g U h L t h L t c 22 2.6 Application RNN Translation Model Traditional translation models are quite complex they consist of nu merous machine learning algorithms applied to different stages of the language translation pipeline. In this section we discuss the potential for adopting RNNs as a replacement to traditional translation mod ules. Consider the RNN example model shown in Figure 10 here the German phrase Echt dicke Kiste is translated to Awesome sauce.']",text-embedding-3-small,512,20,2,"
You are an AI Teaching Assistant for the SEP 775 course. 
Your job is to answer students' questions about course materials according to the instructions and context provided.
If you found the answer based on the context provided, you should provide the answer first, then at the end, beginning a new sentence with the words ""Source:"", followed by the name of the lecture, or assignment, or paper if possible.
",0.953830764252278,1.0,0.949996343901752,0.0588235294117647
67,How does Dropout work during training and testing?,"During training, Dropout works by randomly dropping a subset of neurons with some probability (1-p) during each forward-backward pass. This means that during training, a subset of neurons is set to zero while the rest are kept alive with a probability p. During testing, all weights are multiplied by 1/p, and no dropout is applied. This technique helps prevent overfitting, allows the network to learn more meaningful information from the data, and generally leads to higher performance on the task at hand. Essentially, Dropout trains multiple smaller networks at once and averages their predictions, which contributes to its effectiveness in regularization.

Source: SEP 775 - Computational Natural Language Processing, lecture03_RNNs_and_LLMs.","['Imposing such a con straint can also be interpreted as the prior Bayesian belief that the optimal weights are close to zero how close depends on the value of λ. Choosing the right value of λ is critical and must be chosen via hyperparameter tuning. Too high a value of λ causes most of the weights to be set too close to 0 and the model does not learn anything meaningful from the training data often obtaining poor ac curacy on training validation and testing sets. Too low a value and we fall into the domain of overﬁtting once again. It must be noted that the bias terms are not regularized and do not contribute to the cost term above try thinking about why this is the case There are indeed other types of regularization that are sometimes used such as L1 regularization which sums over the absolute values rather than squares of parameter elements however this is less commonly applied in practice since it leads to sparsity of parameter weights. In the next section we discuss dropout which effectively acts as another form of regularization by randomly dropping i.e. setting to zero neurons in the forward pass. 2.3 Dropout Dropout is a powerful technique for regularization ﬁrst introduced by Srivastava et al. in Dropout A Simple Way to Prevent Neural Net works from Overﬁtting. The idea is simple yet effective during train ing we will randomly drop with some probability 1 p a subset of neurons during each forward backward pass or equivalently we will keep alive each neuron with a probability p . Then during testing we will use the full network to compute our predictions. The result is that the network typically learns more meaningful informa tion from the data is less likely to overﬁt and usually obtains higher performance overall on the task at hand. One intuitive reason why this technique should be so effective is that what dropout is doing is essentially doing is training exponentially many smaller networks at once and averaging over their predictions. Dropout applied to an artiﬁcial neural network. Image credits to Srivastava et al. In practice the way we introduce dropout is that we take the out put h of each layer of neurons and keep each neuron with prob ability p and else set it to 0. Then during back propagation we only pass gradients through neurons that were kept alive during the forward pass.', 'like an ensemble model Nowadays usually thought of as strong feature dependent regularizer Wager Wang Liang 2013DropoutDropout Srivastava Hinton Krizhevsky Sutskever Salakhutdinov 2012 JMLR 2014 During training For each data point each time Randomly set input to 0 with probability 𝑝 dropout ratio often p 0.5 except p 0.15 for input layer via dropout mask During testing Multiply all weights by 1 𝑝 No other dropout 𝑥2 𝑥3 0 𝑤1 𝑤2 𝑤3 𝑤4 𝑏 1 𝑦 𝑤1𝑥1 𝑤2𝑥2 𝑤3𝑥3 𝑥 𝑥 1 1 Train 1 Train 2 Test 𝑥3 0 1 𝑦 𝑤1𝑥1 𝑤3𝑥3 𝑏 𝑤1 𝑤2 𝑤3 𝑤4 𝑏 𝑥1 0 𝑥2 𝑥3 𝑥4 𝑤1 𝑤2 𝑤3 𝑤4 𝑏 1 𝑦 1 𝑝 𝑤1𝑥1 𝑤2𝑥2 𝑤3𝑥3 𝑤4𝑥4 6Vectorization E.g. looping over word vectors versus concatenating them all into one large matrix and then multiplying the softmax weights with that matrix for loop 1000 loops best of 3 639 µs per loop Using single a C x N matrix 10000 loops best of 3 53.8 µs per loop Matrices are awesome Always try to use vectors and matrices rather than for loops The speed gain goes from 1 to 2 orders of magnitude with GPUs 7Parameter Initialization You normally must initialize weights to small random values i.e. not zero matrices To avoid symmetries that prevent learning specialization Initialize hidden layer biases to 0 and output or reconstruction biases to optimal value if weights were 0 e.g.']",text-embedding-3-small,512,20,2,"
You are an AI Teaching Assistant for the SEP 775 course. 
Your job is to answer students' questions about course materials according to the instructions and context provided.
If you found the answer based on the context provided, you should provide the answer first, then at the end, beginning a new sentence with the words ""Source:"", followed by the name of the lecture, or assignment, or paper if possible.
",0.8978898453845874,1.0,0.9247500244029166,0.0625
68,What is the role of parameter initialization in neural networks?,"Parameter initialization in neural networks is a key step towards achieving superlative performance. A good starting strategy is to initialize the weights to small random numbers normally distributed around 0. Different weight and bias initialization schemes can impact training dynamics, affecting convergence speed and error rates. For example, Xavier et al. (2010) found that for sigmoid and tanh activation units, initializing weights randomly with a uniform distribution can lead to faster convergence and lower error rates. This initialization strategy aims to maintain activation variances and backpropagated gradient variances across layers, which are crucial for effective training of neural networks. Without proper parameter initialization, gradient variances may decrease with backpropagation across layers, hindering the learning process.

Source: lecture02_notes_Backpropagation","['This is useful since input features are often measured in different units but we often want to initially consider all features as equally important. The way we accomplish this is by simply dividing the features by their respective standard deviation calculated across the training set. Whitening Not as commonly used as mean subtraction normalization whiten ing essentially converts the data to a have an identity covariance matrix that is features become uncorrelated and have a variance of 1. This is done by ﬁrst mean subtracting the data as usual to get X . We can then take the Singular Value Decomposition SVD of X to get matrices U S V. We then compute UX to project X into the basis deﬁned by the columns of U. We ﬁnally divide each dimension of the result by the corresponding singular value in S to scale our data appropriately if a singular value is zero we can just divide by a small number instead . 2.6 Parameter Initialization A key step towards achieving superlative performance with a neu ral network is initializing the parameters in a reasonable way. A good starting strategy is to initialize the weights to small random numbers normally distributed around 0 and in practice this often words acceptably well. However in Understanding the dif ficulty of training deep feedforward neural networks 2010 Xavier et al study the effect of different weight and bias initialization schemes on training dynamics. The empirical ﬁndings suggest that for sigmoid and tanh activation units faster convergence and lower error rates are achieved when the weights of a matrix W Rn l 1 n l are initialized randomly with a uniform distribution as follows W U s 6 n l n l 1 s 6 n l n l 1 Where n l is the number of input units to W fan in and n l 1 is the number of output units from W fan out . In this parameter initialization scheme bias units are initialized to 0. This approach attempts to maintain activation variances as well as backpropagated gradient variances across layers. Without such initialization the gradient variances which are a proxy for information generally decrease with backpropagation across layers. 2.7 Learning Strategies The rate magnitude of model parameter updates during training can be controlled using the learning rate.', 'like an ensemble model Nowadays usually thought of as strong feature dependent regularizer Wager Wang Liang 2013DropoutDropout Srivastava Hinton Krizhevsky Sutskever Salakhutdinov 2012 JMLR 2014 During training For each data point each time Randomly set input to 0 with probability 𝑝 dropout ratio often p 0.5 except p 0.15 for input layer via dropout mask During testing Multiply all weights by 1 𝑝 No other dropout 𝑥2 𝑥3 0 𝑤1 𝑤2 𝑤3 𝑤4 𝑏 1 𝑦 𝑤1𝑥1 𝑤2𝑥2 𝑤3𝑥3 𝑥 𝑥 1 1 Train 1 Train 2 Test 𝑥3 0 1 𝑦 𝑤1𝑥1 𝑤3𝑥3 𝑏 𝑤1 𝑤2 𝑤3 𝑤4 𝑏 𝑥1 0 𝑥2 𝑥3 𝑥4 𝑤1 𝑤2 𝑤3 𝑤4 𝑏 1 𝑦 1 𝑝 𝑤1𝑥1 𝑤2𝑥2 𝑤3𝑥3 𝑤4𝑥4 6Vectorization E.g. looping over word vectors versus concatenating them all into one large matrix and then multiplying the softmax weights with that matrix for loop 1000 loops best of 3 639 µs per loop Using single a C x N matrix 10000 loops best of 3 53.8 µs per loop Matrices are awesome Always try to use vectors and matrices rather than for loops The speed gain goes from 1 to 2 orders of magnitude with GPUs 7Parameter Initialization You normally must initialize weights to small random values i.e. not zero matrices To avoid symmetries that prevent learning specialization Initialize hidden layer biases to 0 and output or reconstruction biases to optimal value if weights were 0 e.g.']",text-embedding-3-small,512,20,2,"
You are an AI Teaching Assistant for the SEP 775 course. 
Your job is to answer students' questions about course materials according to the instructions and context provided.
If you found the answer based on the context provided, you should provide the answer first, then at the end, beginning a new sentence with the words ""Source:"", followed by the name of the lecture, or assignment, or paper if possible.
",0.8356711454835025,1.0,0.913233322767758,0.0714285714285714
69,"What are the differences between Vanilla RNNs, LSTMs, and GRUs?","Vanilla RNNs suffer from the vanishing gradient problem, making it difficult for them to capture long-term dependencies effectively. LSTMs address this issue by introducing the concept of a cell state, forget gate, input gate, and output gate, allowing them to retain information over long sequences. GRUs, on the other hand, combine the forget and input gates into a single update gate and merge the cell state and hidden state, simplifying the architecture compared to LSTMs while still maintaining the ability to capture long-term dependencies effectively.

Source: file_path: C:\University Graduate\2024 Winter\SEP775_NLP\Final_Project\data\txt_from_pdf_with_file_name\Understanding_LSTM_Networks.txt","['We only forget when we re going to input something in its place. We only input new values to the state when we forget something older. A slightly more dramatic variation on the LSTM is the Gated Recurrent Unit or GRU introduced by Cho et al. 2014 http arxiv.org pdf 1406.1078v3.pdf . It combines the forget and input gates into a single update gate. It also merges the cell state and hidden state and makes some other changes. The resulting model is simpler than standard LSTM models and has been growing increasingly popular. These are only a few of the most notable LSTM variants. There are lots of others like Depth Gated RNNs by Yao et al. 2015 http arxiv.org pdf 1508.03790v2.pdf . There s also some completely different approach to tackling long term dependencies like Clockwork RNNs by Koutnik et al. 2014 http arxiv.org pdf 1402.3511v1.pdf . Which of these variants is best Do the differences matter Greff et al. 2015 http arxiv.org pdf 1503.04069.pdf do a nice comparison of popular variants finding that they re all about the same. Jozefowicz et al. 2015 http jmlr.org proceedings papers v37 jozefowicz15.pdf tested more than ten thousand RNN architectures finding some that worked better than LSTMs on certain tasks. Conclusion Earlier I mentioned the remarkable results people are achieving with RNNs. Essentially all of these are achieved using LSTMs. They really work a lot better for most tasks Written down as a set of equations LSTMs look pretty intimidating. Hopefully walking through them step by step in this essay has made them a bit more approachable.1 24 24 3 23 PM Understanding LSTM Networks colah s blog 7 7 Attention and Augmented Recurrent Neural Networks On Distill Conv Nets A Modular Perspective Neural Networks Manifolds and Topology Deep Learning NLP and Representations LSTMs were a big step in what we can accomplish with RNNs.', 'Extension V given a word sequence A B C in German whose transla tion is X Y in English instead of training the RNN using A B C X Y train it using C B A X Y. The intutition behind this technique is that A is more likely to be translated to X. Thus given the vanishing gradient problem discussed earlier reversing the order of the input words can help reduce the error rate in generating the output phrase. 3 Gated Recurrent Units Beyond the extensions discussed so far RNNs have been found to per form better with the use of more complex units for activation. So far we have discussed methods that transition from hidden state ht 1 to ht using an afﬁne transformation and a point wise nonlinearity. Here we discuss the use of a gated activation function thereby modifying the RNN architecture. What motivates this Well although RNNs can theoretically capture long term dependencies they are very hard to actually train to do this. Gated recurrent units are designed in a manner to have more persistent memory thereby making it easier for RNNs to capture long term dependencies. Let us see mathematically how a GRU uses ht 1 and xt to generate the next hidden state ht. We will then dive into the intuition of this architecture. zt σ W z xt U z ht 1 Update gate rt σ W r xt U r ht 1 Reset gate ht tanh rt Uht 1 Wxt New memory ht 1 zt ht zt ht 1 Hidden state The above equations can be thought of a GRU s four fundamental op erational stages and they have intuitive interpretations that make this model much more intellectually satisfying see Figure 12 1. New memory generation A new memory ht is the consolidation of a new input word xt with the past hidden state ht 1. Anthropomor phically this stage is the one who knows the recipe of combining a newly observed word with the past hidden state ht 1 to summarize this new word in light of the contextual past as the vector ht. 2. Reset Gate The reset signal rt is responsible for determining how important ht 1 is to the summarization ht.']",text-embedding-3-small,512,20,2,"
You are an AI Teaching Assistant for the SEP 775 course. 
Your job is to answer students' questions about course materials according to the instructions and context provided.
If you found the answer based on the context provided, you should provide the answer first, then at the end, beginning a new sentence with the words ""Source:"", followed by the name of the lecture, or assignment, or paper if possible.
",0.8745651825370278,1.0,0.9238183680588868,0.037037037037037
70,What is the difference between traditional language models and conditioned language models?,"Traditional language models are generative models of text, while conditioned language models not only generate text but do so according to some specification or input. Conditioned language models take structured data, such as English documents, utterances, images, or speech, as input and generate text as output based on that input. They are designed to generate text that is conditioned on specific input data, allowing for more targeted and specialized text generation compared to traditional language models. 

Source: Lecture04 Conditioned Generation","['file name: lecture04 Conditioned Generation. Hamidreza Mahyar mahyarh@mcmaster.ca Computational Natural Language Processing Conditioned GenerationLanguage Models Language models are generative models of text s P x The Malfoys said Hermione. Harry was watching him. He looked like Madame Maxime. When she strode up the wrong staircase to visit himself. I m afraid I ve definitely been suspended from power no chance indeed said Snape. He put his head back behind them and read groups as they crossed a corner and fluttered down onto their ink lamp and picked up his spoon. The doorbell rang. It was a lot cleaner down in London. Text Credit Max Deutsch https medium.com deep writingConditioned Language Models Not just generate text generate text according to some specification Input X Structured Data English Document Utterance Image Speech Output Y Text NL Description Japanese Short Description Response Text Transcript Task NL Generation Translation Summarization Response Generation Image Captioning Speech RecognitionFormulation and ModelingCalculating the Probability of a SentenceConditional Language ModelsOne Type of Language Model LSTM LSTM LSTM LSTM predict hate predict this predict movie predict s LSTM Mikolov et al. 2011 s I hate this movie predict ILSTM LSTM LSTM LSTM LSTM s LSTM LSTM LSTM LSTM argmax argmax argmax argmax argmax s One Type of Conditional Language Model I hate this movie kono eiga ga kirai hate this movie Sutskever et al. 2014 Encoder I DecoderHow to Pass Hidden State Initialize decoder w encoder Sutskever et al. 2014 encoder decoder Transform can be different dimensions encoder transform decoder encoder Input at every time step Kalchbrenner Blunsom 2013 decoder decoder decoderMethods of GenerationThe Generation Problem We have a model of P Y X how do we use it to generate a sentence Two methods Sampling Try to generate a random sentence according to the probability distribution. Argmax Try to generate the sentence with the highest probability.Ancestral Sampling Randomly generate words one by one.', 'For instance HLW 20 observe that larger models do not necessarily generalize better out of distribution. There is evidence that suggests that the generalization achieved under this paradigm can be poor because the model is overly speciﬁc to the training distribution and does not generalize well outside it YdC 19 MPL19 . Thus the performance of ﬁne tuned models on speciﬁc benchmarks even when it is nominally at human level may exaggerate actual performance on the underlying task GSL 18 NK19 . Third humans do not require large supervised datasets to learn most language tasks a brief directive in natural language e.g. please tell me if this sentence describes something happy or something sad or at most a tiny number of demonstrations e.g. here are two examples of people acting brave please give a third example of bravery is often Figure 1.1 Language model meta learning. During unsupervised pre training a language model develops a broad set of skills and pattern recognition abilities. It then uses these abilities at inference time to rapidly adapt to or recognize the desired task. We use the term in context learning to describe the inner loop of this process which occurs within the forward pass upon each sequence. The sequences in this diagram are not intended to be representative of the data a model would see during pre training but are intended to show that there are sometimes repeated sub tasks embedded within a single sequence. 3Figure 1.2 Larger models make increasingly efﬁcient use of in context information. We show in context learning performance on a simple task requiring the model to remove random symbols from a word both with and without a natural language task description see Sec. 3.9.2 . The steeper in context learning curves for large models demonstrate improved ability to learn a task from contextual information. We see qualitatively similar behavior across a wide range of tasks. sufﬁcient to enable a human to perform a new task to at least a reasonable degree of competence. Aside from pointing to a conceptual limitation in our current NLP techniques this adaptability has practical advantages it allows humans to seamlessly mix together or switch between many tasks and skills for example performing addition during a lengthy dialogue.']",text-embedding-3-small,512,20,2,"
You are an AI Teaching Assistant for the SEP 775 course. 
Your job is to answer students' questions about course materials according to the instructions and context provided.
If you found the answer based on the context provided, you should provide the answer first, then at the end, beginning a new sentence with the words ""Source:"", followed by the name of the lecture, or assignment, or paper if possible.
",0.9999990071683664,0.75,0.9599304350746012,0.0
71,How can LSTM networks be used in language modeling?,"LSTM networks can be used in language modeling by predicting the next word in a sequence. They have been successful in tasks such as handwriting recognition, speech recognition, machine translation, parsing, image captioning, and generating language models. LSTMs have become the dominant approach for most NLP tasks, showcasing their effectiveness in capturing long-range dependencies in sequential data. Additionally, LSTMs have been instrumental in achieving state-of-the-art results in various NLP applications.","['are hard to train Another solution lots of new deep feedforward convolutional architectures add more direct connections thus allowing the gradient to flow Deep Residual Learning for Image Recognition He et al 2015. https arxiv.org pdf 1512.03385.pdfLSTMs real world success 68 In 2013 2015 LSTMs started achieving state of the art results Successful tasks include handwriting recognition speech recognition machine translation parsing and image captioning as well as language models LSTMs became the dominant approach for most NLP tasks Now 2019 2023 Transformers have become dominant for all tasks For example in WMT a Machine Translation conference competition In WMT 2014 there were 0 neural machine translation systems In WMT 2016 the summary report contains RNN 44 times and these systems won In WMT 2019 RNN 7 times Transformer 105 times Source Findings of the 2016 Conference on Machine Translation WMT16 Bojar et al. 2016 http www.statmt.org wmt16 pdf W16 2301.pdf Source Findings of the 2018 Conference on Machine Translation WMT18 Bojar et al. 2018 http www.statmt.org wmt18 pdf WMT028.pdf Source Findings of the 2019 Conference on Machine Translation WMT19 Barrault et al. 2019 http www.statmt.org wmt18 pdf WMT028.pdf5. Recap 69 Language Model A system that predicts the next word Recurrent Neural Network A family of neural networks that Take sequential input of any length Apply the same weights on each step Can optionally produce output on each step Recurrent Neural Network Language Model We ve shown that RNNs are a great way to build a LM despite some problems RNNs are also useful for much moreWhy should we care about Language Modeling 70 Language Modeling is a benchmark task that helps us measure our progress on predicting language use Language Modeling is a subcomponent of many NLP tasks especially those involving generating text or estimating the probability of text Predictive typing Speech recognition Handwriting recognition Spelling grammar correction Authorship identification Machine translation Summarization Dialogue etc.', 'Everything else in NLP has now been rebuilt upon Language Modeling GPT 3 is an LMOther RNN ArchitecturesOther RNN uses RNNs can be used for sequence tagging e.g. part of speech tagging named entity recognition knocked over the vase the startled cat 72 VBN IN DT NN DT JJ NNthe movie a lot overall I enjoyed positive Sentence encoding 73 How to compute sentence encoding RNNs can be used for sentence classification e.g. sentiment classificationthe movie a lot overall I enjoyed positive Sentence encoding 74 equals How to compute sentence encoding Basic way Use final hidden state RNNs can be used for sentence classification e.g. sentiment classificationRNNs can be used for sentence classification the movie a lot overall I enjoyed positive Sentence encoding How to compute sentence encoding 75 Usually better Take element wise max or mean of all hidden states e.g. sentiment classificationRNNs can be used as an encoder module e.g. question answering machine translation many other tasks Context Ludwig van Beethoven was a German composer and pianist. A crucial figure Beethoven Question what nationality was Here the RNN acts as an encoder for the Question the hidden states represent the Question . The encoder is part of a larger neural system. Answer German 76 lots of neural architecture lots of neural architectureRNN LMs can be used to generate text e.g. speech recognition machine translation summarization RNN LM what s the the weather what s This is an example of a conditional language model. We ll see Machine Translation in much more detail next lectures. Input audio START conditioning 77Bidirectional RNNs was terribly exciting the movie Forward RNN Backward RNN Concatenated hidden states This contextual representation of terribly has both left and right context 78Bidirectional RNNs 79 Note bidirectional RNNs are only applicable if you have access to the entire input sequence They are not applicable to Language Modeling because in LM you only have left context available. If you do have entire input sequence e.g. any kind of encoding bidirectionality is powerful you should use it by default . For example BERT Bidirectional Encoder Representations from Transformers is a powerful pretrained contextual representation system built on bidirectionality.']",text-embedding-3-small,512,20,2,"
You are an AI Teaching Assistant for the SEP 775 course. 
Your job is to answer students' questions about course materials according to the instructions and context provided.
If you found the answer based on the context provided, you should provide the answer first, then at the end, beginning a new sentence with the words ""Source:"", followed by the name of the lecture, or assignment, or paper if possible.
",0.8908757614319701,0.4,0.9492906535730437,0.0909090909090909
72,What are the methods of generation in conditioned language modeling?,"The methods of generation in conditioned language modeling are Sampling and Argmax. Sampling involves trying to generate a random sentence according to the probability distribution, while Argmax involves trying to generate the sentence with the highest probability. Another method mentioned is Ancestral Sampling, which involves randomly generating words one by one.","['file name: lecture04 Conditioned Generation. Hamidreza Mahyar mahyarh@mcmaster.ca Computational Natural Language Processing Conditioned GenerationLanguage Models Language models are generative models of text s P x The Malfoys said Hermione. Harry was watching him. He looked like Madame Maxime. When she strode up the wrong staircase to visit himself. I m afraid I ve definitely been suspended from power no chance indeed said Snape. He put his head back behind them and read groups as they crossed a corner and fluttered down onto their ink lamp and picked up his spoon. The doorbell rang. It was a lot cleaner down in London. Text Credit Max Deutsch https medium.com deep writingConditioned Language Models Not just generate text generate text according to some specification Input X Structured Data English Document Utterance Image Speech Output Y Text NL Description Japanese Short Description Response Text Transcript Task NL Generation Translation Summarization Response Generation Image Captioning Speech RecognitionFormulation and ModelingCalculating the Probability of a SentenceConditional Language ModelsOne Type of Language Model LSTM LSTM LSTM LSTM predict hate predict this predict movie predict s LSTM Mikolov et al. 2011 s I hate this movie predict ILSTM LSTM LSTM LSTM LSTM s LSTM LSTM LSTM LSTM argmax argmax argmax argmax argmax s One Type of Conditional Language Model I hate this movie kono eiga ga kirai hate this movie Sutskever et al. 2014 Encoder I DecoderHow to Pass Hidden State Initialize decoder w encoder Sutskever et al. 2014 encoder decoder Transform can be different dimensions encoder transform decoder encoder Input at every time step Kalchbrenner Blunsom 2013 decoder decoder decoderMethods of GenerationThe Generation Problem We have a model of P Y X how do we use it to generate a sentence Two methods Sampling Try to generate a random sentence according to the probability distribution. Argmax Try to generate the sentence with the highest probability.Ancestral Sampling Randomly generate words one by one.', 'An exact method for sampling from P X no further work needed.Greedy Search One by one pick the single highest probability word Not exact real problems Will often generate the easy words first Will prefer multiple common words to one rare wordBeam Search Instead of picking one high probability word maintain several paths Some in reading materials more in a later classModel EnsemblingEnsembling Why Multiple models make somewhat uncorrelated errors Models tend to be more uncertain when they are about to make errors Smooths over idiosyncrasies of the model LSTM1 predict1 I LSTM2 predict2 Combine predictions from multiple models s sLinear Interpolation Take a weighted average of the M model probabilities Second term often set to uniform distribution 1 MLog linear Interpolation Weighted combination of log probabilities normalize Interpolation coefficient often set to uniform distribution 1 MLinear or Log Linear Think of it in logic Linear Logical OR the interpolated model likes any choice that a model gives a high probability use models with models that capture different traits necessary when any model can assign zero probability Log Linear Logical AND interpolated model only likes choices where all models agree use when you want to restrict possible answersParameter Averaging Problem Ensembling means we have to use M models at test time increasing our time memory complexity Parameter averaging is a cheap way to get some good effects of ensembling Basically write out models several times near the end of training and take the average of parametersEnsemble Distillation e.g. Kim et al. 2016 Problem parameter averaging only works for models within the same run Knowledge distillation trains a model to copy the ensemble Specifically it tries to match the description over predicted words Why We want the model to make the same mistakes as an ensemble Shown to increase accuracy notablyStacking What if we have two very different models where prediction of outputs is done in very different ways e.g. a phrase based translation model and a neural MT model Niehues et al. 2017 Stacking uses the output of one system in calculating features for another systemCase Studies in Conditional Language ModelingFrom Images e.g. Karpathy et al. 2015 Input is image features output is text Use standard image encoders e.g.']",text-embedding-3-small,512,20,2,"
You are an AI Teaching Assistant for the SEP 775 course. 
Your job is to answer students' questions about course materials according to the instructions and context provided.
If you found the answer based on the context provided, you should provide the answer first, then at the end, beginning a new sentence with the words ""Source:"", followed by the name of the lecture, or assignment, or paper if possible.
",0.999997840343882,0.75,0.9486235296589066,0.0833333333333333
73,What is beam search and how is it used in language generation?,"Beam search is a decoding algorithm used in natural language processing for generating sequences like sentences. It is an alternative to greedy decoding, which selects the most probable word at each step. In beam search, instead of selecting just one word, the algorithm keeps track of the k most probable partial translations, called hypotheses, at each step of the decoding process. The beam size, k, determines how many hypotheses are considered. These hypotheses are scored based on their log probabilities, with higher scores indicating better translations. Beam search is more efficient than exhaustive search, where all possible sequences are computed, and while it is not guaranteed to find the optimal solution, it is a practical approach for generating sequences in tasks like neural machine translation.

Source: lecture05_Seq2Seq","['2014 Luong et al. 2015 The hidden states from RNN layer i are the inputs to RNN layer i 1Decoding Greedy decoding We saw how to generate or decode the target sentence by taking argmax on each step of the decoder he hit me with a pie END START he hit me with a pie This is greedy decoding take most probable word on each step argmax argmax argmax argmax 15 argmax argmax argmaxProblems with greedy decoding 16 Greedy decoding has no way to undo decisions Input il a m entarté he he hit he hit a he hit me with a pie whoops no going back now How to fix thisExhaustive search decoding Ideally we want to find a length T translation y that maximizes We could try computing all possible sequences y This means that on each step t of the decoder we re tracking Vt possible partial translations where V is vocab size This O VT complexity is far too expensive 17Beam search decoding Core idea On each step of decoder keep track of the k most probable partial translations which we call hypotheses k is the beam size in practice around 5 to 10 in NMT A hypothesis has a score which is its log probability Scores are all negative and higher score is better We search for high scoring hypotheses tracking top k on each step Beam search is not guaranteed to find optimal solution But much more efficient than exhaustive search 18Beam search decoding example Beam size k 2. Blue numbers START Calculate prob dist of next word 19Beam search decoding example Beam size k 2. Blue numbers START he I 0.7 log PLM he START 0.9 log PLM I START Take top k words and compute scores 20Beam search decoding example Beam size k 2. Blue numbers hit struck was got START he I 10 0.7 0.9 2.9 log PLM struck START he 0.7 1.6 log PLM was START I 0.9 1.8 log PLM got START I 0.9 1.7 log PLM hit START he 0.7 For each of the k hypotheses find top k next words and calculate scoresBeam search decoding example Beam size k 2.', 'An exact method for sampling from P X no further work needed.Greedy Search One by one pick the single highest probability word Not exact real problems Will often generate the easy words first Will prefer multiple common words to one rare wordBeam Search Instead of picking one high probability word maintain several paths Some in reading materials more in a later classModel EnsemblingEnsembling Why Multiple models make somewhat uncorrelated errors Models tend to be more uncertain when they are about to make errors Smooths over idiosyncrasies of the model LSTM1 predict1 I LSTM2 predict2 Combine predictions from multiple models s sLinear Interpolation Take a weighted average of the M model probabilities Second term often set to uniform distribution 1 MLog linear Interpolation Weighted combination of log probabilities normalize Interpolation coefficient often set to uniform distribution 1 MLinear or Log Linear Think of it in logic Linear Logical OR the interpolated model likes any choice that a model gives a high probability use models with models that capture different traits necessary when any model can assign zero probability Log Linear Logical AND interpolated model only likes choices where all models agree use when you want to restrict possible answersParameter Averaging Problem Ensembling means we have to use M models at test time increasing our time memory complexity Parameter averaging is a cheap way to get some good effects of ensembling Basically write out models several times near the end of training and take the average of parametersEnsemble Distillation e.g. Kim et al. 2016 Problem parameter averaging only works for models within the same run Knowledge distillation trains a model to copy the ensemble Specifically it tries to match the description over predicted words Why We want the model to make the same mistakes as an ensemble Shown to increase accuracy notablyStacking What if we have two very different models where prediction of outputs is done in very different ways e.g. a phrase based translation model and a neural MT model Niehues et al. 2017 Stacking uses the output of one system in calculating features for another systemCase Studies in Conditional Language ModelingFrom Images e.g. Karpathy et al. 2015 Input is image features output is text Use standard image encoders e.g.']",text-embedding-3-small,512,20,2,"
You are an AI Teaching Assistant for the SEP 775 course. 
Your job is to answer students' questions about course materials according to the instructions and context provided.
If you found the answer based on the context provided, you should provide the answer first, then at the end, beginning a new sentence with the words ""Source:"", followed by the name of the lecture, or assignment, or paper if possible.
",0.9218853282299084,1.0,0.914525955863322,1.0
74,Explain the concept of model ensembling in language models.,"Model ensembling in language models involves using multiple models that make somewhat uncorrelated errors to improve overall performance. By combining predictions from these models through techniques like linear interpolation or log linear interpolation, the ensemble model can benefit from the strengths of each individual model and mitigate their weaknesses. This approach helps to smooth over idiosyncrasies of the models and improve the overall accuracy of the predictions. Additionally, ensemble distillation is a technique where a model is trained to mimic the behavior of an ensemble of models, aiming to replicate the ensemble's decision-making process and improve accuracy. Overall, model ensembling is a powerful technique in language modeling to enhance performance and robustness. 

Source: SEP 775 - Computational Natural Language Processing, Final_Project\data\txt_from_pdf_with_file_name\lecture04_Conditioned_Generation.txt","['An exact method for sampling from P X no further work needed.Greedy Search One by one pick the single highest probability word Not exact real problems Will often generate the easy words first Will prefer multiple common words to one rare wordBeam Search Instead of picking one high probability word maintain several paths Some in reading materials more in a later classModel EnsemblingEnsembling Why Multiple models make somewhat uncorrelated errors Models tend to be more uncertain when they are about to make errors Smooths over idiosyncrasies of the model LSTM1 predict1 I LSTM2 predict2 Combine predictions from multiple models s sLinear Interpolation Take a weighted average of the M model probabilities Second term often set to uniform distribution 1 MLog linear Interpolation Weighted combination of log probabilities normalize Interpolation coefficient often set to uniform distribution 1 MLinear or Log Linear Think of it in logic Linear Logical OR the interpolated model likes any choice that a model gives a high probability use models with models that capture different traits necessary when any model can assign zero probability Log Linear Logical AND interpolated model only likes choices where all models agree use when you want to restrict possible answersParameter Averaging Problem Ensembling means we have to use M models at test time increasing our time memory complexity Parameter averaging is a cheap way to get some good effects of ensembling Basically write out models several times near the end of training and take the average of parametersEnsemble Distillation e.g. Kim et al. 2016 Problem parameter averaging only works for models within the same run Knowledge distillation trains a model to copy the ensemble Specifically it tries to match the description over predicted words Why We want the model to make the same mistakes as an ensemble Shown to increase accuracy notablyStacking What if we have two very different models where prediction of outputs is done in very different ways e.g. a phrase based translation model and a neural MT model Niehues et al. 2017 Stacking uses the output of one system in calculating features for another systemCase Studies in Conditional Language ModelingFrom Images e.g. Karpathy et al. 2015 Input is image features output is text Use standard image encoders e.g.', 'For instance HLW 20 observe that larger models do not necessarily generalize better out of distribution. There is evidence that suggests that the generalization achieved under this paradigm can be poor because the model is overly speciﬁc to the training distribution and does not generalize well outside it YdC 19 MPL19 . Thus the performance of ﬁne tuned models on speciﬁc benchmarks even when it is nominally at human level may exaggerate actual performance on the underlying task GSL 18 NK19 . Third humans do not require large supervised datasets to learn most language tasks a brief directive in natural language e.g. please tell me if this sentence describes something happy or something sad or at most a tiny number of demonstrations e.g. here are two examples of people acting brave please give a third example of bravery is often Figure 1.1 Language model meta learning. During unsupervised pre training a language model develops a broad set of skills and pattern recognition abilities. It then uses these abilities at inference time to rapidly adapt to or recognize the desired task. We use the term in context learning to describe the inner loop of this process which occurs within the forward pass upon each sequence. The sequences in this diagram are not intended to be representative of the data a model would see during pre training but are intended to show that there are sometimes repeated sub tasks embedded within a single sequence. 3Figure 1.2 Larger models make increasingly efﬁcient use of in context information. We show in context learning performance on a simple task requiring the model to remove random symbols from a word both with and without a natural language task description see Sec. 3.9.2 . The steeper in context learning curves for large models demonstrate improved ability to learn a task from contextual information. We see qualitatively similar behavior across a wide range of tasks. sufﬁcient to enable a human to perform a new task to at least a reasonable degree of competence. Aside from pointing to a conceptual limitation in our current NLP techniques this adaptability has practical advantages it allows humans to seamlessly mix together or switch between many tasks and skills for example performing addition during a lengthy dialogue.']",text-embedding-3-small,512,20,2,"
You are an AI Teaching Assistant for the SEP 775 course. 
Your job is to answer students' questions about course materials according to the instructions and context provided.
If you found the answer based on the context provided, you should provide the answer first, then at the end, beginning a new sentence with the words ""Source:"", followed by the name of the lecture, or assignment, or paper if possible.
",0.9686318869192608,1.0,0.9096205842331848,0.0666666666666666
75,How does ensemble distillation differ from parameter averaging?,"Ensemble distillation differs from parameter averaging in that while parameter averaging involves taking the average of parameters from multiple models near the end of training to achieve some effects of ensembling, ensemble distillation trains a model to copy the ensemble by matching the distribution over predicted words. This way, ensemble distillation aims to make the model make the same mistakes as an ensemble, ultimately increasing accuracy notably.","['An exact method for sampling from P X no further work needed.Greedy Search One by one pick the single highest probability word Not exact real problems Will often generate the easy words first Will prefer multiple common words to one rare wordBeam Search Instead of picking one high probability word maintain several paths Some in reading materials more in a later classModel EnsemblingEnsembling Why Multiple models make somewhat uncorrelated errors Models tend to be more uncertain when they are about to make errors Smooths over idiosyncrasies of the model LSTM1 predict1 I LSTM2 predict2 Combine predictions from multiple models s sLinear Interpolation Take a weighted average of the M model probabilities Second term often set to uniform distribution 1 MLog linear Interpolation Weighted combination of log probabilities normalize Interpolation coefficient often set to uniform distribution 1 MLinear or Log Linear Think of it in logic Linear Logical OR the interpolated model likes any choice that a model gives a high probability use models with models that capture different traits necessary when any model can assign zero probability Log Linear Logical AND interpolated model only likes choices where all models agree use when you want to restrict possible answersParameter Averaging Problem Ensembling means we have to use M models at test time increasing our time memory complexity Parameter averaging is a cheap way to get some good effects of ensembling Basically write out models several times near the end of training and take the average of parametersEnsemble Distillation e.g. Kim et al. 2016 Problem parameter averaging only works for models within the same run Knowledge distillation trains a model to copy the ensemble Specifically it tries to match the description over predicted words Why We want the model to make the same mistakes as an ensemble Shown to increase accuracy notablyStacking What if we have two very different models where prediction of outputs is done in very different ways e.g. a phrase based translation model and a neural MT model Niehues et al. 2017 Stacking uses the output of one system in calculating features for another systemCase Studies in Conditional Language ModelingFrom Images e.g. Karpathy et al. 2015 Input is image features output is text Use standard image encoders e.g.', 'All ensembles have at least 3 workers. TL DR 6.7B RL T 0.7 labeler labeler ensem ble length copying ROUGE 1.3B sup logprob 1.3B RM 6.7B sup logprob 6.7B RM labeler 60.4 5.9 66.0 7.6 55.8 2.2 52.7 2.1 49.9 2.1 48.0 2.2 57.4 2.0 47.3 2.2 62.3 2.1 labeler ensemble 66.0 7.6 80.0 8.9 65.0 10.6 35.0 10.5 45.0 11.1 75.0 9.8 40.0 10.5 75.0 9.8 length 55.8 2.2 80.0 8.9 48.1 2.2 50.3 2.2 30.0 2.1 62.0 2.1 30.4 2.0 59.8 2.2 copying 52.7 2.1 65.0 10.6 48.1 2.2 52.0 2.2 64.2 2.1 56.7 2.2 64.4 2.1 53.4 2.2 ROUGE 49.9 2.1 35.0 10.5 50.3 2.2 52.0 2.2 50.5 2.2 52.0 2.3 51.1 2.3 54.5 2.1 1.3B sup.']",text-embedding-3-small,512,20,2,"
You are an AI Teaching Assistant for the SEP 775 course. 
Your job is to answer students' questions about course materials according to the instructions and context provided.
If you found the answer based on the context provided, you should provide the answer first, then at the end, beginning a new sentence with the words ""Source:"", followed by the name of the lecture, or assignment, or paper if possible.
",0.987278043698859,,0.9705941945294329,0.3333333333333333
76,What are some common evaluation metrics for conditioned language models?,"Some common evaluation metrics for conditioned language models include BLEU, embedding-based metrics like BertScore, BLEURT, COMET, PRISM, and Perplexity. Additionally, meta-evaluation, which involves running human evaluation and automatic evaluation on the same outputs and calculating correlation, is also used to evaluate conditioned language models. 

Source: SEP 775 - Computational Natural Language Processing, lecture04_Conditioned_Generation","['2015 Input is image features output is text Use standard image encoders e.g. CNN Often pre trained on large databases such as ImageNetCheck out this review paperHow do we EvaluateBasic Evaluation Paradigm Use parallel test set Use system to generate translations Compare target translations w referenceHuman Evaluation Ask a human to do evaluation Final goal but slow expensive and sometimes inconsistentBLEU Works by comparing n gram overlap w reference Pros Easy to use good for measuring system improvement Cons Often doesn t match human eval bad for comparing very different systemsEmbedding based Metrics Recently many metrics based on neural models BertScore Find similarity between BERT embeddings unsupervised Zhang et al. 2020 BLEURT Train BERT to predict human evaluation scores Sellam et al. 2020 COMET Train model to predict human eval also using source sentence Rei et al. 2020 PRISM Model based on training paraphrasing model Thompson and Post 2020Perplexity Calculate the perplexity of the words in the held out set without doing generation Pros Naturally solves multiple reference problem Cons Doesn t consider decoding or actually generating output. May be reasonable for problems with lots of ambiguity.Which One to Use Meta evaluation runs human evaluation and automatic evaluation on the same outputs calculates correlation Examples WMT Metrics Task for MT Mathur et al. 2021 RealSumm for summarization Evaluation is hard especially with good systems Most metrics had no correlation w human eval over best systems at some WMT 2019 tasksQuestions', 'For this graph we also include 6 additional extra small models with as few as 100 000 parameters. As observed in KMH 20 language modeling performance follows a power law when making efﬁcient use of training compute. After extending this trend by two more orders of magnitude we observe only a slight if any departure from the power law. One might worry that these improvements in cross entropy loss come only from modeling spurious details of our training corpus. However we will see in the following sections that improvements in cross entropy loss lead to consistent performance gains across a broad spectrum of natural language tasks. Below we evaluate the 8 models described in Section 2 the 175 billion parameter parameter GPT 3 and 7 smaller models on a wide range of datasets. We group the datasets into 9 categories representing roughly similar tasks. In Section 3.1 we evaluate on traditional language modeling tasks and tasks that are similar to language modeling such as Cloze tasks and sentence paragraph completion tasks. In Section 3.2 we evaluate on closed book question answering tasks tasks which require using the information stored in the model s parameters to answer general knowledge questions. In Section 3.3 we evaluate the model s ability to translate between languages especially one shot and few shot . In Section 3.4 we evaluate the model s performance on Winograd Schema like tasks. In Section 3.5 we evaluate on datasets that involve commonsense reasoning or question answering. In Section 3.6 we evaluate on reading comprehension tasks in Section 3.7 we evaluate on the SuperGLUE benchmark suite and in 3.8 we brieﬂy explore NLI. Finally in Section 3.9 we invent some additional tasks designed especially to probe in context learning abilities these tasks focus on on the ﬂy reasoning adaptation skills or open ended text synthesis. We evaluate all tasks in the few shot one shot and zero shot settings. 10Figure 3.1 Smooth scaling of performance with compute. Performance measured in terms of cross entropy validation loss follows a power law trend with the amount of compute used for training. The power law behavior observed in KMH 20 continues for an additional two orders of magnitude with only small deviations from the predicted curve.']",text-embedding-3-small,512,20,2,"
You are an AI Teaching Assistant for the SEP 775 course. 
Your job is to answer students' questions about course materials according to the instructions and context provided.
If you found the answer based on the context provided, you should provide the answer first, then at the end, beginning a new sentence with the words ""Source:"", followed by the name of the lecture, or assignment, or paper if possible.
",1.0000000000000002,0.8888888888888888,0.9160912851646664,0.0
77,What is the significance of stacking in model ensembling?,"Stacking is significant in model ensembling when we have two very different models that predict outputs in different ways. Stacking involves using the output of one system to calculate features for another system, allowing for the combination of diverse model predictions to improve overall performance. It is particularly useful when dealing with models that have complementary strengths and weaknesses, such as a phrase-based translation model and a neural machine translation model. By leveraging stacking, we can enhance the predictive power of ensembles by incorporating a variety of model perspectives and approaches. 

Source: SEP 775 - Computational Natural Language Processing, lecture04_Conditioned_Generation.","['An exact method for sampling from P X no further work needed.Greedy Search One by one pick the single highest probability word Not exact real problems Will often generate the easy words first Will prefer multiple common words to one rare wordBeam Search Instead of picking one high probability word maintain several paths Some in reading materials more in a later classModel EnsemblingEnsembling Why Multiple models make somewhat uncorrelated errors Models tend to be more uncertain when they are about to make errors Smooths over idiosyncrasies of the model LSTM1 predict1 I LSTM2 predict2 Combine predictions from multiple models s sLinear Interpolation Take a weighted average of the M model probabilities Second term often set to uniform distribution 1 MLog linear Interpolation Weighted combination of log probabilities normalize Interpolation coefficient often set to uniform distribution 1 MLinear or Log Linear Think of it in logic Linear Logical OR the interpolated model likes any choice that a model gives a high probability use models with models that capture different traits necessary when any model can assign zero probability Log Linear Logical AND interpolated model only likes choices where all models agree use when you want to restrict possible answersParameter Averaging Problem Ensembling means we have to use M models at test time increasing our time memory complexity Parameter averaging is a cheap way to get some good effects of ensembling Basically write out models several times near the end of training and take the average of parametersEnsemble Distillation e.g. Kim et al. 2016 Problem parameter averaging only works for models within the same run Knowledge distillation trains a model to copy the ensemble Specifically it tries to match the description over predicted words Why We want the model to make the same mistakes as an ensemble Shown to increase accuracy notablyStacking What if we have two very different models where prediction of outputs is done in very different ways e.g. a phrase based translation model and a neural MT model Niehues et al. 2017 Stacking uses the output of one system in calculating features for another systemCase Studies in Conditional Language ModelingFrom Images e.g. Karpathy et al. 2015 Input is image features output is text Use standard image encoders e.g.', 'All ensembles have at least 3 workers. TL DR 6.7B RL T 0.7 labeler labeler ensem ble length copying ROUGE 1.3B sup logprob 1.3B RM 6.7B sup logprob 6.7B RM labeler 60.4 5.9 66.0 7.6 55.8 2.2 52.7 2.1 49.9 2.1 48.0 2.2 57.4 2.0 47.3 2.2 62.3 2.1 labeler ensemble 66.0 7.6 80.0 8.9 65.0 10.6 35.0 10.5 45.0 11.1 75.0 9.8 40.0 10.5 75.0 9.8 length 55.8 2.2 80.0 8.9 48.1 2.2 50.3 2.2 30.0 2.1 62.0 2.1 30.4 2.0 59.8 2.2 copying 52.7 2.1 65.0 10.6 48.1 2.2 52.0 2.2 64.2 2.1 56.7 2.2 64.4 2.1 53.4 2.2 ROUGE 49.9 2.1 35.0 10.5 50.3 2.2 52.0 2.2 50.5 2.2 52.0 2.3 51.1 2.3 54.5 2.1 1.3B sup.']",text-embedding-3-small,512,20,2,"
You are an AI Teaching Assistant for the SEP 775 course. 
Your job is to answer students' questions about course materials according to the instructions and context provided.
If you found the answer based on the context provided, you should provide the answer first, then at the end, beginning a new sentence with the words ""Source:"", followed by the name of the lecture, or assignment, or paper if possible.
",0.9609509521143909,0.6,0.929264964756929,0.3333333333333333
78,How are images used as input for conditioned language models?,"Images can be used as input for conditioned language models in various ways, such as in image captioning tasks where the model generates textual descriptions based on the content of the image, or in tasks where the model generates text conditioned on the features extracted from the image. This allows the model to generate text that is relevant to the visual content of the image provided as input.","['While the effective receptive ﬁeld size in this ﬁgure is the same for both schemes in 2D attention the memory block contains a more evenly balanced number of pixels next to and above the query block respectively. dence across channels Salimans et al. . For each pixel the number of parameters is 10 times the number of mixture components 10 for one unnormalized mixture probability three means three standard deviations and three coefﬁcients which capture the linear dependence. For 10 mixtures this translates to 100 parameters for each pixel for 32 32 im ages the network outputs 102 400 dimensions which is a 7x reduction enabling denser gradients and lower memory. 4. Inference Across all of the presented experiments we use categorical sampling during decoding with a tempered softmax Dahl et al. 2017 . We adjust the concentration of the distribution we sample from with a temperature τ 0 by which we divide the logits for the channel intensities. We tuned τ between 0.8 and 1.0 observing the highest perceptual quality in unconditioned and class conditional image generation with τ 1.0. For super resolution we present results for different temperatures in Table 5. 5. Experiments All code we used to develop train and evaluate our models is available in Tensor2Tensor Vaswani et al. 2018 . For all experiments we optimize with Adam Kingma Ba 2015 and vary the learning rate as speciﬁed in Vaswani et al. 2017 . We train our models on both p100 and k40 GPUs with batch sizes ranging from 1 to 8 per GPU.Image Transformer Table 3. Conditional image generations for all CIFAR 10 cate gories. Images on the left are from a model that achieves 3.03 bits dim on the test set. Images on the right are from our best non averaged model with 2.99 bits dim. Both models are able to generate convincing cars trucks and ships. Generated horses planes and birds also look reasonable. 5.1. Generative Image Modeling Our unconditioned and class conditioned image generation models both use 1D local attention with lq 256 and a total memory size of 512.', 'file name: lecture04 Conditioned Generation. Hamidreza Mahyar mahyarh@mcmaster.ca Computational Natural Language Processing Conditioned GenerationLanguage Models Language models are generative models of text s P x The Malfoys said Hermione. Harry was watching him. He looked like Madame Maxime. When she strode up the wrong staircase to visit himself. I m afraid I ve definitely been suspended from power no chance indeed said Snape. He put his head back behind them and read groups as they crossed a corner and fluttered down onto their ink lamp and picked up his spoon. The doorbell rang. It was a lot cleaner down in London. Text Credit Max Deutsch https medium.com deep writingConditioned Language Models Not just generate text generate text according to some specification Input X Structured Data English Document Utterance Image Speech Output Y Text NL Description Japanese Short Description Response Text Transcript Task NL Generation Translation Summarization Response Generation Image Captioning Speech RecognitionFormulation and ModelingCalculating the Probability of a SentenceConditional Language ModelsOne Type of Language Model LSTM LSTM LSTM LSTM predict hate predict this predict movie predict s LSTM Mikolov et al. 2011 s I hate this movie predict ILSTM LSTM LSTM LSTM LSTM s LSTM LSTM LSTM LSTM argmax argmax argmax argmax argmax s One Type of Conditional Language Model I hate this movie kono eiga ga kirai hate this movie Sutskever et al. 2014 Encoder I DecoderHow to Pass Hidden State Initialize decoder w encoder Sutskever et al. 2014 encoder decoder Transform can be different dimensions encoder transform decoder encoder Input at every time step Kalchbrenner Blunsom 2013 decoder decoder decoderMethods of GenerationThe Generation Problem We have a model of P Y X how do we use it to generate a sentence Two methods Sampling Try to generate a random sentence according to the probability distribution. Argmax Try to generate the sentence with the highest probability.Ancestral Sampling Randomly generate words one by one.']",text-embedding-3-small,512,20,2,"
You are an AI Teaching Assistant for the SEP 775 course. 
Your job is to answer students' questions about course materials according to the instructions and context provided.
If you found the answer based on the context provided, you should provide the answer first, then at the end, beginning a new sentence with the words ""Source:"", followed by the name of the lecture, or assignment, or paper if possible.
",0.9918167469840448,1.0,0.9254619113606456,0.0
79,What challenges exist in evaluating conditioned language models?,"Some challenges in evaluating conditioned language models include the tendency for larger models to not necessarily generalize well out of distribution, the risk of models being overly specific to the training data and not generalizing effectively outside of it, the potential exaggeration of performance on specific benchmarks even when models perform at human-level, and the issue of poor sample efficiency during pre-training. Additionally, there is a limitation in the current approach of scaling up language models due to the lack of weighting tokens based on importance, the reliance on self-supervised objectives that may not capture goal-directed actions effectively, and the lack of grounding in other domains such as real-world interactions or video experiences. These challenges highlight the need for improvements in evaluation methods and model design to address these limitations.

Source: Language_Models_are_Few_Shot_Learners.txt","['For instance HLW 20 observe that larger models do not necessarily generalize better out of distribution. There is evidence that suggests that the generalization achieved under this paradigm can be poor because the model is overly speciﬁc to the training distribution and does not generalize well outside it YdC 19 MPL19 . Thus the performance of ﬁne tuned models on speciﬁc benchmarks even when it is nominally at human level may exaggerate actual performance on the underlying task GSL 18 NK19 . Third humans do not require large supervised datasets to learn most language tasks a brief directive in natural language e.g. please tell me if this sentence describes something happy or something sad or at most a tiny number of demonstrations e.g. here are two examples of people acting brave please give a third example of bravery is often Figure 1.1 Language model meta learning. During unsupervised pre training a language model develops a broad set of skills and pattern recognition abilities. It then uses these abilities at inference time to rapidly adapt to or recognize the desired task. We use the term in context learning to describe the inner loop of this process which occurs within the forward pass upon each sequence. The sequences in this diagram are not intended to be representative of the data a model would see during pre training but are intended to show that there are sometimes repeated sub tasks embedded within a single sequence. 3Figure 1.2 Larger models make increasingly efﬁcient use of in context information. We show in context learning performance on a simple task requiring the model to remove random symbols from a word both with and without a natural language task description see Sec. 3.9.2 . The steeper in context learning curves for large models demonstrate improved ability to learn a task from contextual information. We see qualitatively similar behavior across a wide range of tasks. sufﬁcient to enable a human to perform a new task to at least a reasonable degree of competence. Aside from pointing to a conceptual limitation in our current NLP techniques this adaptability has practical advantages it allows humans to seamlessly mix together or switch between many tasks and skills for example performing addition during a lengthy dialogue.', 'A more fundamental limitation of the general approach described in this paper scaling up any LM like model whether autoregressive or bidirectional is that it may eventually run into or could already be running into the limits of the 33pretraining objective. Our current objective weights every token equally and lacks a notion of what is most important to predict and what is less important. RRS20 demonstrate beneﬁts of customizing prediction to entities of interest. Also with self supervised objectives task speciﬁcation relies on forcing the desired task into a prediction problem whereas ultimately useful language systems for example virtual assistants might be better thought of as taking goal directed actions rather than just making predictions. Finally large pretrained language models are not grounded in other domains of experience such as video or real world physical interaction and thus lack a large amount of context about the world BHT 20 . For all these reasons scaling pure self supervised prediction is likely to hit limits and augmentation with a different approach is likely to be necessary. Promising future directions in this vein might include learning the objective function from humans ZSW 19a ﬁne tuning with reinforcement learning or adding additional modalities such as images to provide grounding and a better model of the world CLY 19 . Another limitation broadly shared by language models is poor sample efﬁciency during pre training. While GPT 3 takes a step towards test time sample efﬁciency closer to that of humans one shot or zero shot it still sees much more text during pre training than a human sees in the their lifetime Lin20 . Improving pre training sample efﬁciency is an important direction for future work and might come from grounding in the physical world to provide additional information or from algorithmic improvements. A limitation or at least uncertainty associated with few shot learning in GPT 3 is ambiguity about whether few shot learning actually learns new tasks from scratch at inference time or if it simply recognizes and identiﬁes tasks that it has learned during training.']",text-embedding-3-small,512,20,2,"
You are an AI Teaching Assistant for the SEP 775 course. 
Your job is to answer students' questions about course materials according to the instructions and context provided.
If you found the answer based on the context provided, you should provide the answer first, then at the end, beginning a new sentence with the words ""Source:"", followed by the name of the lecture, or assignment, or paper if possible.
",0.9932392273138442,1.0,0.8651793262459562,0.04
80,What is the instructor's name for this course?,"The instructor's name for the course ""Introduction to Computational Natural Language Processing"" is Hamidreza Mahyar.","['file name: NLP Winter 2024 Course Outline. Course Outline 1. COURSE INFORMATION Session Offered Winter 2024 Course Name Introduction to Computational Natural Language Processing Course Code SEP 775 Date s and Time s of lectures Lectures In person Wednesday 3 30 pm 6 30 pm Program Name System and Technology Calendar Description This graduate course introduces fundamental concepts in computational natural language processing NLP and their applications to teaching students how to deal with textual data in Artificial Intelligence. This course demonstrates how machines can learn different tasks in natural language such as language modeling text generation machine translation and language understanding. In this regard we go over the most promising methods in this literature and the most recent state of the art techniques. Moreover this course explores different real world applications of NLP and helps students get hands on experience in this field. Instructor Hamidreza Mahyar E Mail mahyarh@mcmaster.ca Office Hours upon request 2.', '. Students should be aware that when they access the electronic components of a course using these elements private information such as first and last names user names for the McMaster e mail accounts and program affiliation may become apparent to all other students in the same course. The available information is dependent on the technology used. Continuation in a course that uses on line elements will be deemed consent to this disclosure. If you have any questions or concerns about such disclosure please discuss this with the course instructor. ONLINE PROCTORING Some courses may use online proctoring software for tests and exams. This software may require students to turn on their video camera present identification monitor and record their computer activities and or lock restrict their browser or other applications software during tests or exams. This software may be required to be installed before the test exam begins. COMMUNICATIONS It is the student s responsibility to Maintain current contact information with the University including address phone numbers and emergency contact information. Use the University provided e mail address or maintain a valid forwarding e mail address.', 'COURSE SPECIFICS Course Description This course covers some fundamental concepts in natural language processing NLP and how they apply in real world use cases. Instruction Type Code Type Hours per term C Classroom instruction 39 L Laboratory workshop or fieldwork T Tutorial DE Distance education Total Hours 39 Resources ISBN Textbook Title Edition Author Publisher Natural Language Processing Jacob Eisenstein Speech and Language Processing Dan Jurafsky and James H. Martin Deep Learning Ian Goodfellow Yoshua Bengio and Aaron Courville Prerequisite s Proficiency in Python programming language Some Machine Learning and or Deep Learning knowledge is a plus Corequisite s Antirequisite s Course Specific Policies All work must be shown to get full credit. Specific policy of Projects Assignments submissionsProjects Assignments will be conducted online by using related software. Completed Projects Assignments should be uploaded to the drop box before midnight of the due date. Projects Assignments missed due to legitimate reasons must be completed later mutually agreed with the instructor.', 'Students should submit their request to their Faculty Office normally within 10 working days of the beginning of term in which they anticipate a need for accommodation or to the Registrar s Office prior to their examinations. Students should also contact their instructors as soon as possible to make alternative arrangements for classes assignments and tests. http www.mcmaster.ca policy Students AcademicStudies Studentcode.pdf COPYRIGHT AND RECORDING Students are advised that lectures demonstrations performances and any other course material provided by an instructor include copyright protected works. The Copyright Act and copyright law protect every original literary dramatic musical and artistic work including lectures by University instructors The recording of lectures tutorials or other methods of instruction may occur during a course. Recording may be done by either the instructor for the purpose of authorized distribution or by a student for the purpose of personal study. Students should be aware that their voice and or image may be recorded by others during the class. Please speak with the instructor if this is a concern for you.']",text-embedding-3-small,256,10,4,"
You are an AI teaching Assistant for the SEP 775 course. 
You will provide an interactive platform for students to ask questions and receive guidance on course materials.
Your goal is to answer questions as accurately as possible based on the instructions and context provided.
If you found the answer based on the context provided, you should provide the answer first, then at the end, beginning a new sentence with the words ""Source:"", followed by the name of the lecture, or assignment, or paper if possible.
",0.9157200533247656,1.0,0.9394654423691152,0.1
81,What is the email address of the instructor for this course?,"The email address of the instructor for the course ""Introduction to Computational Natural Language Processing"" (Course Code: SEP 775) is mahyarh@mcmaster.ca.

Source: NLP Winter 2024 Course Outline.","['. Students should be aware that when they access the electronic components of a course using these elements private information such as first and last names user names for the McMaster e mail accounts and program affiliation may become apparent to all other students in the same course. The available information is dependent on the technology used. Continuation in a course that uses on line elements will be deemed consent to this disclosure. If you have any questions or concerns about such disclosure please discuss this with the course instructor. ONLINE PROCTORING Some courses may use online proctoring software for tests and exams. This software may require students to turn on their video camera present identification monitor and record their computer activities and or lock restrict their browser or other applications software during tests or exams. This software may be required to be installed before the test exam begins. COMMUNICATIONS It is the student s responsibility to Maintain current contact information with the University including address phone numbers and emergency contact information. Use the University provided e mail address or maintain a valid forwarding e mail address.', 'Students should submit their request to their Faculty Office normally within 10 working days of the beginning of term in which they anticipate a need for accommodation or to the Registrar s Office prior to their examinations. Students should also contact their instructors as soon as possible to make alternative arrangements for classes assignments and tests. http www.mcmaster.ca policy Students AcademicStudies Studentcode.pdf COPYRIGHT AND RECORDING Students are advised that lectures demonstrations performances and any other course material provided by an instructor include copyright protected works. The Copyright Act and copyright law protect every original literary dramatic musical and artistic work including lectures by University instructors The recording of lectures tutorials or other methods of instruction may occur during a course. Recording may be done by either the instructor for the purpose of authorized distribution or by a student for the purpose of personal study. Students should be aware that their voice and or image may be recorded by others during the class. Please speak with the instructor if this is a concern for you.', 'file name: NLP Winter 2024 Course Outline. Course Outline 1. COURSE INFORMATION Session Offered Winter 2024 Course Name Introduction to Computational Natural Language Processing Course Code SEP 775 Date s and Time s of lectures Lectures In person Wednesday 3 30 pm 6 30 pm Program Name System and Technology Calendar Description This graduate course introduces fundamental concepts in computational natural language processing NLP and their applications to teaching students how to deal with textual data in Artificial Intelligence. This course demonstrates how machines can learn different tasks in natural language such as language modeling text generation machine translation and language understanding. In this regard we go over the most promising methods in this literature and the most recent state of the art techniques. Moreover this course explores different real world applications of NLP and helps students get hands on experience in this field. Instructor Hamidreza Mahyar E Mail mahyarh@mcmaster.ca Office Hours upon request 2.', 'Regularly check the official University communications channels. Official University communications are considered received if sent by postal mail by fax or by e mail to the student s designated primary e mail account via their @mcmaster.ca alias. Accept that forwarded e mails may be lost and that e mail is considered received if sent via the student s @mcmaster.ca alias. Check the McMaster Avenue email and course websites on a regular basis during the term. CONDUCT EXPECTATIONS As a McMaster student you have the right to experience and the responsibility to demonstrate respectful and dignified interactions within all of our living learning and working communities. These expectations are described in the Code of Student Rights Responsibilities the Code . All students share the responsibility of maintaining a positive environment for the academic and personal growth of all McMaster community members whether in person or online. It is essential that students be mindful of their interactions online as the Code remains in effect in virtual learning environments. The Code applies to any interactions that adversely affect disrupt or interfere with reasonable participation in University activities.']",text-embedding-3-small,256,10,4,"
You are an AI teaching Assistant for the SEP 775 course. 
You will provide an interactive platform for students to ask questions and receive guidance on course materials.
Your goal is to answer questions as accurately as possible based on the instructions and context provided.
If you found the answer based on the context provided, you should provide the answer first, then at the end, beginning a new sentence with the words ""Source:"", followed by the name of the lecture, or assignment, or paper if possible.
",0.9164196233140022,1.0,0.8962192671649039,0.0
82,When is this course held every week?,"The course ""Introduction to Computational Natural Language Processing"" with course code SEP 775 is held in person on Wednesdays from 3:30 pm to 6:30 pm every week during the Winter 2024 session.","['3. SUB TOPIC S Week 1 Overview Human language Word meanings Word2Vec and Optimization basics Week 2 Intro to neural networks Gradients and backpropagation Week 3 Recurrent Neural Networks and Language Models Week 4 Conditioned Generation Week 5 Part 1 Self attention and transformers Part 2 Seq2Seq models Week 6 Midterm Test Week 7 Midterm Recess No class Week 8 Prompting Instruction Finetuning and RLHF Week 9 Question Answering systems Week 10 Multimodal models Week 11 Project presentation and Q A Week 12 Project presentation and Q A Week 13 Project presentation and Q A Classes end April 10th 4. ASSESSMENT OF LEARNING Weight 4 Assignments 20 4 Quizzes 10 Midterm Test 35 Group Project 35 TOTAL 100Note that the percentage distribution of each module may be adjusted. Percentage grades will be converted to letter grades and grade points per the University calendar. 5.', 'file name: NLP Winter 2024 Course Outline. Course Outline 1. COURSE INFORMATION Session Offered Winter 2024 Course Name Introduction to Computational Natural Language Processing Course Code SEP 775 Date s and Time s of lectures Lectures In person Wednesday 3 30 pm 6 30 pm Program Name System and Technology Calendar Description This graduate course introduces fundamental concepts in computational natural language processing NLP and their applications to teaching students how to deal with textual data in Artificial Intelligence. This course demonstrates how machines can learn different tasks in natural language such as language modeling text generation machine translation and language understanding. In this regard we go over the most promising methods in this literature and the most recent state of the art techniques. Moreover this course explores different real world applications of NLP and helps students get hands on experience in this field. Instructor Hamidreza Mahyar E Mail mahyarh@mcmaster.ca Office Hours upon request 2.', 'COURSE SPECIFICS Course Description This course covers some fundamental concepts in natural language processing NLP and how they apply in real world use cases. Instruction Type Code Type Hours per term C Classroom instruction 39 L Laboratory workshop or fieldwork T Tutorial DE Distance education Total Hours 39 Resources ISBN Textbook Title Edition Author Publisher Natural Language Processing Jacob Eisenstein Speech and Language Processing Dan Jurafsky and James H. Martin Deep Learning Ian Goodfellow Yoshua Bengio and Aaron Courville Prerequisite s Proficiency in Python programming language Some Machine Learning and or Deep Learning knowledge is a plus Corequisite s Antirequisite s Course Specific Policies All work must be shown to get full credit. Specific policy of Projects Assignments submissionsProjects Assignments will be conducted online by using related software. Completed Projects Assignments should be uploaded to the drop box before midnight of the due date. Projects Assignments missed due to legitimate reasons must be completed later mutually agreed with the instructor.', 'Students should submit their request to their Faculty Office normally within 10 working days of the beginning of term in which they anticipate a need for accommodation or to the Registrar s Office prior to their examinations. Students should also contact their instructors as soon as possible to make alternative arrangements for classes assignments and tests. http www.mcmaster.ca policy Students AcademicStudies Studentcode.pdf COPYRIGHT AND RECORDING Students are advised that lectures demonstrations performances and any other course material provided by an instructor include copyright protected works. The Copyright Act and copyright law protect every original literary dramatic musical and artistic work including lectures by University instructors The recording of lectures tutorials or other methods of instruction may occur during a course. Recording may be done by either the instructor for the purpose of authorized distribution or by a student for the purpose of personal study. Students should be aware that their voice and or image may be recorded by others during the class. Please speak with the instructor if this is a concern for you.']",text-embedding-3-small,256,10,4,"
You are an AI teaching Assistant for the SEP 775 course. 
You will provide an interactive platform for students to ask questions and receive guidance on course materials.
Your goal is to answer questions as accurately as possible based on the instructions and context provided.
If you found the answer based on the context provided, you should provide the answer first, then at the end, beginning a new sentence with the words ""Source:"", followed by the name of the lecture, or assignment, or paper if possible.
",0.8459265441514411,1.0,0.8547195606207922,0.1428571428571428
83,What is the name of the TA for this course?,"The TA for this course is not mentioned in the provided context information. If you need more specific details about the TA, you may need to refer to the official course documentation or contact the course instructor directly for that information.","['file name: NLP Winter 2024 Course Outline. Course Outline 1. COURSE INFORMATION Session Offered Winter 2024 Course Name Introduction to Computational Natural Language Processing Course Code SEP 775 Date s and Time s of lectures Lectures In person Wednesday 3 30 pm 6 30 pm Program Name System and Technology Calendar Description This graduate course introduces fundamental concepts in computational natural language processing NLP and their applications to teaching students how to deal with textual data in Artificial Intelligence. This course demonstrates how machines can learn different tasks in natural language such as language modeling text generation machine translation and language understanding. In this regard we go over the most promising methods in this literature and the most recent state of the art techniques. Moreover this course explores different real world applications of NLP and helps students get hands on experience in this field. Instructor Hamidreza Mahyar E Mail mahyarh@mcmaster.ca Office Hours upon request 2.', '. Students should be aware that when they access the electronic components of a course using these elements private information such as first and last names user names for the McMaster e mail accounts and program affiliation may become apparent to all other students in the same course. The available information is dependent on the technology used. Continuation in a course that uses on line elements will be deemed consent to this disclosure. If you have any questions or concerns about such disclosure please discuss this with the course instructor. ONLINE PROCTORING Some courses may use online proctoring software for tests and exams. This software may require students to turn on their video camera present identification monitor and record their computer activities and or lock restrict their browser or other applications software during tests or exams. This software may be required to be installed before the test exam begins. COMMUNICATIONS It is the student s responsibility to Maintain current contact information with the University including address phone numbers and emergency contact information. Use the University provided e mail address or maintain a valid forwarding e mail address.', 'COURSE SPECIFICS Course Description This course covers some fundamental concepts in natural language processing NLP and how they apply in real world use cases. Instruction Type Code Type Hours per term C Classroom instruction 39 L Laboratory workshop or fieldwork T Tutorial DE Distance education Total Hours 39 Resources ISBN Textbook Title Edition Author Publisher Natural Language Processing Jacob Eisenstein Speech and Language Processing Dan Jurafsky and James H. Martin Deep Learning Ian Goodfellow Yoshua Bengio and Aaron Courville Prerequisite s Proficiency in Python programming language Some Machine Learning and or Deep Learning knowledge is a plus Corequisite s Antirequisite s Course Specific Policies All work must be shown to get full credit. Specific policy of Projects Assignments submissionsProjects Assignments will be conducted online by using related software. Completed Projects Assignments should be uploaded to the drop box before midnight of the due date. Projects Assignments missed due to legitimate reasons must be completed later mutually agreed with the instructor.', '3. SUB TOPIC S Week 1 Overview Human language Word meanings Word2Vec and Optimization basics Week 2 Intro to neural networks Gradients and backpropagation Week 3 Recurrent Neural Networks and Language Models Week 4 Conditioned Generation Week 5 Part 1 Self attention and transformers Part 2 Seq2Seq models Week 6 Midterm Test Week 7 Midterm Recess No class Week 8 Prompting Instruction Finetuning and RLHF Week 9 Question Answering systems Week 10 Multimodal models Week 11 Project presentation and Q A Week 12 Project presentation and Q A Week 13 Project presentation and Q A Classes end April 10th 4. ASSESSMENT OF LEARNING Weight 4 Assignments 20 4 Quizzes 10 Midterm Test 35 Group Project 35 TOTAL 100Note that the percentage distribution of each module may be adjusted. Percentage grades will be converted to letter grades and grade points per the University calendar. 5.']",text-embedding-3-small,256,10,4,"
You are an AI teaching Assistant for the SEP 775 course. 
You will provide an interactive platform for students to ask questions and receive guidance on course materials.
Your goal is to answer questions as accurately as possible based on the instructions and context provided.
If you found the answer based on the context provided, you should provide the answer first, then at the end, beginning a new sentence with the words ""Source:"", followed by the name of the lecture, or assignment, or paper if possible.
",0.0,,0.833724864337395,0.0
84,What is Word2vec?,"Word2vec is a model that represents each word in a fixed vocabulary as a low-dimensional vector, much smaller than the vocabulary size. It learns the value of each word's vector to be predictive based on the distribution of words in a short context. The specific model described in the context is the skip-gram word2vec algorithm. It focuses on learning word embeddings by making predictions in local context windows. The word vectors are sometimes called distributed representations as the word's meaning is distributed across the vector dimensions. The parameters of these word vectors are optimized using iterative algorithms based on gradient descent. Source: Lecture01_notes_Introduction.txt, Efficient_Estimation_of_Word_Representations_in_Vector_Space.txt, lecture01_notes_wordvecs2.txt, Contextual_Word_Representations_A_Contextual_Introduction.txt.","['However many of the details of word2vec will hold true in methods that we ll proceed to further in the course so we ll focus our time on that. 3.2 Word2vec model and objective The word2vec model represents each word in a fixed vocabulary as a low dimensional much smaller than vocabulary size vector. It learns the value of each word s vector to be predictive via a simple function of the distribution of words in a usually short 2 4 words context. The model we ll describe here is called the skipgram word2vec algo rithm. Skipgram word2vec. As usual we have a finite vocabulary V. Let C O be random variables representing an unknown pair of C V a center word and O V an outside word appearing in the context of the center word . We ll use c o to refer to specific values of the random variables.', 'file name: Efficient Estimation of Word Representations in Vector Space. Efﬁcient Estimation of Word Representations in Vector Space Tomas Mikolov Google Inc. Mountain View CA tmikolov@google.com Kai Chen Google Inc. Mountain View CA kaichen@google.com Greg Corrado Google Inc. Mountain View CA gcorrado@google.com Jeffrey Dean Google Inc. Mountain View CA jeff@google.com Abstract We propose two novel model architectures for computing continuous vector repre sentations of words from very large data sets. The quality of these representations is measured in a word similarity task and the results are compared to the previ ously best performing techniques based on different types of neural networks. We observe large improvements in accuracy at much lower computational cost i.e. it takes less than a day to learn high quality word vectors from a 1.6 billion words data set.', 'Jeffrey Pennington Richard Socher and Christopher D. Manning. 2014. GloVe Global Vectors for Word Repre sentation 1.1 Comparison with Previous Methods So far we have looked at two main classes of methods to ﬁnd word embeddings. The ﬁrst set are count based and rely on matrix factor ization e.g. LSA HAL . While these methods effectively leverage global statistical information they are primarily used to capture word similarities and do poorly on tasks such as word analogy indi cating a sub optimal vector space structure. The other set of methods are shallow window based e.g. the skip gram and the CBOW mod els which learn word embeddings by making predictions in local context windows. These models demonstrate the capacity to capture complex linguistic patterns beyond word similarity but fail to make use of the global co occurrence statistics.', 'The word s meaning is distributed across the whole vector for this reason these vectors are sometimes called distributed representations.5 As corpora grew scalability became a challenge because the number of observable contexts grew as well. Underlying all word vector algorithms is the notion that the value placed in each dimension of each word type s vector is a parameter that will be optimized alongside all the other parameters to best ﬁt the observed patterns of the words in the data. Since we view these parameters as continuous values and the notion of ﬁtting the data can be operationalized as a smooth continuous objective function selecting the parameter values is done using iterative algorithms based on gradient descent. Using tools that had become popular in machine learning faster methods based on stochastic optimization were developed. One widely known collection of algorithms is available as the word2vec package Mikolov et al. 2013 . A common pattern arose in which industry researchers with large corpora and powerful computing infrastructure would construct word vectors using an established often expensive iterative method and then publish the vectors for anyone to use.']",text-embedding-3-small,256,10,4,"
You are an AI teaching Assistant for the SEP 775 course. 
You will provide an interactive platform for students to ask questions and receive guidance on course materials.
Your goal is to answer questions as accurately as possible based on the instructions and context provided.
If you found the answer based on the context provided, you should provide the answer first, then at the end, beginning a new sentence with the words ""Source:"", followed by the name of the lecture, or assignment, or paper if possible.
",0.9869208964181452,1.0,0.9201541402454648,0.0344827586206896
85,What are the main learning goals of the course?,"The main learning goals of the course are:
1. Understanding the foundations of effective modern methods for deep learning applied to NLP, starting with basics and then covering key methods used in NLP in 2024 such as word vectors, feedforward networks, recurrent networks, attention, encoder-decoder models, transformers, and large pre-trained language models.
2. Developing a big picture understanding of human languages and the challenges in understanding and generating them using computers.
3. Gaining knowledge about various aspects of NLP including deep learning, word representations, language models, pre-trained language models, text generation, Seq2Seq models, prompting, feedback systems, multimodal models, and NLP applications like Q&A systems.

Source: SEP 775 - Computational Natural Language Processing, Course Context.","['learning goals 4 1. The foundations of the effective modern methods for deep learning applied to NLP Basics first then key methods used in NLP in 2024 Word vectors feed forward networks recurrent networks attention encoder decoder models transformers large pre trained language models etc. 2. A big picture understanding of human languages and the difficulties in understanding and producing them via computers 3.', '5. LEARNING OUTCOMES By the end of this course the students will know about Introduction to Deep Learning Word representations Language models Pre trained language models Text generation Seq2Seq models Prompting Feedback systems Multimodal models NLP applications e.g. Q A systems 6. COURSE OUTLINE APPROVED ADVISORY STATEMENTS ANTI DISCRIMINATION The Faculty of Engineering is concerned with ensuring an environment that is free of all discrimination. If there is a problem individuals are reminded that they should contact the Associate Director Graduate Studies the Sexual Harassment Officer or the Human Rights Consultant as soon as possible. http www.mcmaster.ca policy General HR Discrimination_Harassment_Sexual_Harassment Prevention Response.pdf ACADEMIC INTEGRITY You are expected to exhibit honesty and use ethical behaviour in all aspects of the learning process. Academic credentials you earn are rooted in principles of honesty and academic integrity. It is your responsibility to understand what constitutes academic dishonesty.', 'vision are also of interest. 1.2 Language and machines Human children interacting with a rich multi modality world and various forms of feedback acquire language with exceptional sample efficiency not observing that much language and compute efficiency brains are efficient computing machines With all the impressive advances in NLP in the last decades we are still nowhere close to developing learning machines that have a fraction of acquisition ability of children. One fundamental and still quite open problem in building language learning machines is the question of representa tion how should we represent language in a computer such that the computer can robustly process and or generate it This is where this course focuses on the tools provided by deep learning a highly effec tive toolkit for representing both the wild variety of natural language and some of the rules and structures it sometimes adheres to. Much of this course will be dedicated to this question of representation and the rest of this note will talk about a basic subquestion how do we represent words Before that though let s briefly discuss some of the applications you can hope to build after learning modern NLP techniques.', '3. SUB TOPIC S Week 1 Overview Human language Word meanings Word2Vec and Optimization basics Week 2 Intro to neural networks Gradients and backpropagation Week 3 Recurrent Neural Networks and Language Models Week 4 Conditioned Generation Week 5 Part 1 Self attention and transformers Part 2 Seq2Seq models Week 6 Midterm Test Week 7 Midterm Recess No class Week 8 Prompting Instruction Finetuning and RLHF Week 9 Question Answering systems Week 10 Multimodal models Week 11 Project presentation and Q A Week 12 Project presentation and Q A Week 13 Project presentation and Q A Classes end April 10th 4. ASSESSMENT OF LEARNING Weight 4 Assignments 20 4 Quizzes 10 Midterm Test 35 Group Project 35 TOTAL 100Note that the percentage distribution of each module may be adjusted. Percentage grades will be converted to letter grades and grade points per the University calendar. 5.']",text-embedding-3-small,256,10,4,"
You are an AI teaching Assistant for the SEP 775 course. 
You will provide an interactive platform for students to ask questions and receive guidance on course materials.
Your goal is to answer questions as accurately as possible based on the instructions and context provided.
If you found the answer based on the context provided, you should provide the answer first, then at the end, beginning a new sentence with the words ""Source:"", followed by the name of the lecture, or assignment, or paper if possible.
",0.9999999999999996,1.0,0.9538546846950732,0.0769230769230769
86,How is the course grade distributed?,"The course grade is distributed as follows:
- Assignments: 20%
- Quizzes: 10%
- Midterm Test: 35%
- Group Project: 35%
(Source: SEP 775 - Computational Natural Language Processing Course Outline)","['3. SUB TOPIC S Week 1 Overview Human language Word meanings Word2Vec and Optimization basics Week 2 Intro to neural networks Gradients and backpropagation Week 3 Recurrent Neural Networks and Language Models Week 4 Conditioned Generation Week 5 Part 1 Self attention and transformers Part 2 Seq2Seq models Week 6 Midterm Test Week 7 Midterm Recess No class Week 8 Prompting Instruction Finetuning and RLHF Week 9 Question Answering systems Week 10 Multimodal models Week 11 Project presentation and Q A Week 12 Project presentation and Q A Week 13 Project presentation and Q A Classes end April 10th 4. ASSESSMENT OF LEARNING Weight 4 Assignments 20 4 Quizzes 10 Midterm Test 35 Group Project 35 TOTAL 100Note that the percentage distribution of each module may be adjusted. Percentage grades will be converted to letter grades and grade points per the University calendar. 5.', 'For courses using such software students will be expected to submit their work electronically either directly to Turnitin.com or via an online learning platform e.g. A2L etc. using plagiarism detection a service supported by Turnitin.com so it can be checked for academic dishonesty. Students who do not wish their work to be submitted through the plagiarism detection software must inform the Instructor before the assignment is due. No penalty will be assigned to a student who does not submit work to the plagiarism detection software. All submitted work is subject to normal verification that standards of academicintegrity have been upheld e.g. on line search other software etc. . For more details about McMaster s use of Turnitin.com please go to www.mcmaster.ca academicintegrity. COURSES WITH AN ON LINE ELEMENT Some courses may use on line elements e.g. e mail Avenue to Learn A2L LearnLink web pages capa Moodle ThinkingCap etc. .', '. Students should be aware that when they access the electronic components of a course using these elements private information such as first and last names user names for the McMaster e mail accounts and program affiliation may become apparent to all other students in the same course. The available information is dependent on the technology used. Continuation in a course that uses on line elements will be deemed consent to this disclosure. If you have any questions or concerns about such disclosure please discuss this with the course instructor. ONLINE PROCTORING Some courses may use online proctoring software for tests and exams. This software may require students to turn on their video camera present identification monitor and record their computer activities and or lock restrict their browser or other applications software during tests or exams. This software may be required to be installed before the test exam begins. COMMUNICATIONS It is the student s responsibility to Maintain current contact information with the University including address phone numbers and emergency contact information. Use the University provided e mail address or maintain a valid forwarding e mail address.', 'Students should submit their request to their Faculty Office normally within 10 working days of the beginning of term in which they anticipate a need for accommodation or to the Registrar s Office prior to their examinations. Students should also contact their instructors as soon as possible to make alternative arrangements for classes assignments and tests. http www.mcmaster.ca policy Students AcademicStudies Studentcode.pdf COPYRIGHT AND RECORDING Students are advised that lectures demonstrations performances and any other course material provided by an instructor include copyright protected works. The Copyright Act and copyright law protect every original literary dramatic musical and artistic work including lectures by University instructors The recording of lectures tutorials or other methods of instruction may occur during a course. Recording may be done by either the instructor for the purpose of authorized distribution or by a student for the purpose of personal study. Students should be aware that their voice and or image may be recorded by others during the class. Please speak with the instructor if this is a concern for you.']",text-embedding-3-small,256,10,4,"
You are an AI teaching Assistant for the SEP 775 course. 
You will provide an interactive platform for students to ask questions and receive guidance on course materials.
Your goal is to answer questions as accurately as possible based on the instructions and context provided.
If you found the answer based on the context provided, you should provide the answer first, then at the end, beginning a new sentence with the words ""Source:"", followed by the name of the lecture, or assignment, or paper if possible.
",0.9999999999999996,0.8333333333333334,0.931533433604044,0.0344827586206896
87,What is the policy for late submissions in this course?,"The policy for late submissions in this course is that there are NO free late days, and there is a penalty of 1 off course grade per day late. Assignments are not accepted more than 3 days late unless given permission in advance.","['For courses using such software students will be expected to submit their work electronically either directly to Turnitin.com or via an online learning platform e.g. A2L etc. using plagiarism detection a service supported by Turnitin.com so it can be checked for academic dishonesty. Students who do not wish their work to be submitted through the plagiarism detection software must inform the Instructor before the assignment is due. No penalty will be assigned to a student who does not submit work to the plagiarism detection software. All submitted work is subject to normal verification that standards of academicintegrity have been upheld e.g. on line search other software etc. . For more details about McMaster s use of Turnitin.com please go to www.mcmaster.ca academicintegrity. COURSES WITH AN ON LINE ELEMENT Some courses may use on line elements e.g. e mail Avenue to Learn A2L LearnLink web pages capa Moodle ThinkingCap etc. .', 'Students should submit their request to their Faculty Office normally within 10 working days of the beginning of term in which they anticipate a need for accommodation or to the Registrar s Office prior to their examinations. Students should also contact their instructors as soon as possible to make alternative arrangements for classes assignments and tests. http www.mcmaster.ca policy Students AcademicStudies Studentcode.pdf COPYRIGHT AND RECORDING Students are advised that lectures demonstrations performances and any other course material provided by an instructor include copyright protected works. The Copyright Act and copyright law protect every original literary dramatic musical and artistic work including lectures by University instructors The recording of lectures tutorials or other methods of instruction may occur during a course. Recording may be done by either the instructor for the purpose of authorized distribution or by a student for the purpose of personal study. Students should be aware that their voice and or image may be recorded by others during the class. Please speak with the instructor if this is a concern for you.', 'An understanding of and ability to build systems in PyTorch for some of the major problems in NLP Word meaning dependency parsing machine translation question answeringCourse work and grading policy 5 4 Assignments 20 4 Quizzes 10 Midterm 35 Final Group Project 1 3 people 34 Late day policy NO free late days 1 off course grade per day late Assignments not accepted more than 3 days late unless given permission in advance Collaboration policy Understand allowed collaboration and how to document it Don t take code off the web acknowledge working with other students write your own assignment solutionsTrained on text data neural machine translation is quite good https kiswahili.tuko.co.keThe SEC said Musk your tweets are a blight. They really could cost you your job if you don t stop all this tweeting at night. Then Musk cried Why The tweets I wrote are not mean I don t use all caps and I m sure that my tweets are clean. But your tweets can move markets and that s why we re sore.', 'Departmental Policies The use of cell phones iPods laptops and other personal electronic devices are prohibited from the classroom during the class time unless the instructor makes an explicit exception. Announcements made in class or placed on Avenue are considered to have been communicated to all students including those individuals that are not in class. Instructor has the right to submit work to software to identify plagiarism. 3.']",text-embedding-3-small,256,10,4,"
You are an AI teaching Assistant for the SEP 775 course. 
You will provide an interactive platform for students to ask questions and receive guidance on course materials.
Your goal is to answer questions as accurately as possible based on the instructions and context provided.
If you found the answer based on the context provided, you should provide the answer first, then at the end, beginning a new sentence with the words ""Source:"", followed by the name of the lecture, or assignment, or paper if possible.
",0.9832537859774184,1.0,0.9625397787656936,0.0434782608695652
88,What does the course hope to teach regarding word vectors?,The course hopes to teach that word meaning can be represented rather well by a high dimensional vector of real numbers.,"['file name: lecture01 wordvecs1. Hamidreza Mahyar mahyarh@mcmaster.ca Computational Natural Language Processing Overview of NLP and Word VectorsLecture Plan 2 Lecture 1 Introduction and Word Vectors 1. The course 2. Human language and word meaning 3. Word2vec introduction 4. Word2vec objective function gradients 5. Optimization basics 6. Looking at word vectors Key learning today The astounding result that word meaning can be represented rather well by a high dimensional vector of real numbersCourse logistics in brief 3 Instructor Hamidreza Mahyar Head TA Reza Namazi Time Wednesday 3 30pm 6 30pm We put a lot of other important information on Avenue to Learn. Please read itWhat do we hope to teach A.k.a. learning goals 4 1.', '8 CBOW 100B 68.4 79.6 75.4 59.4 45.5 Table 6 Here we see the correlations be tween of word vector similarities using different embedding techniques with different human judgment datasets 2.6 Further Reading Dealing With Ambiguity One might wonder how we handle the situation where we want to capture the same word with different vectors for its different uses in natural language. For instance run is both a noun and a verb and is used and interpreted differently based on the context. Improving Word Representations Via Global Context And Multi ple Word Prototypes Huang et al 2012 describes how such cases can also be handled in NLP. The essence of the method is the following 1. Gather ﬁxed size context windows of all occurrences of the word for instance 5 before and 5 after 2. Each context is represented by a weighted average of the context words vectors using idf weighting 3. Apply spherical k means to cluster these context representations. 4.', 'We believe that word vectors trained on even larger data sets with larger dimensionality will perform signiﬁcantly better and will enable the development of new innovative applications. Another way to improve accuracy is to provide more than one example of the relationship. By using ten examples instead of one to form the relationship vector we average the individual vectors together we have observed improvement of accuracy of our best models by about 10 absolutely on the semantic syntactic test. It is also possible to apply the vector operations to solve different tasks. For example we have observed good accuracy for selecting out of the list words by computing average vector for a list of words and ﬁnding the most distant word vector. This is a popular type of problems in certain human intelligence tests. Clearly there is still a lot of discoveries to be made using these techniques. 6 Conclusion In this paper we studied the quality of vector representations of words derived by various models on a collection of syntactic and semantic language tasks.', 'However many of the details of word2vec will hold true in methods that we ll proceed to further in the course so we ll focus our time on that. 3.2 Word2vec model and objective The word2vec model represents each word in a fixed vocabulary as a low dimensional much smaller than vocabulary size vector. It learns the value of each word s vector to be predictive via a simple function of the distribution of words in a usually short 2 4 words context. The model we ll describe here is called the skipgram word2vec algo rithm. Skipgram word2vec. As usual we have a finite vocabulary V. Let C O be random variables representing an unknown pair of C V a center word and O V an outside word appearing in the context of the center word . We ll use c o to refer to specific values of the random variables.']",text-embedding-3-small,256,10,4,"
You are an AI teaching Assistant for the SEP 775 course. 
You will provide an interactive platform for students to ask questions and receive guidance on course materials.
Your goal is to answer questions as accurately as possible based on the instructions and context provided.
If you found the answer based on the context provided, you should provide the answer first, then at the end, beginning a new sentence with the words ""Source:"", followed by the name of the lecture, or assignment, or paper if possible.
",0.8935645846756067,1.0,0.9644346981202137,0.0434782608695652
89,How does Word2vec represent word meaning?,"Word2vec represents each word in a fixed vocabulary as a low-dimensional vector, much smaller than the vocabulary size. It learns the value of each word's vector to be predictive based on the distribution of words in a usually short context. The model, specifically the skipgram word2vec algorithm, focuses on learning word vectors that are predictive based on the context in which the words appear. By training the word vectors to predict surrounding words in a sentence, Word2vec captures the distribution of the context in which a word appears, allowing words that frequently appear together to have similar vector representations. This approach helps Word2vec capture semantic relationships between words based on their usage in context.

Source: lecture01_notes_Introduction.txt","['As the word vectors are trained to predict the surrounding words in the sentence the vectors can be seen as representing the distribution of the context in which a word appears. These values are related logarithmically to the probabilities computed by the output layer so the sum of two word vectors is related to the product of the two context distributions. The product works here as the AND function words that are assigned high probabilities by both word vectors will have high probability and the other words will have low probability. Thus if Volga River appears frequently in the same sentence together with the words Russian and river the sum of these two word vectors will result in such a feature vector that is close to the vector of Volga River . 6 Comparison to Published Word Representations Many authors who previously worked on the neural network based representations of words have published their resulting models for further use and comparison amongst the most well known au thors are Collobert and Weston 2 Turian et al. 17 and Mnih and Hinton 10 .', 'However many of the details of word2vec will hold true in methods that we ll proceed to further in the course so we ll focus our time on that. 3.2 Word2vec model and objective The word2vec model represents each word in a fixed vocabulary as a low dimensional much smaller than vocabulary size vector. It learns the value of each word s vector to be predictive via a simple function of the distribution of words in a usually short 2 4 words context. The model we ll describe here is called the skipgram word2vec algo rithm. Skipgram word2vec. As usual we have a finite vocabulary V. Let C O be random variables representing an unknown pair of C V a center word and O V an outside word appearing in the context of the center word . We ll use c o to refer to specific values of the random variables.', 'More recently a square root type transformation in the form of Hellinger PCA HPCA Lebret and Collobert 2014 has been suggested as an effec tive way of learning word representations. Shallow Window Based Methods. Another approach is to learn word representations that aid in making predictions within local context win dows. For example Bengio et al. 2003 intro duced a model that learns word vector representa tions as part of a simple neural network architec ture for language modeling. Collobert and Weston 2008 decoupled the word vector training from the downstream training objectives which paved the way for Collobert et al. 2011 to use the full context of a word for learning the word represen tations rather than just the preceding context as is the case with language models. Recently the importance of the full neural net work structure for learning useful word repre sentations has been called into question.', 'Recently Mikolov et al. 2013c introduced a new evalua tion scheme based on word analogies that probes the ﬁner structure of the word vector space by ex amining not the scalar distance between word vec tors but rather their various dimensions of dif ference. For example the analogy king is to queen as man is to woman should be encoded in the vector space by the vector equation king queen man woman. This evaluation scheme favors models that produce dimensions of mean ing thereby capturing the multi clustering idea of distributed representations Bengio 2009 . The two main model families for learning word vectors are 1 global matrix factorization meth ods such as latent semantic analysis LSA Deer wester et al. 1990 and 2 local context window methods such as the skip gram model of Mikolov et al. 2013c . Currently both families suffer sig niﬁcant drawbacks.']",text-embedding-3-small,256,10,4,"
You are an AI teaching Assistant for the SEP 775 course. 
You will provide an interactive platform for students to ask questions and receive guidance on course materials.
Your goal is to answer questions as accurately as possible based on the instructions and context provided.
If you found the answer based on the context provided, you should provide the answer first, then at the end, beginning a new sentence with the words ""Source:"", followed by the name of the lecture, or assignment, or paper if possible.
",0.9584550878885092,0.8,0.9154487068136772,0.0434782608695652
90,What is the main focus of this lecture on neural networks?,"The main focus of this lecture on neural networks is on introducing single and multilayer neural networks for classification purposes, discussing how they can be trained using backpropagation, explaining the use of the chain rule for parameter updates, providing practical tips and tricks for training neural networks, and motivating the use of recurrent neural networks as a language model.","['This is the prowess of neural networks. Fun Fact Neural networks are biologically in spired classiﬁers which is why they are often called artiﬁcial neural networks to distinguish them from the organic kind. However in reality human neural networks are so much more capable and complex from artiﬁcial neural net works that it is usually better to not draw too many parallels between the two. We established in our previous discussions the need for non linear classiﬁers since most data are not linearly separable and thus our classiﬁcation performance on them is limited. Neural networks are a family of classiﬁers with non linear decision boundary as seen in Figure 1. Now that we know the sort of decision boundaries neural networks create let us see how they manage doing so. 1.1 A Neuron A neuron is a generic computational unit that takes n inputs and produces a single output. What differentiates the outputs of different neurons is their parameters also referred to as their weights .', 'everything doing this everywhere was the key test Now much less needed you can use it to check layers are correctly implemented 78Summary We ve mastered the core technology of neural nets Backpropagation recursively and hence efficiently apply the chain rule along computation graph downstream gradient upstream gradient x local gradient Forward pass compute results of operations and save intermediate values Backward pass apply chain rule to compute gradients 79Why learn all these details about gradients 80 Modern deep learning frameworks compute gradients for you But why take a class on compilers or systems when they are implemented for you Understanding what is going on under the hood is useful Backpropagation doesn t always work perfectly out of the box Understanding why is crucial for debugging and improving models See Karpathy article https medium.com @karpathy yes you should understand backprop e2f06eab496b Example in future lecture exploding and vanishing gradients', 'file name: lecture03 RNNs and LLMs. Hamidreza Mahyar mahyarh@mcmaster.ca Computational Natural Language Processing Language Models and Recurrent Neural NetsLecture Plan 1. A bit more about neural networks Language modeling RNNs 2. A new NLP task Language Modeling 4. Problems with RNNs 5. Recap on RNNs LMs Reminders You should have started working on Assignment 1 2 motivates 3. A new family of neural networks Recurrent Neural Networks RNNs This is the most important concept in the class It leads to GPT 3 and ChatGPT Important and used in Ass1 but not the only way to build LMs0 model power Training error Test error Classic view Regularization works to prevent overfitting when we have a lot of features or later a very powerful deep model etc.', 'file name: lecture02 notes Backpropagation.  Neural networks. Forward computation. Backward propagation. Neuron Units. Max margin Loss. Gradient checks. Xavier parameter initialization. Learning rates. Adagrad. This set of notes introduces single and multilayer neural networks and how they can be used for classiﬁcation purposes. We then dis cuss how they can be trained using a distributed gradient descent technique known as backpropagation. We will see how the chain rule can be used to make parameter updates sequentially. After a rigorous mathematical discussion of neural networks we will discuss some practical tips and tricks in training neural networks involving neuron units non linearities gradient checks Xavier parameter ini tialization learning rates Adagrad etc. Lastly we will motivate the use of recurrent neural networks as a language model. 1 Neural Networks Foundations Figure 1 We see here how a non linear decision boundary separates the data very well. This is the prowess of neural networks.']",text-embedding-3-small,256,10,4,"
You are an AI teaching Assistant for the SEP 775 course. 
You will provide an interactive platform for students to ask questions and receive guidance on course materials.
Your goal is to answer questions as accurately as possible based on the instructions and context provided.
If you found the answer based on the context provided, you should provide the answer first, then at the end, beginning a new sentence with the words ""Source:"", followed by the name of the lecture, or assignment, or paper if possible.
",1.0000000000000002,1.0,0.9175241449286085,0.0357142857142857
91,What are the non-linear functions mentioned for neural networks?,"The non-linear functions mentioned for neural networks are logistic sigmoid, tanh, hard tanh, Swish, Rectified Linear Unit (ReLU), Leaky ReLU, Parametric ReLU, and GELU. These functions are used to introduce non-linearities in neural networks, allowing them to approximate complex functions effectively.

Source: lecture02_Neural_Nets.txt","['Non linearities old and new logistic sigmoid tanh hard tanh 1 0 1 1 Swish arXiv 1710.05941 swish 𝑥 𝑥. logistic 𝑥 Rectified Linear Unit ReLU ReLU 𝑧 max 𝑧 0 Leaky ReLU Parametric ReLU 0 0 0 GELU arXiv 1606.08415 GELU 𝑥 𝑥. 𝑃𝑋 𝑥 𝑋 𝑁 0 1 𝑥. logistic 1.702𝑥Non linearities i.e. f on previous slide Why they re needed Neural networks do function approximation e.g. regression or classification Without non linearities deep neural networks can t do anything more than a linear transform Extra layers could just be compiled down into a single linear transform W1 W2 x Wx But with more layers that include non linearities they can approximate any complex function 5Training with cross entropy loss you use this in', 'This is the prowess of neural networks. Fun Fact Neural networks are biologically in spired classiﬁers which is why they are often called artiﬁcial neural networks to distinguish them from the organic kind. However in reality human neural networks are so much more capable and complex from artiﬁcial neural net works that it is usually better to not draw too many parallels between the two. We established in our previous discussions the need for non linear classiﬁers since most data are not linearly separable and thus our classiﬁcation performance on them is limited. Neural networks are a family of classiﬁers with non linear decision boundary as seen in Figure 1. Now that we know the sort of decision boundaries neural networks create let us see how they manage doing so. 1.1 A Neuron A neuron is a generic computational unit that takes n inputs and produces a single output. What differentiates the outputs of different neurons is their parameters also referred to as their weights .', '3.5 Non linear Classiﬁers Figure 9 Here we see that many exam ples are wrongly classiﬁed even though the best linear decision boundary is chosen. This is due linear decision boundaries have limited model capacity for this dataset. We now introduce the need for non linear classiﬁcation models such as neural networks. We see in Figure 9 that a linear classiﬁer mis classiﬁes many datapoints. Using a non linear decision boundary as shown in Figure 10 we manage to classify all training points accu rately. Although oversimpliﬁed this is a classic case demonstrating the need for non linear decision boundaries. In the next set of notes we study neural networks as a class of non linear models that have performed particularly well in deep learning applications. Figure 10 Here we see that the non linear decision boundary allows for much better classiﬁcation of datapoints.', 'One of the most popular choices for neurons is the sigmoid or binary lo gistic regression unit. This unit takes an n dimensional input vector x and produces the scalar activation output a. This neuron is also associated with an n dimensional weight vector w and a bias scalar b. The output of this neuron is then a 1 1 exp wTx b We can also combine the weights and bias term above to equiva Neuron A neuron is the fundamental building block of neural networks. We will see that a neuron can be one of many functions that allows for non linearities to accrue in the network. lently formulate a 1 1 exp wT b x 1 Figure 2 This image captures how in a sigmoid neuron the input vector x is ﬁrst scaled summed added to a bias unit and then passed to the squashing sigmoid function. This formulation can be visualized in the manner shown in Fig ure 2.']",text-embedding-3-small,256,10,4,"
You are an AI teaching Assistant for the SEP 775 course. 
You will provide an interactive platform for students to ask questions and receive guidance on course materials.
Your goal is to answer questions as accurately as possible based on the instructions and context provided.
If you found the answer based on the context provided, you should provide the answer first, then at the end, beginning a new sentence with the words ""Source:"", followed by the name of the lecture, or assignment, or paper if possible.
",0.990252641413291,0.6,0.959879757978364,0.037037037037037
92,What is the purpose of non-linearities in neural networks?,"The purpose of non-linearities in neural networks is to enable them to approximate any complex function. Without non-linearities, deep neural networks can only perform a linear transform, but with the inclusion of non-linearities in more layers, neural networks can approximate complex functions effectively.","['Non linearities old and new logistic sigmoid tanh hard tanh 1 0 1 1 Swish arXiv 1710.05941 swish 𝑥 𝑥. logistic 𝑥 Rectified Linear Unit ReLU ReLU 𝑧 max 𝑧 0 Leaky ReLU Parametric ReLU 0 0 0 GELU arXiv 1606.08415 GELU 𝑥 𝑥. 𝑃𝑋 𝑥 𝑋 𝑁 0 1 𝑥. logistic 1.702𝑥Non linearities i.e. f on previous slide Why they re needed Neural networks do function approximation e.g. regression or classification Without non linearities deep neural networks can t do anything more than a linear transform Extra layers could just be compiled down into a single linear transform W1 W2 x Wx But with more layers that include non linearities they can approximate any complex function 5Training with cross entropy loss you use this in', 'This is the prowess of neural networks. Fun Fact Neural networks are biologically in spired classiﬁers which is why they are often called artiﬁcial neural networks to distinguish them from the organic kind. However in reality human neural networks are so much more capable and complex from artiﬁcial neural net works that it is usually better to not draw too many parallels between the two. We established in our previous discussions the need for non linear classiﬁers since most data are not linearly separable and thus our classiﬁcation performance on them is limited. Neural networks are a family of classiﬁers with non linear decision boundary as seen in Figure 1. Now that we know the sort of decision boundaries neural networks create let us see how they manage doing so. 1.1 A Neuron A neuron is a generic computational unit that takes n inputs and produces a single output. What differentiates the outputs of different neurons is their parameters also referred to as their weights .', 'Speciﬁcally it introduces a special set of units called LSTM units which are linear and have a recurrent connection to itself which is ﬁxed to 1. The ﬂow of information into the unit and from the unit is guarded by an input and output gates their behaviour is learned . There are several variations of this basic structure. This solution does not address explicitly the exploding gradients problem. Sutskever et al. 2011 use the Hessian Free opti mizer in conjunction with structural damping a spe ciﬁc damping strategy of the Hessian. This approach seems to deal very well with the vanishing gradient though more detailed analysis is still missing. Pre sumably this method works because in high dimen sional spaces there is a high probability for long term components to be orthogonal to short term ones. This would allow the Hessian to rescale these components independently. In practice one can not guarantee that this property holds.', '2 Background A feed forward neural network is a non linear mapping from a input pattern x to an output vector y. Consider the lth hidden layer in a deep feed forward neural network and let al be the vector representation of the summed inputs to the neurons in that layer. The summed inputs are computed through a linear projection with the weight matrix W l and the bottom up inputs hl given as follows al i wl i hl hl 1 i f al i bl i 1 where f is an element wise non linear function and wl i is the incoming weights to the ith hidden units and bl i is the scalar bias parameter. The parameters in the neural network are learnt using gradient based optimization algorithms with the gradients being computed by back propagation. One of the challenges of deep learning is that the gradients with respect to the weights in one layer are highly dependent on the outputs of the neurons in the previous layer especially if these outputs change in a highly correlated way. Batch normalization Ioffe and Szegedy 2015 was proposed to reduce such undesirable covariate shift .']",text-embedding-3-small,256,10,4,"
You are an AI teaching Assistant for the SEP 775 course. 
You will provide an interactive platform for students to ask questions and receive guidance on course materials.
Your goal is to answer questions as accurately as possible based on the instructions and context provided.
If you found the answer based on the context provided, you should provide the answer first, then at the end, beginning a new sentence with the words ""Source:"", followed by the name of the lecture, or assignment, or paper if possible.
",0.999997702681424,1.0,0.9391147376468416,0.037037037037037
93,What is cross entropy loss used for in PyTorch?,"Cross entropy loss is used in PyTorch to minimize the negative log probability of the correct class, which is equivalent to maximizing the probability of the correct class. It involves comparing the true probability distribution (p) with the computed model probability distribution (q) to calculate the cross entropy. This loss function is commonly used in PyTorch for tasks such as classification.","['with cross entropy loss you use this in PyTorch Until now our objective was stated as to maximize the probability of the correct class y or equivalently we can minimize the negative log probability of that class Now restated in terms of cross entropy a concept from information theory Let the true probability distribution be p let our computed model probability be q The cross entropy is Assuming a ground truth or true or gold or target probability distribution that is 1 at the right class and 0 everywhere else p 0 0 1 0 0 then Because of one hot p the only term left is the negative log probability of the true class yi log 𝑝 𝑦i 𝑥i Cross entropy can be used in other ways with a more interesting p but for now just know that you ll want to use it as the loss in PyTorch 6Remember Stochastic Gradient Descent Update equation i.e. for each parameter In deep learning 𝜃includes the data representation e.g.', 'Now we are ready to introduce cross entropy. The cross entropy is useful when cross entropy we don t know the actual probability distribution p that generated some data. It allows us to use some m which is a model of p i.e. an approximation to p . The cross entropy of m on p is deﬁned by H p m lim n 1 n X W L p w1 ... wn logm w1 ... wn 3.50 That is we draw sequences according to the probability distribution p but sum the log of their probabilities according to m. Again following the Shannon McMillan Breiman theorem for a stationary er godic process H p m lim n 1 n logm w1w2 ...wn 3.51 This means that as for entropy we can estimate the cross entropy of a model m on some distribution p by taking a single sequence that is long enough instead of summing over all possible sequences. What makes the cross entropy useful is that the cross entropy H p m is an up per bound on the entropy H p .', 'For any model m H p H p m 3.52 This means that we can use some simpliﬁed model m to help estimate the true en tropy of a sequence of symbols drawn according to probability p. The more accurate m is the closer the cross entropy H p m will be to the true entropy H p . Thus the difference between H p m and H p is a measure of how accurate a model is. Between two models m1 and m2 the more accurate model will be the one with the lower cross entropy. The cross entropy can never be lower than the true entropy so a model cannot err by underestimating the true entropy. We are ﬁnally ready to see the relation between perplexity and cross entropy as we saw it in Eq. 3.51. Cross entropy is deﬁned in the limit as the length of the observed word sequence goes to inﬁnity. We will need an approximation to cross entropy relying on a sufﬁciently long sequence of ﬁxed length.', 'Non linearities old and new logistic sigmoid tanh hard tanh 1 0 1 1 Swish arXiv 1710.05941 swish 𝑥 𝑥. logistic 𝑥 Rectified Linear Unit ReLU ReLU 𝑧 max 𝑧 0 Leaky ReLU Parametric ReLU 0 0 0 GELU arXiv 1606.08415 GELU 𝑥 𝑥. 𝑃𝑋 𝑥 𝑋 𝑁 0 1 𝑥. logistic 1.702𝑥Non linearities i.e. f on previous slide Why they re needed Neural networks do function approximation e.g. regression or classification Without non linearities deep neural networks can t do anything more than a linear transform Extra layers could just be compiled down into a single linear transform W1 W2 x Wx But with more layers that include non linearities they can approximate any complex function 5Training with cross entropy loss you use this in']",text-embedding-3-small,256,10,4,"
You are an AI teaching Assistant for the SEP 775 course. 
You will provide an interactive platform for students to ask questions and receive guidance on course materials.
Your goal is to answer questions as accurately as possible based on the instructions and context provided.
If you found the answer based on the context provided, you should provide the answer first, then at the end, beginning a new sentence with the words ""Source:"", followed by the name of the lecture, or assignment, or paper if possible.
",0.9999999999999988,0.75,0.967789830267552,0.5
94,What is the significance of the backpropagation algorithm?,"The significance of the backpropagation algorithm lies in its ability to efficiently calculate loss gradients for parameters in a neural network by utilizing the chain rule of differentiation. This allows for the optimization of the network's parameters through techniques like gradient descent, ultimately leading to improved performance by enabling the network to learn more meaningful information from the data, reduce overfitting, and achieve higher overall task performance. Additionally, backpropagation facilitates error propagation through the network, enabling adjustments to be made based on the calculated gradients, which is crucial for training deep learning models effectively.

Source: Lecture02_Notes_Backpropagation","['The result is that the network typically learns more meaningful informa tion from the data is less likely to overﬁt and usually obtains higher performance overall on the task at hand. One intuitive reason why this technique should be so effective is that what dropout is doing is essentially doing is training exponentially many smaller networks at once and averaging over their predictions. Dropout applied to an artiﬁcial neural network. Image credits to Srivastava et al. In practice the way we introduce dropout is that we take the out put h of each layer of neurons and keep each neuron with prob ability p and else set it to 0. Then during back propagation we only pass gradients through neurons that were kept alive during the forward pass. Finally during testing we compute the forward pass using all of the neurons in the network.', 'No parameter updates are necessary if the cost is 0. Since we typically update parameters using gradient descent or a variant such as SGD we typically need the gradient information for any parameter as required in the update equation θ t 1 θ t α θ t J Backpropagation is technique that allows us to use the chain rule of differentiation to calculate loss gradients for any parameter used in the feed forward computation on the model. To understand this further let us understand the toy network shown in Figure 5 for which we will perform backpropagation. Figure 5 This is a 4 2 1 neural network where neuron j on layer k receives input z k j and produces activation output a k j . Here we use a neural network with a single hidden layer and a single unit output. Let us establish some notation that will make it easier to generalize this model later xi is an input to the neural network. s is the output of the neural network. Each layer including the input and output layers has neurons which receive an input and produce an output.', 'The intuition is that to get a better approximation of the derivative slope around a point we need to examine the func tion f s behavior both to the left and right of that point. It can also be shown using Taylor s theorem that the centered difference formula has an error proportional to ϵ2 which is quite small whereas the derivative deﬁnition is more error prone. Now a natural question you might ask is if this method is so pre cise why do we not use it to compute all of our network gradients instead of applying back propagation The simple answer as hinted earlier is inefﬁciency recall that every time we want to compute the gradient with respect to an element we need to make two forward passes through the network which will be computationally expen sive. Furthermore many large scale neural networks can contain millions of parameters and computing two passes per parameter is clearly not optimal. And since in optimization techniques such as SGD we must compute the gradients once per iteration for several thousands of iterations it is obvious that this method quickly grows intractable.', 'essentially the error propagating backwards from the i th neu ron in layer 2. a 1 j is an input fed to i th neuron in layer 2 when scaled by Wij. Figure 6 This subnetwork shows the relevant parts of the network required to update W 1 ij Let us discuss the error sharing distribution interpretation of backpropagation better using Figure 6 as an example. Say we were to update W 1 14 1. We start with the an error signal of 1 propagating backwards from a 3 1 . 2. We then multiply this error by the local gradient of the neuron which maps z 3 1 to a 3 1 . This happens to be 1 in this case and thus the error is still 1. This is now known as δ 3 1 1. 3. At this point the error signal of 1 has reached z 3 1 .']",text-embedding-3-small,256,10,4,"
You are an AI teaching Assistant for the SEP 775 course. 
You will provide an interactive platform for students to ask questions and receive guidance on course materials.
Your goal is to answer questions as accurately as possible based on the instructions and context provided.
If you found the answer based on the context provided, you should provide the answer first, then at the end, beginning a new sentence with the words ""Source:"", followed by the name of the lecture, or assignment, or paper if possible.
",1.000000000000001,1.0,0.9409748510212887,0.0344827586206896
95,What does the Jacobian matrix represent in the context of neural networks?,"The Jacobian matrix in the context of neural networks represents a matrix of partial derivatives, where it is an m x n matrix of partial derivatives for a function with m outputs and n inputs. It generalizes the concept of the gradient for functions with multiple inputs and outputs, providing information about how each output changes with respect to each input. It is crucial for understanding the sensitivity of the network's output to changes in its parameters or inputs. 

Source: Lecture02_Neural_Nets","['So its Jacobian will be n m. Note that zi m X k 1 Wikxk So an entry z x ij of the Jacobian will be z x ij zi xj xj m X k 1 Wikxk m X k 1 Wik xj xk Wij because xj xk 1 if k j and 0 if otherwise. So we see that z x W 2 Row vector times matrix with respect to the row vector z xW what is z x A computation similar to 1 shows that z x W T . 3 A vector with itself z x what is z x We have zi xi. So z x ij zi xj xj xi 1 if i j 0 if otherwise So we see that the Jacobian z x is a diagonal matrix where the entry at i i is 1. This is just the identity matrix z x I . When applying the chain 2rule this term will disappear because a matrix or vector multiplied by the identity matrix does not change.', '21Other Jacobians Compute these at home for practice 22Back to our Neural Net x xmuseums xin xParis xare xamazing 23Back to our Neural Net Let s find Really we care about the gradient of the loss Jt but we will compute the gradient of the score for simplicity x xmuseums xin xParis xare xamazing 241. Break up equations into simple pieces Carefully define your variables and keep track of their dimensionality 252. Apply the chain rule 262. Apply the chain rule 272. Apply the chain rule 282. Apply the chain rule 293. Write out the Jacobians Useful Jacobians from previous slide 303. Write out the Jacobians 𝒖𝑇 Useful Jacobians from previous slide 313. Write out the Jacobians 𝒖𝑇 Useful Jacobians from previous slide 323. Write out the Jacobians 𝒖𝑇 Useful Jacobians from previous slide 333.', '013 64.48Gradients Given a function with 1 output and n inputs Its gradient is a vector of partial derivatives with respect to each input 11Jacobian Matrix Generalization of the Gradient Given a function with m outputs and n inputs It s Jacobian is an m x n matrix of partial derivatives 12Chain Rule For composition of one variable functions multiply derivatives For multiple variables functions multiply Jacobians 13Example Jacobian Elementwise activation Function 14Example Jacobian Elementwise activation Function Function has n outputs and n inputs n by n Jacobian 15Example Jacobian Elementwise activation Function 16Example Jacobian Elementwise activation Function 17Example Jacobian Elementwise activation Function 18Other Jacobians Compute these at home for practice Check your answers with the lecture notes 19Other Jacobians Compute these at home for practice Check your answers with the lecture notes 20Other Jacobians Compute these at home for practice Check your answers with the lecture notes Fine print This is the correct Jacobian. Later we discuss the shape convention using it the answer would be h.', 'Write out the Jacobians 𝒖𝑇 𝒖𝑇 Useful Jacobians from previous slide . 34 Hadamard product element wise multiplication of 2 vectors to give vectorRe using Computation Suppose we now want to compute Using the chain rule again 35Re using Computation Suppose we now want to compute Using the chain rule again The same Let s avoid duplicated computation 36Re using Computation Suppose we now want to compute Using the chain rule again 𝛿is the upstream gradient error signal 37 𝒖𝑇Derivative with respect to Matrix Output shape What does look like 1 output nm inputs 1 by nm Jacobian Inconvenient to then do 38Derivative with respect to Matrix Output shape What does look like 1 output nm inputs 1 by nm Jacobian Inconvenient to then do Instead we leave pure math and use the shape convention the shape of the gradient is the shape of the parameters So is n by m 39Derivative with respect to Matrix What is is going to be in our answer The other term should']",text-embedding-3-small,256,10,4,"
You are an AI teaching Assistant for the SEP 775 course. 
You will provide an interactive platform for students to ask questions and receive guidance on course materials.
Your goal is to answer questions as accurately as possible based on the instructions and context provided.
If you found the answer based on the context provided, you should provide the answer first, then at the end, beginning a new sentence with the words ""Source:"", followed by the name of the lecture, or assignment, or paper if possible.
",0.9999999999999988,1.0,0.937541251674308,0.0476190476190476
96,How is the derivative with respect to a matrix described?,The derivative with respect to a matrix is described using the Jacobian matrix. The Jacobian matrix is useful because we can apply the chain rule to a vector-valued function by multiplying Jacobians. It helps in computing the gradients efficiently for matrix operations.,"['. f1 xn . . . ... . . . fm x1 . . . fm xn That is f x ij fi xj which is just a standard non vector derivative . The Jacobian matrix will be useful for us because we can apply the chain rule to a vector valued function just by multiplying Jacobians. As a little illustration of this suppose we have a function f x f1 x f2 x taking a scalar to a vector of size 2 and a function g y g1 y1 y2 g2 y1 y2 taking a vector of size two to a vector of size two. Now let s compose them to get g x g1 f1 x f2 x g2 f1 x f2 x .', '4 An elementwise function applied a vector z f x what is z x Since f is being applied elementwise we have zi f xi . So z x ij zi xj xj f xi f xi if i j 0 if otherwise So we see that the Jacobian z x is a diagonal matrix where the entry at i i is the derivative of f applied to xi. We can write this as z x diag f x . Since multiplication by a diagonal matrix is the same as doing elementwise multiplication by the diagonal we could also write f x when applying the chain rule. 5 Matrix times column vector with respect to the matrix z W x δ J z what is J W J z z W δ z W This is a bit more complicated than the other identities. The reason for in cluding J z in the above problem formulation will become clear in a moment.', 'First suppose we have a loss function J a scalar and are computing its gradient with respect to a matrix W Rn m. Then we could think of J as a function of W taking nm inputs the entries of W to a single output J . This means the Jacobian J W would be a 1 nm vector. But in practice this is not a very useful way of arranging the gradient. It would be much nicer if the derivatives were in a n m matrix like this J W J W11 . . . J W1m . . . ... . . . J Wn1 . . . J Wnm Since this matrix has the same shape as W we could just subtract it times the learning rate from W when doing gradient descent. So in a slight abuse of notation let s ﬁnd this matrix as J W instead. This way of arranging the gradients becomes complicated when computing z W . Unlike J z is a vector.', 'Using the regular chain rule we can compute the derivative of g as the Jacobian g x xg1 f1 x f2 x xg2 f1 x f2 x g1 f1 f1 x g1 f2 f2 x g2 f1 f1 x g2 f2 f2 x 1And we see this is the same as multiplying the two Jacobians g x g f f x g1 f1 g1 f2 g2 f1 g2 f2 f1 x f2 x 3 Useful Identities This section will now go over how to compute the Jacobian for several simple functions. It will provide some useful identities you can apply when taking neu ral network gradients. 1 Matrix times column vector with respect to the column vector z W x what is z x Suppose W Rn m. Then we can think of z as a function of x taking an m dimensional vector to an n dimensional vector.']",text-embedding-3-small,256,10,4,"
You are an AI teaching Assistant for the SEP 775 course. 
You will provide an interactive platform for students to ask questions and receive guidance on course materials.
Your goal is to answer questions as accurately as possible based on the instructions and context provided.
If you found the answer based on the context provided, you should provide the answer first, then at the end, beginning a new sentence with the words ""Source:"", followed by the name of the lecture, or assignment, or paper if possible.
",0.8877782074100343,1.0,0.8892445262902104,0.0434782608695652
97,What role does automatic differentiation play in modern deep learning frameworks?,"Automatic differentiation plays a crucial role in modern deep learning frameworks as it allows for efficient computation of gradients for training neural networks. By automatically computing the derivatives of the loss function with respect to the model parameters, automatic differentiation simplifies the process of optimizing neural networks through techniques like backpropagation. This capability is essential for training complex deep learning models with numerous layers and parameters effectively.

Source: lecture02_Neural_Nets.txt","['Non differentiable points arise because we use a hard transfer function 5 and because we use a max layer 7 in the sentence approach network. Fortunately stochastic gradient still converges to a meaningful local minimum despite such minor differentiability problems Bottou 1991 1998 . Stochastic gradient iterations that hit a non differentiability are simply skipped. Remark 6 Modular Approach The well known back propagation algorithm LeCun 1985 Rumelhart et al. 1986 computes gradients using the chain rule. The chain rule can also be used in a modular implementation.11 Our modules correspond to the boxes in Figure 1 and Figure 2. Given derivatives with respect to its outputs each module can independently compute derivatives with respect to its inputs and with respect to its trainable parameters as proposed by Bottou and Gallinari 1991 . This allows us to easily build variants of our networks. For details about gradient computations see Appendix A. Remark 7 Tricks Many tricks have been reported for training neural networks LeCun et al.', 'everything doing this everywhere was the key test Now much less needed you can use it to check layers are correctly implemented 78Summary We ve mastered the core technology of neural nets Backpropagation recursively and hence efficiently apply the chain rule along computation graph downstream gradient upstream gradient x local gradient Forward pass compute results of operations and save intermediate values Backward pass apply chain rule to compute gradients 79Why learn all these details about gradients 80 Modern deep learning frameworks compute gradients for you But why take a class on compilers or systems when they are implemented for you Understanding what is going on under the hood is useful Backpropagation doesn t always work perfectly out of the box Understanding why is crucial for debugging and improving models See Karpathy article https medium.com @karpathy yes you should understand backprop e2f06eab496b Example in future lecture exploding and vanishing gradients', '2507COLLOBERT WESTON BOTTOU KARLEN KAVUKCUOGLU AND KUKSA 3.4.3 STOCHASTIC GRADIENT Maximizing 8 with stochastic gradient Bottou 1991 is achieved by iteratively selecting a random example x y and making a gradient step θ θ λ log p y x θ θ 16 where λ is a chosen learning rate. Our neural networks described in Figure 1 and Figure 2 are a succession of layers that correspond to successive composition of functions. The neural network is ﬁnally composed with the word level log likelihood 11 or successively composed in the re cursion 14 if using the sentence level log likelihood 13 . Thus an analytical formulation of the derivative 16 can be computed by applying the differentiation chain rule through the network and through the word level log likelihood 11 or through the recurrence 14 . Remark 5 Differentiability Our cost functions are differentiable almost everywhere.', 'Another approach is to allow the learning rate to decrease over time such that α t α0τ max t τ In the above scheme α0 is a tunable parameter and represents the starting learning rate. τ is also a tunable parameter and represents the time at which the learning rate should start reducing. In practice this method has been found to work quite well. In the next section we discuss another method for adaptive gradient descent which does not require hand set learning rates. 2.8 Momentum Updates Momentum methods a variant of gradient descent inspired by the study of dynamics and motion in physics attempt to use the veloc ity of updates as a more effective update scheme. Pseudocode for momentum updates is shown below Snippet 2.2 Computes a standard momentum update on parameters x v mu v alpha grad_x x v 2.9 Adaptive Optimization Methods AdaGrad is an implementation of standard stochastic gradient de scent SGD with one key difference the learning rate can vary for each parameter.']",text-embedding-3-small,256,10,4,"
You are an AI teaching Assistant for the SEP 775 course. 
You will provide an interactive platform for students to ask questions and receive guidance on course materials.
Your goal is to answer questions as accurately as possible based on the instructions and context provided.
If you found the answer based on the context provided, you should provide the answer first, then at the end, beginning a new sentence with the words ""Source:"", followed by the name of the lecture, or assignment, or paper if possible.
",1.0000000000000002,0.5,0.9114183586390944,0.0
98,What is the purpose of manual gradient checking?,"The purpose of manual gradient checking is to verify the correctness of analytic gradients by comparing them with numerical gradients, which are much quicker to compute. This helps ensure that the gradients calculated by the model are accurate and can help in debugging the implementation of gradient calculations.","['This inefﬁciency is why we only use gradient check to verify the correctness of our analytic gradients which are much quicker to compute. A standard implementation of gradient check is shown below Snippet 2.1 def eval_numerical_gradient f x a naive implementation of numerical gradient of f at x f should be a function that takes a single argument x is the point numpy array to evaluate the gradient at fx f x evaluate function value at original point grad np.zeros x.shape h 0.00001 iterate over all indexes in x it np.nditer x flags multi_index op_flags readwrite while not it.finished evaluate function at x h ix it.multi_index old_value x ix x ix old_value h increment by h fxh_left f x evaluate f x h x ix old_value h decrement by h fxh_right f x evaluate f x h x ix old_value restore to previous value very important compute the partial derivative grad ix fxh_left fxh_right 2 h the slope it.iternext step to next dimension return grad 2.', 'We can compute them as follows δ1 J θ ˆ y y T this is just identity 7 δ2 J z J θ θ h h z using the chain rule δ1 θ h h z substituting in δ1 δ1 U h z using identity 1 δ1 U ReLU z using identity 4 δ1 U sgn h we computed this earlier A good way of checking our work is by looking at the dimensions of the Jaco bians J z δ1 U sgn h 1 Dh 1 Nc Nc Dh Dh 6We see that the dimensions of all the terms in the gradient match up i.e. the number of columns in a term equals the number of rows in the next term . This will always be the case if we computed our gradients correctly. Now we can use the error terms to compute our gradients. Note that we trans pose out answers when computing the gradients for column vectors terms to follow the shape convention.', 'Briefly the gradient think derivative U f of a scalar function f with respect to a parameter matrix U represents the direction to locally move U in in order to maximally increase the value of f. So in practice we do something like drawing the initial U 0 and V 0 randomly as U V N 0 0.001 V d matrices of independent draws from a zero centered normal distribution with small variance and then perform some number of iterations of the following process U i 1 U i α UL U i V i . 7 This should be read as setting the value of U at iteration i 1 as the value of U at the previous iteration plus a small α small step in the direction that locally best improves U with respect to the objective L U V we specified in Eqn 6. Stochastic gradients. There s a crucial detail remaining here beyond how to compute the gradient function U which we ll discuss later computing L U V is exceptionally expensive as it walks over the entire dataset.', 'Some examples if you want practice dot product of two vectors elementwise product of two vectors 2 norm of a vector. Feel free to use these identities in the assignments. One option is just to memorize them. Another option is to ﬁgure them out by looking at the dimensions. For example only one ordering orientation of δ and x will produce the correct shape for J W assuming W is not square . 4 Gradient Layout Jacobean formulation is great for applying the chain rule you just have to mul tiply the Jacobians. However when doing SGD it s more convenient to follow the convention the shape of the gradient equals the shape of the parameter as we did when computing J W . That way subtracting the gradient times the learning rate from the parameters is easy. We expect answers to homework questions to follow this convention. Therefore if you compute the gradient of a column vector using Jacobian formulation you should take the transpose when reporting your ﬁnal answer so the gradient is a column vector. Another option is to always follow the convention.']",text-embedding-3-small,256,10,4,"
You are an AI teaching Assistant for the SEP 775 course. 
You will provide an interactive platform for students to ask questions and receive guidance on course materials.
Your goal is to answer questions as accurately as possible based on the instructions and context provided.
